video_id,title,publishedAt,channelId,channelTitle,categoryId,trending_date,tags,view_count,likes,dislikes,comment_count,thumbnail_link,comments_disabled,ratings_disabled,description
"p_VssaTwwLY","Harry Styles Audition: EXTENDED CUT | The X Factor UK","2022-07-30T15:00:36Z","UCEY1ejsweY4DgMwOVJeEaBA","The X Factor UK","24","22.01.08","the x factor|X Factor UK|xfactor|x-factor|Simon Cowell|X Factor Final|Nicole Scherzinger|the x factor auditions|X Factor 2020|X Factor 2021|x factor auditions|Sharon Osborne|louis walsh|dermot O'leary|the x factor final|performance|x factor live shows|best of x factor|best of|uk singers|amazing singers|uk talent show|Hey Soul Sister|Train|Harry Styles|One Direction|1D|Unseen|extended|never seen before","771489","0","0","1644","https://i.ytimg.com/vi/p_VssaTwwLY/default.jpg","False","True","Meet Harry Styles again for the very first time, but with EXTRA footage that's never been aired before!Featuring an unseen performance of Train's 'Hey, Soul Sister'. SUBSCRIBE: http://bit.ly/TXFSubFacebook: http://bit.ly/TXFFBTwitter: http://bit.ly/TXFTwiInstagram: https://bit.ly/3QAQxhe"
"4P6l35M61GY","Note Block Universe - Animation vs. Minecraft Shorts Ep 29","2022-07-30T12:00:11Z","UCbKWv2x9t6u8yZoB3KcPtnw","Alan Becker","1","22.01.08","animation vs minecraft|alan becker|minecraft animation stickman|minecraft animation|stick figure|stick fight|roller coaster|stickman animation|minecraft animations|note blocks|stick iq|avm shorts|animator vs animation|minecraft vs animation|alan becker minecraft|jaiden animations|minecraft story mode|family friendly","5223121","0","0","32164","https://i.ytimg.com/vi/4P6l35M61GY/default.jpg","False","True","Green has to use music to ask where Purple went.🖐 ASK ME ANYTHING! https://www.youtube.com/noogai89/join👕 MERCH! https://store.alanbecker.store💬DISCORD SERVER ► https://discord.gg/alanbecker 🕹️ANIMATORS VS GAMES ► https://www.youtube.com/AnimatorsVSGames📷INSTAGRAM ► http://www.instagram.com/alanbecker ✏️TWITTER ► http://twitter.com/alanthebeckerAnimated by Terkoiz, Fordz, Ellis02, Shuriken255, AJAnims, Able Rai, Simple Fox, SmoilySheep, Oxob3000, Hexal, Nemo, KayalMusic by Aaron Grooves (first half), and Scott Buckley (second half)Sound Design by Pepper, Alexandr Samarov, EgorBackgrounds by TheKaemble, Avenoire, Brian Nguyen"
"ZF-w__uUs8c","Race Highlights | 2022 Hungarian Grand Prix","2022-07-31T16:10:28Z","UCB_qr75-ydFVKSF9Dmo6izg","FORMULA 1","17","22.01.08","F1|Formula One|Formula 1|Sports|Sport|Action|GP|Grand Prix|Auto Racing|Motor Racing","4400952","0","0","7163","https://i.ytimg.com/vi/ZF-w__uUs8c/default.jpg","False","True","Watch all the best moments from an absorbing race at the Hungaroring.For more F1® videos, visit https://www.Formula1.comFollow F1®:https://www.instagram.com/F1https://www.facebook.com/Formula1/https://www.twitter.com/F1https://www.twitch.tv/formula1https://www.tiktok.com/@f1#F1 #HungarianGP"
"ddLF9_Qmr3g","Extending My Family's VISA in the PHILIPPINES!! 🇵🇭 (Staying For GOOD?!) 😍","2022-07-31T10:06:11Z","UCrPo31V8wpuuCMseyzEDZMQ","The Hungry Syrian Wanderer","22","22.01.08","hungry syrian wanderer dad|the hungry syrian wanderer father|the hungry syrian wanderer family|the hungry syrian wanderer meeting his family|hungry syrian life story|meeting my father after 10 years|meeting with my family after long time|emotional father and son meeting after 10 years|family reunite after many years|meeting my family after many years|missing family reunite|reunion after many years|foreigner visa extension philippines|tourist visa philippines 2022","537609","0","0","1679","https://i.ytimg.com/vi/ddLF9_Qmr3g/default.jpg","False","True","🇵🇭 My family decided to stay longer in the Philippines. 😍 More adventures together mga tao. Stay blessed. 🙏Meeting my Dad after 10 long years: https://youtu.be/929ufmSignwMeeting My sister & Family: https://youtu.be/Pn2rq2Tn-PI#WelcomeToThePhilippines #FamilyReunite #GoodMorningMgaTaoTo avail our merch, order online via shopee:BLACK SHIRT:https://shopee.ph/(BLACK)-THE-HUNGRY-SYRIAN-WANDERER-T-SHIRT-MERCH-i.405820137.6997199574?position=5WHITE SHIRT:https://shopee.ph/(WHITE)-THE-HUNGRY-SYRIAN-WANDERER-T-SHIRT-MERCH-i.405820137.9588958798?position=0Paypal: https://www.paypal.me/hungrysyrianBusiness inquiry: thehungrysyrian@gmail.comPlease like and follow our Business Page: https://www.facebook.com/YOLO.RetroPH/To shop retail ONLINE, shipping nationwide COD SHOPEE link: shopee.ph/yeoboseyokoreanmartphhttps://web.facebook.com/yeoboseyokoreanmartSupport & Visit our shops mga tao 🔔YOLO Retro Diner Bf Resort Las Piñas🔔 YEOBOSEYO Korean Mart Bacoor - Marcos Alvarez - Naga Road Pulang Lupa - URCI 🔔 AllMeat Meatshop Las Piñas🔔 AllMart Bacoor"
"W1Q5zEWTwmM","48H POUR RÉNOVER MON APPARTEMENT | DENYZEE","2022-07-31T08:30:09Z","UClOeGHFiUlegRJFGhkMxoHg","DENYZEE","23","22.01.08","denyzee|denize|denyze|denizee|humour|vidéo drôle|24h|24h challenge|défi|défi 24h|deneezee|denzee|denezy|deneeze|denezee|denysee|rénovation maison|rénovation|rénovation de maison|rénovation appartement|rénovation salle de bain|rénover une maison|rénovation appartement paris|rénovation cuisine|décoration chambre|décoration salon|décoration appartement|mon appartement|mon appartement à paris|mon appartement a montreal|mon appartement tour|denyzee maison","132513","0","0","622","https://i.ytimg.com/vi/W1Q5zEWTwmM/default.jpg","False","True","48h top chrono pour rénover entièrement mon appartement et changer sa décoration!  👉🏼 Pour commander vos Displate dès maintenant: https://displate.com/promo/denyzee/?art=5fa27d0d7a1c3, vous obtenez en cliquant sur le lien 25% off pour 1 ou 2 displate et 29% off pour 3 ou + 💜C'est un challenge de décoration avec un petit budget que je réalise dans cet épisode de construction.➡️  Rejoins la famille en t'abonnant à ma chaîne: http://bit.ly/2gcKjr9 Ouesh.✌️➡️  Rejoins-moi sur mon Instagram: http://bit.ly/2LYxPy8Pour rénover mon appartement, je suis allée prospecter dans plusieurs magasins tel que LeRoy Merlin, Castorama et aussi Monsieur Bricolage. Dans l'immobilier, il faut privilégier le côté pratique sans oublier le côté esthétique. Actuellement chez moi, c'est l'entrepôt du bricoleur, il y a beaucoup de choses ! Je garde pas mal de chose de mon enfance, sauf mes Barbies, elles sont toutes parties à la poubelle!➡️  Ma marque de vêtement: https://electricsugar.co/Je vais rénover toutes les pièces de mon appartement au Canada, de l'entrée au salon à ma chambre et mon studio de tournage.La plupart de mon mobilier vient de chez Ikea et j'ai fais beaucoup de DIY également.Je vais tenter de bricoler pour que je puisse me sentir à l'aise dans mon appartement et l'appeler enfin mon chez moi. J'adore rénover en général, en fait, j'adore l'immobilier et l'idée d'aider les gens à trouver la maison de leur rêve est géniale, je trouve! Se loger de nos jours ce n'est pas si facile en France, quelques fois, il est plus facile de louer que d'acheter. Les banques comme le Bnp Paribas ou la Banque Populaire sont des banques qui peuvent aider à l'achat d'un bien immobilier par exemple.Et je commence à m'intéresser à investir dans l'immobilier pour en faire des immeubles a logement locatif ou encore les transformer en Airbnb, j'adorerai faire vivre des expériences à autrui.Déménager et changer de logement, c'est comme un nouveau départ. Sur le site web Leboncoin ou Facebook Market, vous pouvez trouver pas mal de logements à louer ou à acheter entre particuliers si vous ne souhaitez pas passer par des agences comme Century21. Pour ma part mon style de déco change, j'ai besoin de me renouveler. C'est comme la mode, un coup, on s'habille chez Zara, H&M et quand on peut pourquoi pas la haute couture comme Gucci ou Chanel? Le but de cette vidéo n'est pas de passer dans le magasine Grazia ou Vogue plutôt de concurrencer Valérie Damidot.Grâce à mon iPhone 13 d’Apple, j'ai pu me filmer pendant plusieurs heures en train de rénover mon appartement et on me suivra avec la caméra Lumix Panasonic GH5 (pas encore la GH6) pour prendre les vidéos et photos clés de cette expérience. C'est une expérience unique de ma vie quotidienne que j'ai envie de vivre avec vous !   Ensemble, on va re-découvrir mon appartement et pourquoi pas refaire un room-tour à la fin pour faire tout découvrir d'un seul coup. J'ai hâte d'avoir vos avis sur les réseaux et lire vos commentaires sur YouTube.-------➡️  Si tu as lu jusqu'ici, écris LE LAMA S'APPELLE.... en commentaires.-------DENYZEE, c'est une chaîne Youtube humour, des sketchs comiques de divertissement qui propose des défis/challenge et expériences sociales.J’imite bien l’accent québécois aussi.-------Rejoins-moi sur:Facebook: http://bit.ly/denyzeefacebookInstagram : https://www.instagram.com/denyzee_Twitter : https://twitter.com/denyzee_TikTok : https://bit.ly/TikTokDenyzee"
"NlWEZKrcwMo","Skeng - Gvnman Session (Official Music Video)","2022-07-30T23:33:54Z","UCI8XzkDP8ZrWUxEMfTe-SWQ","Skeng","10","22.01.08","[none]","680723","0","0","4211","https://i.ytimg.com/vi/NlWEZKrcwMo/default.jpg","False","True","Skeng - Gvnman Session Produced By: John Coop Records X DiTruth Records Beat Composed By: Shacko X Coop#coop #ditruth #rg"
"w1csR1MHTbM","HIGHLIGHTS | Real Madrid 2-0 Juventus  | Los Angeles","2022-07-31T05:16:20Z","UCWV3obpZVGgJ3j9FVhEjF2Q","Real Madrid","17","22.01.08","Real Madrid|Madrid|Real Madrid CF|Madridistas|Santiago Bernabéu|Bernabéu|Hala Madrid|Carlo Ancelotti|レアル・マドリード|ريال مدريد|레알 마드리드","1587769","0","0","0","https://i.ytimg.com/vi/w1csR1MHTbM/default.jpg","False","True","Inside two minutes of kick-off, Real Madrid came close to going ahead with the first move of the game when Kroos’ deep pass found Valverde, who whipped in a cross from the right-hand side for Benzema to turn into the net, only for the linesman to rule it out for off-side. Karim Benzema then stepped up to tuck home a penalty and make it 1-0, who was later followed by Marco Asensio in the second half after a magnificent team play led by Eden Hazard. Carlo Ancelotti’s team showed superb skill and teamwork in order to secure a victory in their final match.🎥  SUBSCRIBE YOUTUBE: https://www.youtube.com/subscription_center?add_user=realmadridcf📱 FOLLOW US INSTAGRAM: https://instagram.com/realmadridTIKTOK: https://www.tiktok.com/@realmadridTWITTER: https://twitter.com/realmadridTWITCH: https://www.twitch.tv/realmadridSNAPCHAT: https://snapchat.com/add/realmadridFACEBOOK: https://facebook.com/realmadrid💳 BECOME A MADRIDISTA: https://www.realmadrid.com/en/fans/madridistas/international🙌 JOIN THE MADRIDISTA NATION: https://www.facebook.com/becomesupporter/RealMadrid/?entrypoint_surface=youtube"
"G1vtJsi8KY8","Garcia vs Benavidez HIGHLIGHTS: July 30, 2022 | PBC on Showtime","2022-07-31T08:10:33Z","UCWXYAGB9SadlL6p5Bb66wWw","Premier Boxing Champions","17","22.01.08","Boxing|PBC|premier boxing champions|ko|tko|knockouts|fighter|boxer|mayweather|al haymon|showtime boxing|wilder|thurman|spence|porter|broner|fighting|best of|highlights|wbo|wba|wbc|ibo|ibf|boxing highlights|jose benavidez|danny garcia|danny garcia highlights|garcia benavodez|jose benavidez jr.|danny garcia vs jose benavidez jr|danny garcia vs benavidez|Danny Garcia vs Jose Benavidez|garcia vs benavidez|jose benavidez highlights|garcia vs benavidez highlights","459273","0","0","923","https://i.ytimg.com/vi/G1vtJsi8KY8/default.jpg","False","True","Two-division world champion Danny “Swift Garcia dominated in his super welterweight debut Saturday night, cruising to a majority decision victory over exciting contender Jose Benavidez Jr. in the SHOWTIME main event from Barclays Center in Brooklyn headlining a Premier Boxing Champions event. He saved perhaps his most expressive moment post-fight when he broke down in the ring discussing his struggles with mental health with SHOWTIME reporter Jim Gray, showing the authenticity that has made him such a fan-favorite in Brooklyn.  “I did take a break going through mental things, things went dark, I went through anxiety, deep depression, just trying to be strong,” said a visibly emotional Garcia. “It was the pressure of life, being a good dad, just letting it out right now, because it was all stuck inside. It rained on me for a year and a half and the only way to do better was to fight again. I’m a fighter. If you battle anxiety and depression, you can get out of it, that’s what I did today. I fought.” Philadelphia’s Garcia (37-3, 21 KOs) has become a staple at Barclays Center ever since headlining the arena’s first boxing event in 2012, and his return on Saturday night against Benavidez (27-2-1, 18 KOs), saw him pick up his seventh victory in Brooklyn.#DannyGarcia #JoseBenavidez #GarciaBenavidezVisit PremierBoxingChampions.com for more info.SIGN UP FOR FIGHT ALERTS: https://pbcham.ps/FightAlertsFOLLOW US:https://twitter.com/premierboxinghttps://instagram.com/premierboxinghttps://www.facebook.com/premierboxingchampions"
"1U-Phc7HZ9c","Mane off the mark | RB Leipzig - FC Bayern München 3-5 | Highlights | DFL-Supercup 2022","2022-07-30T21:34:03Z","UC6UL29enLNe4mqwTfAyeNuw","Bundesliga","17","22.01.08","Bundesliga|Bundesliga 2022/23|Bundesliga Highlights|Football Highlights|season 2022/23|Highlights|RB Leipzig|Leipzig|RBL|FC Bayern München|Bayern|Bayern Munich|Leipzig Bayern|Leipzig Bayern highlights|DFL-Supercup 2022","1064098","0","0","751","https://i.ytimg.com/vi/1U-Phc7HZ9c/default.jpg","False","True","#RBLFCB | DFL-Supercup 2022 highlights!► Sub now: https://redirect.bundesliga.com/_bwCS Watch the DFL-Supercup 2022 highlights between RB Leipzig and FC Bayern München of 2022/23 season!Goals: 0-1 Musiala (14'), 0-2 Mane (31'), 0-3 Pavard (45'), 1-3 Halstenberg (59'), 1-4 Gnabry (66'), 2-4 Nkunku (77'), 3-4 Olmo (89'), 3-5 Sane (90')► Watch Bundesliga in your country: https://redirect.bundesliga.com/All_Broadcaster► Join the conversation in the Bundesliga Community Tab:https://www.youtube.com/bundesliga/communityWe’ve seen another Matchday full of unmissable Bundesliga drama. Don’t miss any highlights from Germany’s football league! The Official Bundesliga YouTube channel gives you access to videos about the greatest goals, best moments and anything else you should know about. Make sure to subscribe now and visit us at https://bndsl.ga/comYT to find out more about the fixtures, analysis and news about your favourite team!"
"jXrxDKwlA_s","It's been a minute...","2022-07-29T14:00:29Z","UCKuHFYu3smtrl2AwwMOXOlg","Will Smith","24","22.01.08","[none]","3131707","0","0","24154","https://i.ytimg.com/vi/jXrxDKwlA_s/default.jpg","False","True","Thanx y’all"
"Ud8KRhkAXFo","How I Got the Most Expensive Pet in Minecraft...","2022-07-30T15:30:10Z","UC_3rZIKC-FvhYwM76LGDp7Q","RageTrain","20","22.01.08","Ragetrain|Ragetrain Minecraft|Rage Train Minecraft|RageTrain hypixel|RageTrain Hypixel Skyblock|Minecraft|rage train|most expensive pet|minecraft pet|most expensive minecraft pet|most expensive pet in minecraft","322452","0","0","1082","https://i.ytimg.com/vi/Ud8KRhkAXFo/default.jpg","False","True","How I Got the Most Expensive Pet in Minecraft...Install Raid for Free ✅ IOS/ANDROID/PC: https://clcr.me/9K5jwi and get a special starter pack 💥 Available only for the next 30 daysDiscord ➤ https://discord.gg/ragetrainUse code RageTrain at the Hypixel Store's Support a Creator checkout box to help support the channel!➤ https://store.hypixel.net/Twitch ➤ https://www.twitch.tv/ragetrainPrevious episode ➤ https://youtu.be/a-TpBfIjdrYEdited By ➤  MeIn this video I recap my journey of buying and maxing out the most expensive pet in minecraft.🔔 TURN ON NOTIFICATIONS SO YOU NEVER MISS A VIDEO!👍 Drop a Like if you Enjoyed the Video!​#Hypixel #Minecraft"
"NrWx9Xi7dfE","I lost my BISCUITS for Luka Doncic on NBA 2K22","2022-07-31T02:00:09Z","UCSEQjmaQ-N3lcPzyvBcFWfg","Troydan","20","22.01.08","nba2k22|nba 2k22|nba2k23|nba 2k23|basketball|luka doncic|Luka Dončić|luka|end game luka|pack opening|nba pack opening|locker code|lockercodes|nba locker code|basketball pack opening|kareem|end game|packs|troydan packs|troydan pack opening|troydan|troydanreacts|biscuits|popeyes biscuits","274503","0","0","457","https://i.ytimg.com/vi/NrWx9Xi7dfE/default.jpg","False","True","Troydan opens packs for End Game Luka Doncic and End Game Kareem Abdul-Jabbar are here on NBA2K22. Will this be the worst pack opening troydan has ever had?►Join the discord http://discord.gg/troydan ►Follow on Twitter @Troydan►or follow on Instagram @Troydan"
"QGmdUj6LY3s","I hope you're ready","2022-07-30T11:23:16Z","UCrqsNpKuDQZreGaxBL_a5Jg","Deji","17","22.01.08","[none]","1171245","0","0","7487","https://i.ytimg.com/vi/QGmdUj6LY3s/default.jpg","False","True","Join the TANK GANG ►http://bit.ly/1h6i9oRInstagram ► http://instagram.com/comedygamerTwitter ► https://twitter.com/DejiFacebook ► https://www.facebook.com/DejiPage/"
"K7JZ6pUNADU","Metallica x Stranger Things: Joseph Quinn Meets Metallica","2022-07-30T22:23:36Z","UCbulh9WdLtEXiooRcYK7SWw","Metallica","10","22.01.08","metallica|metallica lollapalooza|joseph quinn|eddie munson|master of puppets|metallica master of puppets|stranger things season 4|stranger things|netflix|eleven|chrissy cunningham|dustin henderson|lucas sinclair|max mayfried|steve harrington|robin buckley|nancy wheeler|barb holland|the upside down|hawkins|vecna|hellfire|hellfire club|kate bush|running up that hill","381471","0","0","877","https://i.ytimg.com/vi/K7JZ6pUNADU/default.jpg","False","True","We call to order the most metal meeting ever of The Hellfire Club.Listen to Metallica: https://tallica.lnk.to/listenFollow Metallica:Website & Store: http://www.metallica.comOfficial Live Recordings: http://www.livemetallica.comInstagram: http://www.instagram.com/metallicaFacebook: http://www.facebook.com/metallicaTwitter: http://www.twitter.com/metallica"
"ciKHSOrpNKg","Impossible Who's That Pokemon Catching Challenge","2022-07-30T15:42:53Z","UCLc_ZQgQ8h2XKUAQpqcvIdw","PM7","20","22.01.08","pokemon|pm7|pokemen7|pokemen7 plays|mandjtv|mandjtv plays|pm7 mandjtv|pm7 vs mandjtv|pokemen7 mandjtv|guess the pokemon|whos that pokemon|pokemon challenge|impossible whos that pokemon challenge|hardest whos that pokemon|impossible whos that pokemon catching challenge|pokemon catching challenge|whos that pokemon challenge|whos that pokemon catching challenge|pokemon quiz|new pokemon|cursed whos that pokemon|original pokemon|new pokemon challenge|challenge","366741","0","0","1401","https://i.ytimg.com/vi/ciKHSOrpNKg/default.jpg","False","True","We play who's that Pokemon and then try to catch the correct Pokemon to win!SUBSCRIBE: ➡️ http://bit.ly/pm7_sub ⬅️🏆John Michael Cup Playlist: https://bit.ly/JMCup1✅Mikey's Channel: ​http://bit.ly/mandjtv_plays▶️Second Channel! https://bit.ly/pm7plus_sub📹VOD Channel! https://bit.ly/pm7vods_sub🎞️Clips Channel! https://bit.ly/pm7clips_sub💸Support The Channel and Get Perks! https://bit.ly/pm7_member🐦Twitter! https://bit.ly/pm7_twitter📸Instagram! https://bit.ly/pm7_instagram👽Reddit! https://bit.ly/pm7_reddit⏰TikTok! https://bit.ly/pm7_tiktokArt by https://twitter.com/guyrodwell_Edited by https://www.youtube.com/channel/UCias_4TWH7N0czxFASEkkzg#Pokemon #Gaming #Challenge"
"BqTldh763Fw","100 Levels Of Roblox Bedwars Tricks","2022-07-30T20:00:12Z","UCMt7QccSCUZgp-qrLLYVybA","CubeINC","22","22.01.08","roblox bedwars|roblox|roblox bed wars|roblox bedwars tricks|roblox bedwars trick|roblox bedwars tips and tricks|roblox bedwars hacks|roblox bedwars glitches|roblox bedwars live|roblox bedwars tanqr|bedwars|roblox gaming|bedwars roblox|tanqr|cubeinc|minibloxia|foltyn|bedwars tricks|roblox bedwars update|roblox bedwars kit|mythbusting","324482","0","0","968","https://i.ytimg.com/vi/BqTldh763Fw/default.jpg","False","True","100 Levels Of Roblox Bedwars TricksAs The Levels Get HIGHER, The Tricks Get HARDER!Roblox Bedwars is one of the LARGEST games on Roblox, and it has so much to do and so many tricks and glitches. I'll be gathering some of the most USEFUL Roblox Bedwars tricks, and rank them from level 1 being the simplest, to level 100 being the most advanced, intricate and developed tricks in the game! All of these tricks and glitches will help you get better at roblox bedwars, so I'd suggest you stick around and watch until the end. It's insane! Anyways I hope you enjoy!This is a Roblox Bedwars analysis/tricks video.20,000 likes would be cool :)STORE: https://cubeinc.store/USE CODE 'CUBEINC' FOR A 5% DISCOUNT ON EVERYTHING!! POG! BUT THE CODE EXPIRES ON SEPTEMBER, SO USE IT FAST!DISCORD: https://discord.gg/cubeincROBLOX GROUP: https://www.roblox.com/groups/12664086/Cube-Incorporation#!/aboutCredits to That's Amazing for the idea, go sub to them if you haven't!"
"Uv6iK2kS3qQ","Shein: When Public Image No Longer Matters | Corporate Casket","2022-07-30T18:00:20Z","UCpDmn2FfVYdPIDwRTcf5-OA","iilluminaughtii","27","22.01.08","iilluminaughtii|illuminaughti|illuminaughty|video essay|documentary|mini documentary|mini doc","492996","0","0","3244","https://i.ytimg.com/vi/Uv6iK2kS3qQ/default.jpg","False","True","Go to http://mintmobile.com/casper to cut your wireless bill to $15 a month!Welcome to the Corporate Casket, a semiweekly series where bad businesses go to die. We will discuss any and everything from bad charities, terrible CEOs, and businesses that have a lot to hide. Shein took the world by storm starting in 2012. As the newest hit in fast fashion, the company appealed to every demographic, offering trendy styles at incredibly affordable prices. Every day, someone posts a tiktok or youtube video, showing off treasure chests full of clothes. But the bright colors that represent the company hide a dark corporate empire that exploits everyone from the creators to the consumers.Connect with me: https://linktr.ee/iilluminaughtiiSources: https://justpaste.it/9pn2tWriters/Researchers/Helpers:Jess HubbertThis episode was edited by:Catechism: https://www.youtube.com/channel/UC1X38twKH-ePKOMQclh8a6g&Kelpie&Michael: https://www.flowcode.com/page/michaelseim&Collin Robinson twitter.com/CollinR027&The Mysterious BrianThis episode's audio was mixed by:G. Thomas Craig Artists:Sprites made by https://plegberb.tumblr.com/Outro song is Cake by RetrovisionYou made it all the way to the bottom of my description box so, hello there.#iilluminaughtii #shein 00:00 Hook02:03 Intro08:29 The Downfalls of Fast-Fashion11:30 Design Fails13:57 Profiting from Pain and Stolen Art17:02 Ad20:02 Stealing From Creators25:14 Outro"
"P7Cyrr64Ow4","I Designed Custom Minecraft Bosses...","2022-07-30T00:57:55Z","UCojEXrCBzO-cP2N5YlRcrWw","Daniel Krafft","27","22.01.08","minecraft|blender|minecraft art|minecraft mobs|creeper art|villager art|3d minecraft|3d art|minecraft animation|blender 2.8|blender eevee|cycles render|game art|blender tutorial|tutorial|animation|minecraft build|cute creeper|iron golem|enderman|fall guys|3d|mrbeast|mrbeast playbutton|mrbeast award|wither|ender dragon|warden|axolotl|lego|lego youtube|lego set|daniel craft|dream|linus tech tips|markiplier|linus|modding|mod|mod showcase|1.16|1.17","1144935","0","0","2425","https://i.ytimg.com/vi/P7Cyrr64Ow4/default.jpg","False","True","More Redesigns: https://youtube.com/playlist?list=PLSh10HLKI-DjA3Rbn8puAh-_sUwA8Gq0xGo to our sponsor http://betterhelp.com/danielkrafft for 10% off your first month of therapy withBetterHelp and get matched with a therapist who will listen and help.Skylor's Channel:  https://www.youtube.com/c/SkylorBeckKat's Channel:  https://www.youtube.com/c/Eirikat  Follow please➤ Instagram - https://www.instagram.com/danielkkrafft/➤ Twitter - https://twitter.com/danielkkrafftAlright so in this video I made some custom minecraft bosses and got a real mod developer to react to/review my designs. I ended up making a Piglin/Minotaur hybrid and a sculk allay. they turned out really good! The mrbeast playbutton is also officially underway//aboutMy name's daniel and I design things. Usually I do 3d modeling in blender but I'm now a metal worker thanks to mr beast apparently??? Who knows what I'll design in the future. If you have any ideas please let me know"
"9cT0jXI7l4E","Building a Next-Level Camera","2022-07-30T18:30:08Z","UCUQo7nzH1sXVpzL92VesANw","DIY Perks","26","22.01.08","[none]","847485","0","0","4381","https://i.ytimg.com/vi/9cT0jXI7l4E/default.jpg","False","True","Use POGDIYJULY16 for 16 FREE MEALS across 7 boxes + 3 FREE GIFTS at https://strms.net/hellofresh_diyperks ADCan this old lens become legendary? I think it can!Want to make one of these yourself? Download pack link coming soon."
