video_id,title,publishedAt,channelId,channelTitle,categoryId,trending_date,tags,view_count,likes,dislikes,comment_count,thumbnail_link,comments_disabled,ratings_disabled,description
"sts78MiLlzk","Surviving On $0.01 For 30 Days in Among Us","2022-07-31T16:00:37Z","UCke6I9N4KfC968-yRcd5YRg","SSundee","20","22.01.08","[none]","1353549","0","0","3102","https://i.ytimg.com/vi/sts78MiLlzk/default.jpg","False","True","We survive 30 days with a Penny in Among Us! ☞  Subscribe & click the bell Subscribe ➡ https://www.youtube.com/user/SSundee?sub_confirmation=1=== ϟ || Friends || ϟ ===⭑ @Sigils ⭑ @Biffle ⭑ @GarryBlox ⭑ @helloiamkate ⭑ @Mitzefy ⭑ @Nicovald ⭑ @Zud ⭑ @PatP • Video Editor ► Brenhttps://www.youtube.com/Brendalf• Thumbnail Maker ► Flashhttps://www.youtube.com/channel/UCLy01oVLarj7RNQm52jnGKw• Animator ► Davidhttps://www.youtube.com/channel/UCxSSIQevKsx2bFc_Gn4WAMg?view_as=subscriber​​• Music by Ninety9 ► LivesTobu - Such FunVideo Link: https://www.youtube.com/watch?v=d3Oc26AFDdUChannel: https://99l.tv/SubscribeDownload the album! https://99l.tv/Levelup-i#gaming #amongus #ssundee Thanks for watching!"
"Q2IX-Rui4ds","Обстрел Еленовки. Трибунал для Путина. Херсон в центре войны. Неоколонизаторы Кремля в Африке","2022-07-31T17:00:10Z","UCdubelOloxR3wzwJG9x8YqQ","Телеканал Дождь","25","22.01.08","дождь|телеканал дождь|новости|политика|фишман|михаил фишман|и так далее|война|еленовка|херсон|ВСУ|армия|обстрел|виктор бут|бриттни грайнер","529522","0","0","2300","https://i.ytimg.com/vi/Q2IX-Rui4ds/default.jpg","False","True","31 июля —158-й день войны Путина с Украиной. Сегодня поговорим про страшную гибель пленных украинцев в Еленовке, как две армии готовятся к битве за Херсон, обменяют ли Бриттни Грайнер на Виктора Бута, зачем Лавров едет в Африку и почему Россия ссорится с Израилем. Поддержать нас донатами можно по ссылке: https://tvrain.tv/Следите за главными новостями и новыми выпусками программ в телеграм-канале Дождя: https://t.me/tvrainЧто внутри:00:00 Анонс тем00:45 Удар по колонии в Еленовке04:46 Битва за Херсон20:39 Глава украинской делегации в ПАСЕ об ударе по Еленовке26:01 Международный трибунал для Путина28:30 Вступление Украины в ЕС33:38 Будет ли обмен Грайнер и Бута42:09 Лавров в Африке51:56 Суд над «Сохнут»1:06:16 Страх «за мной придут»1:09:51 За какие слова о войне сажают? Павел Чиков#фишман #итакдалее #дождь"
"nxs0RHpT_Hg","BLACKPINK - 'BORN PINK' ANNOUNCEMENT TRAILER","2022-07-31T15:00:27Z","UCOmHUn--16B90oW2L6FRR3A","BLACKPINK","10","22.01.08","YG Entertainment|YG|와이지|K-pop|BLACKPINK|블랙핑크|블핑|제니|로제|리사|지수|LISA|JISOO|JENNIE|ROSÉ|BLINK|블링크|BORN PINK|본핑크|블랙핑크 본핑크|BLACKPINK BORN PINK","8692081","0","0","165741","https://i.ytimg.com/vi/nxs0RHpT_Hg/default.jpg","False","True","#BLACKPINK #블랙핑크 #BORNPINK #ANNOUNCEMENT #TRAILER #YG"
"4UmroqAS5G0","День сто пятьдесят второй. Беседа с @Alexey Arestovych Алексей Арестович","2022-07-25T19:44:15Z","UCQVtD_N4OeD-9PshBq7NwyQ","ФЕЙГИН LIVE","25","22.01.08","фейгин live|фейгин лайф|марк фейгин|mark feygin|фейгин|марк фейгин стрим|фейгин марк|новости|политика|экономика|общество|прямой эфир|прямая трансляция|стрим|Society|Politics|общество и политика|фейгин арестович|новости украины|новости сегодня|power and politics|украина|путин|арестович фейгин|зеленский|россия|ukraine|алексей арестович|зсу|арестович|russia|северодонецк|всу|нато|харьков|херсон|ситуация на фронте","1870981","0","0","3693","https://i.ytimg.com/vi/4UmroqAS5G0/default.jpg","False","True","#Фейгин #ФейгинLIVE День сто пятьдесят второй. Беседа с  Алексеем Арестовичем (Киев).https://feygin-live.customprint.market/uk сайт с фирменным дизайном, если вы проживаете в Украине.https://feygin-live.myspreadshop.ie сайт с фирменным дизайном, если вы проживаете в Европе, Азии и Ближнем Востоке.https://feygin-live-usa.myspreadshop.com сайт с фирменным дизайном, если вы проживаете в Северной и Южной Америке, Африке и Тихоокеанском регионе.Подписка на PATREON https://www.patreon.com/feygin_liveЗачем нужна подписка на PATREON https://youtu.be/vcVmXQD7hrsПоддержите ФЕЙГИН LIVE: https://donate.stream/feyginliveПоддержите ФЕЙГИН LIVE: https://www.donationalerts.com/r/feygin_liveРеквизиты для поддержки проекта:Перевод с любой банковской карты https://buy.stripe.com/3cs03j5drbasg2Q004 недоступный для контроля российских регуляторов! Paypal: https://paypal.com/donate/?hosted_button_id=M77VR7HP9FELL&source=urlЯндекс-кошелек (в рублях): https://yoomoney.ru/to/4100116535768948QIWI Кошелек: https://qiwi.com/n/FEYGINLIVEBitcoin: 16rWnEwYErcknE2QWAJwRcGMw8L6cCjXLhETH: 0xe02B9F3b530a0AAf58B626Ad819672FF5c355Aee (убедитесь, что сеть верна: Ethereum (ERC20).USDC: 0xe02B9F3b530a0AAf58B626Ad819672FF5c355AeeДля пожертвований из Украины и Казахстана перечисляйте на кошельки платформы advcash.com на аккаунт feyginlive@gmail.comПодписывайтесь на Марка Фейгина в соцсетях:Твиттер Марка Фейгина - https://twitter.com/FeyginMark4Фейсбук Марка Фейгина - https://www.facebook.com/mark.feygin.z Телеграмм-канал - https://t.me/MarkFeyginПодкасты - https://castbox.fm/ch/3077294Почта для корреспонденции - feyginlive@gmail.com"
"u7_lljUeHrY","«Денег дали только на гроб и памятник». Как российская семья выбивает компенсацию за гибель солдата?","2022-07-17T08:00:22Z","UCp2J7GRxQ36QLqW4ReLLt5g","А поговорить?","22","22.01.08","а поговорить|эксклюзив|интервью|шихман|Ирина шихман|интервью дудя|юрий дудь|вдудь|дудь|gazlive|газлайв|газлайф|баста интервью|апоговорить|собчак|осторожно собчак|лойк|никита лойк|режик|война в украине|война на украине|груз 200|гибель солдата|зиганшины|василенко|илья василенко|зиганшин|компенсации|холодильник|про холодильник|украинский холодильник","2836054","0","0","61336","https://i.ytimg.com/vi/u7_lljUeHrY/default.jpg","False","True","Научись создавать сайты и приложения на Python в SkillFactory: https://go.skillfactory.ru/zPFSOgСкидка 45% по промокоду А ПОГОВОРИТЬ до 31.07.2022 г.Эксклюзивная коллекция одежды А поговорить?: https://shop.apogovorit.ruЧитай нас в Telegram: https://teleg.one/apogovoritofficial* Сервисы Facebook и Instagram принадлежат компании MetaКомпания Meta признана экстремистской организацией на территории Российской ФедерацииИрина Шихман берет эксклюзивные интервью у самых неожиданных гостей! А поговорить?..НАМ РАССКАЖУТ ВСЕ!#груз200 #шихман #апоговорить #интервьюПодпишись на канал https://www.youtube.com/channel/UCp2J7GRxQ36QLqW4ReLLt5g?sub_confirmation=1Instagram Ирины Шихман: https://www.instagram.com/irinashikhman/За логотипом и фирменным стилем к Борису Казачкову https://www.instagram.com/boris.kazachkov/"
"RlOB3UALvrQ","Marvel Studios’ Black Panther: Wakanda Forever | Official Teaser","2022-07-24T01:22:23Z","UCvC4D8onUfXzvjTOM-dBfEA","Marvel Entertainment","24","22.01.08","comics|marvel","32759812","0","0","60594","https://i.ytimg.com/vi/RlOB3UALvrQ/default.jpg","False","True","WAKANDA FOREVER - 11.11.22Wakanda Forever Prologue – New Music Available Now – Stream here – https://Hollywoodrecs.lnk.to/BPWFP► Watch Marvel on Disney+: https://bit.ly/2XyBSIW► Subscribe to Marvel on YouTube: http://bit.ly/WeO3YJFollow Marvel on Twitter: ‪https://twitter.com/marvelLike Marvel on Facebook: ‪https://www.facebook.com/marvelWatch Marvel on Twitch: https://www.twitch.tv/marvelReward your Marvel fandom by joining Marvel Insider!Earn points, then redeem for awesome rewards.Terms and conditions apply. Learn more at https://www.marvel.com/insider?Osocial=YT&CID=MarvelInsiderFor even more news, stay tuned to:Tumblr: ‪http://marvelentertainment.tumblr.com/Instagram: https://www.instagram.com/marvelPinterest: ‪http://pinterest.com/marvelofficialReddit: http://reddit.com/u/marvel-official"
"r8OodN1apJg","Турбо Гольф 4х4 дубасит! Финал проекта.","2022-07-26T14:37:12Z","UCG4yz4wtp2E5S62L06yqC9w","ИЛЬДАР АВТО-ПОДБОР","2","22.01.08","эльдар|авто|подбор|падбор|ильдар|ильдпр|автоподбор|эльдпр|элдар|илдар|vw|vv|wv|ww|golf|golf4|gti|1.8t|awu|aeb|adr|agn|aum|agu|awt|awm|turbo|ea|113|octavia|oktavia|skoda|volkswagen|wolkswagen|wolksvagen|vag|wag|шкода|агу|адр|агн|рс|rs|октавия|октавиа|актавия|актавиа|гольф|голф|гти|1.8т|турбо|фольксваген|вольксваген|гольф4|4моушн|4motion|motion|проект|валит|5сек|100кмч|6сек|строим|делаем|ремонт|воскрешение|восстановление|нагибатор|новый|к03|к04|k03|k04|гибрид|часть|седьмая|серия|7я|чип|тюнинг","2561227","0","0","10100","https://i.ytimg.com/vi/r8OodN1apJg/default.jpg","False","True","Заключительная серия саги про Гольф 4 Турбо 4х4!Здесь мы доводим этот проект до конца, впервые выезжаем, делаем замеры разгона, настройку, чип тюнинг и устраняем оставшиеся косяки ))Наконец-то можно официально заявить, что проект закончен... или нет?Если Вы не смотрели предыдущие части, то вот ссылки:Первая часть: https://youtu.be/i7Jiy4Ifw20Вторая часть: https://youtu.be/2egXlru-zpkТретья часть: https://youtu.be/_lRKtvA-e5EЧетвёртая часть: https://youtu.be/xpqhSr1Kg3oПятая часть: https://youtu.be/43CQF3i0qjQШестая часть: https://youtu.be/tc_hSFVd4D0Ильдар Авто-подбор это официальный канал группы компаний АП. Работаем c 2013 года. По всей России. Чем мы можем Вам помочь:✔ Подбор автомобилей с гарантией. Проверка по 105 пунктам. Экспертиза, оценка авто: https://podbor.org✔ Выучиться на права - Автошкола в Москве: https://school.podbor.org✔ Страхование по всей России ОСАГО/КАСКО: https://ins.podbor.org✔ Автосервис. Ремонт, обслуживание авто в Москве и СПб: https://service.podbor.org✔ Помощь нашего юриста. Консультации, суды, защита: https://lawyer.podbor.org✔ Вкуснейший натуральный Мёд с пасеки моего отца: https://honey.podbor.orgДля тех, кто хочет поддержать наш Благотворительный проект: https://podbor.org/charity/Обращайтесь! Мы всегда Вам рады!"
"xH9GsCCHMFY","I Held A Live YouTuber Talent Show...","2022-07-29T16:50:35Z","UC5p_l5ZeB_wGjO_yDXwiqvw","TommyInnit","20","22.01.08","tommyinnit|minecraft|mine craft|dream minecraft|funny|minecraft funny|funniest minecraft video|minecraft manhunt|minecraft speedrunner|minecraft challenge|challenge|minecraft but|minecraft mod|modded minecraft|tommy talent show|ranboo|tommy live show|I Held A Live YouTuber Talent Show","2533651","0","0","16974","https://i.ytimg.com/vi/xH9GsCCHMFY/default.jpg","False","True","Today TommyInnit, Ranboo, Jack Manifold, Niki & SO MANY MORE came together for the YouTuber Talent Show. This was stupid. No really, this was stupid.STREAMING A GOOD FEW TIMES A WEEK, COME WATCH - https://www.twitch.tv/tommyinnit Socials:Follow my Twitter - @tommyinnitFollow my Instagram - @tommyinnitEdited by @elodiegif THANK YOU SO MUCH TO EVERYONE WHO WAS INVOLVED IN MAKING THIS POSSIBLE. This whole night was one of the coolest of my entire life. Thank you guys :))"
"-K2riQhCyF4","Could You Survive On Mars?","2022-07-25T16:09:39Z","UCyps-v4WNjWDnYRKmZ4BUGw","Airrack","24","22.01.08","[none]","3162771","0","0","12591","https://i.ytimg.com/vi/-K2riQhCyF4/default.jpg","False","True","Mafia, start your business today with an exclusive 14-day free trial! https://www.shopify.com/airrackmarsGET YOUR LIMITED EDITION MARS MERCH BEFORE IT NO LONGER EXISTS ON EARTH: https://www.airrack.shopFollow me on Instagram!INSTAGRAM ▶️ https://urlgeni.us/instagram/jBHgFOLLOW MY FRIENDS:Mack: https://www.instagram.com/mackTyler: https://www.youtube.com/c/tylerblanchardOuttro song ▶️ Axel Thesleff - Bad KarmaYouTube: https://bit.ly/3k6UadjSpotify: https://spoti.fi/3odq3TNInstagram: https://bit.ly/3lsccazBonita Domes - https://www.airbnb.com/rooms/45896701?source_impression_id=p3_1657833463_bA6O%2BpZe4yVr44oF Rover - https://www.lcwprops.com/ Spacesuits - https://www.globaleffects.com/"
"OMKn-NATBiQ","Эта статуэтка не даёт мне спать по ночам","2022-07-28T12:05:11Z","UCyJrhZm9KXrzRub3-wD2zWg","TheBrianMaps","24","22.01.08","thebrianmaps|Брайн Мапс|юмор|хоррор|джеральд|статуэтка","1638334","0","0","19540","https://i.ytimg.com/vi/OMKn-NATBiQ/default.jpg","False","True","Данный видеоматериал не предназначен для распространения.МОЙ ТЕЛЕГРАМ-КАНАЛ: https://t.me/br1anm7ps• Подпишисьhttps://www.youtube.com/user/thebrianmaps?sub_confirmation=1• Инстаграм: https://instagram.com/brianmaps• Второй канал: http://www.youtube.com/user/BrianMaps2• Я ВКонтакте: http://vk.com/thebrianmaps• Группа ВКонтакте: http://vk.com/thebrianmapsgroup• Твиттер: https://twitter.com/TheBrianMapsCopyright © КОПИРАЙТ---------------------------------------Приятного просмотра! :] Брайн Мапс"
"BxFBlPSKN78","Трагедия в колонии в Еленовке: подробности. Новые «иноагенты» и возможный визит Пелоси на Тайвань","2022-07-30T18:39:07Z","UCdubelOloxR3wzwJG9x8YqQ","Телеканал Дождь","25","22.01.08","дождь|телеканал дождь|новости|политика|пелоси|тайвань|быков|альбац|иноагенты|еленовка|сизо|пленные|зеленский|нэнси|приговор","758089","0","0","2221","https://i.ytimg.com/vi/BxFBlPSKN78/default.jpg","False","True","Сегодня в «Здесь и Сейчас» обсуждаем подробности трагедии в Еленовке: СИЗО, где содержались украинские военнопленные, подверглось прицельному ракетному удару. Состоится ли визит спикера Палаты представителей  США Нэнси Пелоси на Тайвань, — учитывая, что сама его возможность уже создала напряжение между Китаем и Соединенными Штатами. И новый список «иноагентов»: кто попал в него на этот раз. Поддержать нас донатами можно по ссылке: https://tvrain.tv/Следите за главными новостями и новыми выпусками программ в телеграм-канале Дождя: https://t.me/tvrain#еленовка #иноагенты #дождь"
"AivQBXds-r0","Is MGK's New Movie Actually Genius?","2022-07-31T18:00:03Z","UCSUf5_EPEfl4zlBKZHkZdmw","Danny Gonzalez","23","22.01.08","danny gonzalez|funny|commentary|comedy|react|reaction|reacting|awful|humor","1062821","0","0","4465","https://i.ytimg.com/vi/AivQBXds-r0/default.jpg","False","True","Thanks to HelloFresh for sponsoring this video! For 16 free meals with HelloFresh across 7 boxes AND 3 free gifts, use code TRULYGREG16 at https://bit.ly/3FrlChp !edited by Jake Mayer https://www.instagram.com/jakeshotfriend/MERCH ► http://dannygonzalez.storeFollow MeSECOND CHANNEL ► https://www.youtube.com/c/2Danny2FuriousGAMING CHANNEL ► https://www.youtube.com/channel/UC2mQG51F8wu7njF84D-49cAINSTAGRAM ► https://www.instagram.com/dannygonzalez/TWITTER ► https://twitter.com/dannygonzalezTWITCH ► https://twitch.tv/dannygoonzalezSPOTIFY ► https://open.spotify.com/artist/6pDkmNhHCLh7YEb3sXceOs?si=8ZpMgF41SoufOS1UZ4vbkgSubmit a video topic https://forms.gle/VNa9Tq6Ncok8RWjN9"
"ukIGxgdbqqI","Stray Kids Time Out M/V","2022-07-31T14:59:53Z","UCaO6TYtlC8U5ttz62hTrZgg","JYP Entertainment","10","22.01.08","JYP Entertainment|JYP","2367475","0","0","59324","https://i.ytimg.com/vi/ukIGxgdbqqI/default.jpg","False","True","Stray Kids(스트레이 키즈) Time Out M/V Stray Kids Mixtape : Time OutiTunes & Apple Music: https://stray-kids.lnk.to/MixtapeTimeOut/AppleMusicSpotify: https://stray-kids.lnk.to/MixtapeTimeOut/Spotify🌊Listen to ＜Mixtape : Time Out＞ now!✨http://Stray-Kids.lnk.to/MixtapeTimeOutStray Kids Official YouTube: https://www.youtube.com/c/StrayKidsStray Kids Official Facebook: https://www.facebook.com/JYPEStrayKids/Stray Kids Official Instagram: https://www.instagram.com/realstraykids/Stray Kids Official Twitter: https://twitter.com/Stray_KidsStray Kids Official TikTok: https://www.tiktok.com/@jypestraykidsStray Kids Official Fan's: https://fans.jype.com/StrayKids#StrayKids #스트레이키즈 #TimeOut#Mixtape_TimeOut#YouMakeStrayKidsStay Copyrights 2022 ⓒ JYP Entertainment. All Rights Reserved."
"eCGiLsTLjFM","НОВОЕ ЖИЛЬЁ ДЛЯ ПАРНЯ! Трансформация личности: он весит 44кг в 24 года.","2022-07-25T14:59:34Z","UC2bhfksrCXjguRr10mpkvag","СЛОВО ПАЦАНА","22","22.01.08","Слово пацана|трансформация человека|Трансформация личности|меняем жезнь|добрый канал|помощь|Помогаем изменить жизнь|44 кг|Худой|Набираем вес|Брат в интернате|ищем работу|Помогаем с работой|Опека над братом|Рома и Дима|нет денег|сложная жизнь|трудности в жизни|поможем парню|проблемы в семье|нечего кушать|голодает|Наладим жизнь|нашли работу|Тянет семью|Новое жилье|Сняли квартиру","1184619","0","0","10104","https://i.ytimg.com/vi/eCGiLsTLjFM/default.jpg","False","True","Откройте счет для бизнеса на индивидуальных условиях — https://l.tinkoff.ru/slovopacanajuly______Наш курс по спорту, питанию и мотивации REforma: https://reforma-kurs.ru/Старт курса - сегодня! Вы еще можете успеть присоединиться!______Поддержать канал и стать спонсором - https://boosty.to/slovopatsana______Телеграм канала СЛОВО ПАЦАНА - https://t.me/slovopatsanaСюда мы выложили случайный конфликт который случился во дворе.И тут есть голосование про Серёжу - нам действительно очень интересно ваше мнение.______Это снова продолжение истории про Серёжу, которому 24 года и который весит всего 44 кг! Он отлично справился с первым месяцем работы, которую мы ему предложили. Если честно, мы сами этого не ожидали.Начало этой истории: https://youtu.be/a1MHozt4iR0В этом ролике мы решили сделать сюрприз для Серёжи. Мы смогли найти квартиру в аренду в его городе. Серёжа об этом ничего не знает.Мы покажем как Серёжа впервые увидел свое новое жильё.Теперь он сможет жить отдельно, сам себе готовить еду, и поддерживать свое жильё в порядке. Мы очень верим в Серёжу!_____Плей-лист со всеми роликам истории: https://www.youtube.com/playlist?list=PLuahPsoV_OOSbD8R--Rj3bmQaAj6xv9jw_____Помочь каналу (на добрые дела) - 2202 2025 2294 3368 (Сбербанк)QIWI - +79639660705USDT (TRC20) - TEQiQPHqXgH2pmYCUrbcbNB9ww8uEJEd9Y_____Наш мерч и наклейки на машину можно заказать на сайте: https://slovopatsana.ru_____Телеграм - https://t.me/slovopatsanaЯндекс.Дзен - https://zen.yandex.ru/slovopatsanaИнстаграм https://www.instagram.com/slovo.patsanaИнстаграм Димы https://www.instagram.com/dimab17Группа VK https://vk.com/public175204338VK Ромы https://vk.com/romaromanya_____По вопросам рекламы: adv@slovopatsana.ruСотрудничество и истории: story@slovopatsana.ru#СЛОВОПАЦАНА #трансформация"
"E1Fw4DODJ3o","Что произошло в Еленовке. Пытки украинских военных | Утро","2022-08-01T08:09:48Z","UCBG57608Hukev3d0d-gvLhQ","Настоящее Время","24","22.01.08","донбасс|нато|косово|еленовка|азов|азовсталь|украина|война","161658","0","0","986","https://i.ytimg.com/vi/E1Fw4DODJ3o/default.jpg","False","True","Текстовый онлайн 159-го дня войны: https://rferl.click/nk34Россия в выходные сильнее всего с начала войны бомбила Николаев. Российская армия формирует новые ударные группировки для наступления на Харьков – это показывают спутниковые снимки, и Кривой Рог – об этом говорят в оперативном командовании ВСУ Юг. Украина решает принудительно эвакуировать жителей Донецкой области из-за российского наступления и полностью уничтоженных коммуникаций. Осенью люди там просто замерзнут, говорит Ирина Верещук. Красный крест: Россия не пускает в колонию в оккупированной Еленовке, где в пятницу погибли около полусотни украинских военнопленных. Эксперты говорят, что по колонии в Еленовке не был нанесен ракетный удар, это был взрыв изнутри#Донбасс #НАТО #Косово"
