video_id,title,publishedAt,channelId,channelTitle,categoryId,trending_date,tags,view_count,likes,dislikes,comment_count,thumbnail_link,comments_disabled,ratings_disabled,description
"SagXrBEvMvA","25 Enlightening Secrets in Elden Ring","2022-07-30T06:19:56Z","UCe0DNp0mKMqrYVaTundyr9w","VaatiVidya","20","22.01.08","guide|walkthrough|lore|dark|souls|dlc|two|bloodborne|story|vaatividya|vaati|vidya|videos|(video|game)|shadows|twice|from|software|sekiro|combat|tips|tricks|elden|ring|trailer|demon's souls|remake|ps5|playstation 5|queen marika|demigods|great runes|radagon|godwyn|mohg|morgott|godrick|ranni|rykard|radahn|malenia|miquella|melina|omen|dragons|margitt|rennala|caria|liurnia|leyndell|elden beast|gideon|empyrean|scarlet rot|outer god|demi|gods","879089","0","0","2000","https://i.ytimg.com/vi/SagXrBEvMvA/default.jpg","False","True","Visit http://www.audible.com/vaatividya or text vaatividya to 500-500. Let Audible help you discover new ways to laugh, be inspired, or be entertained.  New members can try it free for 30 days. ►Get Posters & Apparel at https://vaatividya.com/►Check out Limit Breakers: https://www.youtube.com/c/LimitBreakers►Check out Oroboro: https://www.twitch.tv/oroboroTIMESTAMPS00:00 Rare Astel Attack00:56 Fallingstar Beast's Stages of Evolution02:15 Hardest Rise Puzzle02:59 Invisible Paths04:27 Ways to Cross Invisible Paths04:43 Attacking at Ledges05:35 Items Behind the Sanctum06:37 Weapon Scaling Secret07:45 Soap08:40 Deadly Rot09:23 Deadly Poison09:54 Merchant Violin10:22 Merchant Feathers10:54 How to Pause in Elden Ring11:34 Rare Accords12:13 Backup Shielding12:39 Backstep Attacks13:30 Invade Spamming14:02 Songs of the Two Fingers14:57 Scabbards Look Nice15:50 The Jar of Warriors17:10 Every Ruin Has an Underground17:57 Flask QoL Changes18:21 Rune QoL Changes18:40 How to Beat Radahn at Low LevelKINDLE THE CHANNEL [become a patron]►http://www.patreon.com/vaatividyaSPECIAL THANKS TO►TheParryGod, for editing many recent videos - https://www.youtube.com/user/xricsxPLAYLISTS►My Best Videos: http://bit.ly/2oMp66a►Elden Ring News: https://bit.ly/2ZkDV2d►Sekiro Lore: https://bit.ly/2KGEzD1►Sekiro Secrets: https://bit.ly/2IsObhW►Dark Souls 3 Lore: http://bit.ly/2n0bU13►Dark Souls 3 News: http://bit.ly/1NQbgbW►Bloodborne Lore: http://bit.ly/1X9doOQ►Demon's Souls Lore: http://bit.ly/16mIF86►Dark Souls Remastered Lore: http://bit.ly/13x6nNs►Dark Souls 2 Lore: http://bit.ly/1dedWjI►Souls-like: http://bit.ly/1xCPDnuSOCIAL►Follow me on Twitter: https://twitter.com/VaatiVidya►Follow me on Tumblr: http://vaatividya.tumblr.com/►Follow me on Twitch.tv: http://www.twitch.tv/vaatividya►Follow me on Facebook: https://www.facebook.com/Vaatividya►Follow me on Patreon: http://www.patreon.com/vaatividya►Join me on Discord: http://discord.gg/vaatividyaTHUMBNAIL ART►Janice ChuPATRONS►I'd like to give sincere thanks to all my patrons - your contributions have changed the course of my life, allowing me to put more emphasis on video production in the future.►Special thanks to Soul of Cinder-tier Patrons: Nurfarious, Aidan, Aishlinn, AJ, Aj Banasiak, AmazinShawn, Andreas, Andronikos, anthony, Aritz, Armand, Axel, Benjamin, budhawillyboy, Cat, Chase, Chattan, Croonz, Dain, David, deathbydishwasher, Aydian, Diablo, Erlend, Finbarwrong, GoldenSunX, Goon1234, HugDucks, Ian, Italian, Jacob, Joshua, Justin, Justin, Kejo, Kuvoc, Kyle, Lena, Liam, Lucat, Lucian, Lucratiel, Loak, M, Malik, Matthew, Meistermuall, Michael, michael, Mike, & Morgan."
"BqTldh763Fw","100 Levels Of Roblox Bedwars Tricks","2022-07-30T20:00:12Z","UCMt7QccSCUZgp-qrLLYVybA","CubeINC","22","22.01.08","roblox bedwars|roblox|roblox bed wars|roblox bedwars tricks|roblox bedwars trick|roblox bedwars tips and tricks|roblox bedwars hacks|roblox bedwars glitches|roblox bedwars live|roblox bedwars tanqr|bedwars|roblox gaming|bedwars roblox|tanqr|cubeinc|minibloxia|foltyn|bedwars tricks|roblox bedwars update|roblox bedwars kit|mythbusting","324482","0","0","968","https://i.ytimg.com/vi/BqTldh763Fw/default.jpg","False","True","100 Levels Of Roblox Bedwars TricksAs The Levels Get HIGHER, The Tricks Get HARDER!Roblox Bedwars is one of the LARGEST games on Roblox, and it has so much to do and so many tricks and glitches. I'll be gathering some of the most USEFUL Roblox Bedwars tricks, and rank them from level 1 being the simplest, to level 100 being the most advanced, intricate and developed tricks in the game! All of these tricks and glitches will help you get better at roblox bedwars, so I'd suggest you stick around and watch until the end. It's insane! Anyways I hope you enjoy!This is a Roblox Bedwars analysis/tricks video.20,000 likes would be cool :)STORE: https://cubeinc.store/USE CODE 'CUBEINC' FOR A 5% DISCOUNT ON EVERYTHING!! POG! BUT THE CODE EXPIRES ON SEPTEMBER, SO USE IT FAST!DISCORD: https://discord.gg/cubeincROBLOX GROUP: https://www.roblox.com/groups/12664086/Cube-Incorporation#!/aboutCredits to That's Amazing for the idea, go sub to them if you haven't!"
"D6Gk2KePhV0","EST Gee - Blood (Official Music Video)","2022-07-29T19:00:05Z","UChPQNFEbdvaZWZJLTRngYBQ","ESTGeeVEVO","10","22.01.08","EST|Gee|Blood|CMG/Warlike|Hip|Hop","630295","0","0","1070","https://i.ytimg.com/vi/D6Gk2KePhV0/default.jpg","False","True","Listen to Blood out now on all platforms:https://estgee.lnk.to/BloodFollow EST Gee:https://twitter.com/ESTGEEhttps://www.instagram.com/est.geehttps://www.facebook.com/ESTGeeOffici...https://tiktok.com/@est.geehttps://smarturl.it/ESTGeeYThttp://www.est-gee.com/https://estgee.lnk.to/MailerSignUpMusic video by EST Gee performing Blood. © 2022 Foundation Entertainment/Interscope Recordshttp://vevo.ly/dZilH0"
"78Y3Oq0Pfaw","EVEN BIGGER Debris Flow Flash Flood in Flagstaff, Arizona Drone Footage","2022-07-30T21:00:09Z","UCV6hWxB0-u_IX7e-h4fEBAw","Reed Timmer","25","22.01.08","flash flood|heavy rain|extreme weather|flash floods caught on tape|flash flood caught on camera|flash flood arizona|debris flow video|debris flow barrier|reed timmer|debris flow 2022|debris flow landslide|flash floods in the desert|extreme weather documentary|storm chasing|storm chaser|flash flood arizona canyon|flash flood arizona today|flash flood warning arizona|Arizona|Flagstaff|flagstaff arizona|flagstaff flooding 2022|flagstaff news|arizona news","175498","0","0","298","https://i.ytimg.com/vi/78Y3Oq0Pfaw/default.jpg","False","True","A monster, pitch-black debris flow makes its was through Flagstaff Arizona.  This is a flash flood emergency, and another has been has been declared by the city.  All of this from just over 2 inches of rain hitting the San Fransisco Peaks 'burn scar' area, see the result from both the ground and a drone.00:00 - Intro01:30 - Reed moves for intercept 03:09 - Initial Flash Flood arrives04:27 - Details on the debris flow05:14 - Flood reaches Flagstaff.  06:15 - Drone survey of FlagstaffSUBSCRIBE - https://www.youtube.com/channel/UCV6hWxB0-u_IX7e-h4fEBAw/?sub_confirmation=1Never Stop Chasing."
"j4vIxEGYqVs","Grain Bin Clean Out","2022-07-30T15:53:50Z","UCp0rRUsMDlJ1meYAQ6_37Dw","Millennial Farmer","22","22.01.08","[none]","284509","0","0","712","https://i.ytimg.com/vi/j4vIxEGYqVs/default.jpg","False","True","Save 20% on your system and your first month is free when you sign up forinteractive monitoring. Visit https://SimpliSafe.com/MillennialFarmer to learn more!A PARTY LIKE NO OTHER! Join us July 1st, 2022 in Alexandria, MN to Celebrate 1 Million Subscribers (hopefully), enjoy some great music and contribute to a great cause! We're teaming up with Anderson Bash to kick off our Grain Bin Safety Campaign again! The goal of this campaign is to reduce the occurrence of grain bin accidents by raising awareness of the hazards and by raising funds to equip first responders with the tools and training needed to respond quickly when necessary in the event of a grain bin accident. The funds raised will be used to purchase Grain Bin Rescue kits and training for first responders. #GrainBinSafety Can we hit our $100,000 goal and 1 Million Subscribers?! Free Will Donation, Donate today! ►https://www.gofundme.com/f/grain-bin-safetyOrder Millennial Farmer Merchandise: ►https://www.mnmillennialfarmer.com/ Check out our 2nd Channel@Between The Rows Off The Husk With The Millennial Farmer Podcast Listen Here: ►https://www.mnmillennialfarmer.com/podcast Farmers Business Network FBN membership is now FREE! Start maximizing your farm's profit potential today. ►https://use.fbn.com/MN-MILLENNIAL-FARMER Yankum RopesPROMO CODE MFARMER►https://yankum.com/?afmc=1sGet my Sunglasses Gatorz ►https://www.gatorz.com?aff=mnmillennialfarmer&utm_campaign=referral-program Drink Northern Chill 20% off using code MNFARMER20 ► www.northernchill.com Maximum Hearing Protecting and Hearing Enhancement with Blue Tooth Technology ►https://goaxil.com/?rfsn=6419650.f3c859 Coupon Code: FARMER1 OTHER COOL STUFF like my watch here: ►https://www.amazon.com/shop/mnmillennialfarmer?listId=W464BJJLJY8I&ref=idea_share_inf Bringing Magical Moments to Millennial Farmer Fans:►https://www.cameo.com/millennialfarmer?utm_campaign=profile_share Book The Millennial Farmer to Speak at your Next Event: ►mnmillennialfarmer@gmail.com Field Work Podcast Listen on Apple Music, Google and Spotify: ►https://www.fieldworktalk.org/ Zach Johnson, the “Millennial Farmer” is a 5th-generation farmer who’s spent his life growing, working, and learning on his family’s farm. His wit and dry sense of humor appeal to children and adults alike. A product of the millennial generation, his appreciation of new technology blends with his old-fashioned work ethic, and he offers a unique ability to deliver his message in a way that resonates with lifelong farmers as well as those with no knowledge of agriculture. With growing consumer awareness about where their food comes from, Zach has identified the need for an independent voice from the front lines of agriculture. Zach actively promotes agriculture by sharing his day-to-day experiences in the agriculture world while providing farmer-to-farmer education to help facilitate a collaborative conversation between farmers and the public. Follow Along ►https://www.instagram.com/mnmillennialfarmer/ ►https://www.facebook.com/MNMILLENNIALFARMER/ ►https://twitter.com/farmmillennial Edited By: Becky Johnson"
"P7Cyrr64Ow4","I Designed Custom Minecraft Bosses...","2022-07-30T00:57:55Z","UCojEXrCBzO-cP2N5YlRcrWw","Daniel Krafft","27","22.01.08","minecraft|blender|minecraft art|minecraft mobs|creeper art|villager art|3d minecraft|3d art|minecraft animation|blender 2.8|blender eevee|cycles render|game art|blender tutorial|tutorial|animation|minecraft build|cute creeper|iron golem|enderman|fall guys|3d|mrbeast|mrbeast playbutton|mrbeast award|wither|ender dragon|warden|axolotl|lego|lego youtube|lego set|daniel craft|dream|linus tech tips|markiplier|linus|modding|mod|mod showcase|1.16|1.17","1144935","0","0","2425","https://i.ytimg.com/vi/P7Cyrr64Ow4/default.jpg","False","True","More Redesigns: https://youtube.com/playlist?list=PLSh10HLKI-DjA3Rbn8puAh-_sUwA8Gq0xGo to our sponsor http://betterhelp.com/danielkrafft for 10% off your first month of therapy withBetterHelp and get matched with a therapist who will listen and help.Skylor's Channel:  https://www.youtube.com/c/SkylorBeckKat's Channel:  https://www.youtube.com/c/Eirikat  Follow please➤ Instagram - https://www.instagram.com/danielkkrafft/➤ Twitter - https://twitter.com/danielkkrafftAlright so in this video I made some custom minecraft bosses and got a real mod developer to react to/review my designs. I ended up making a Piglin/Minotaur hybrid and a sculk allay. they turned out really good! The mrbeast playbutton is also officially underway//aboutMy name's daniel and I design things. Usually I do 3d modeling in blender but I'm now a metal worker thanks to mr beast apparently??? Who knows what I'll design in the future. If you have any ideas please let me know"
"Yonsx-Q9fIk","Daddy, I Want A G-Wagon","2022-07-30T01:58:38Z","UCdqp0KK_Io7TwK5cJMBvB0Q","WhistlinDiesel","22","22.01.08","[none]","995415","0","0","9252","https://i.ytimg.com/vi/Yonsx-Q9fIk/default.jpg","False","True","Coming Soon"
"HNaI7kniyvE","Are You Smarter Than A 5th Grader? Cash vs FLIGHT!","2022-07-29T22:57:45Z","UCvyTdLw8SkVmUcHYXSDEGwA","CashNasty","24","22.01.08","cash vs flight|cash vs flight are you smarter than 5th grader|funny videos clean|entertainment|funny trivia|flight and cash funny moments|flight dumbest moments|trivia game|are you smarter than a 5th grader|are you smarter than a fifth grader|elementary school quiz|quiz show|5th grader quiz|quiz|comedy|game|viral|test|americans are stupid","449814","0","0","3751","https://i.ytimg.com/vi/HNaI7kniyvE/default.jpg","False","True","Me and Flight go head to head while answering 5th grade level questions!Gaming Channel: https://goo.gl/Se1qBH 2HYPE Channel: https://www.youtube.com/channel/UCY4AlDv6wL2qhrX29iwdqAgFollow me on Twitter: www.twitter.com/cashnastygamingInstagram: @cashnastyI livestream on Twitch! www.twitch.tv/cashnastygaming"
"aE9tWKLfsl0","Hotboii ft. Lil Uzi Vert - Throw In The Towel (Official Video)","2022-07-29T18:15:10Z","UCxuYJtXOR5MUXLU-qQ-JaLw","H O T B O I I","10","22.01.08","hotboii|hotboii music video|hotboii kut da fan on|hotboii life of a hotboii|nobody special|future|hotboii nobody special|hotboii dont need time|goat talk|lil baby|florida|orlando|hip hop|hip hop music|hotboii music videos|hotboii music|hotboy|double 0 baby|kut da fan on|ynw melly|kodak black|Hotboiii WTF|Hotboii Blinded By Death|Blinded By Death|Hotboii Lil Uzi Vert|Lil Uzi Vert|Hotboii Lil Uzi Vert Throw In The Towel|Throw In The Towel|Hotboii2022","989584","0","0","2036","https://i.ytimg.com/vi/aE9tWKLfsl0/default.jpg","False","True","Stream Blinded By Death here: https://hotboii.lnk.to/Blinded Follow Hotboii on Instagram: https://www.instagram.com/itshotboii438​Twitter: https://twitter.com/itshotboii438​Soundcloud: http://soundcloud.com/itshotboii​Director @shotbymiggy EP @jmpSupervising Producer @joeyszelaField @killagramDP @mkoziel AC @eric_gauntt KG @ryvnphvm BCAM VHS @zeddekiah PA/VHS @liam.shoree Color @cameronmarygold Editor @shotbymiggy VFX @rfxmedia Production House @paperwork #Hotboii #LilUziVert #ThrowInTheTowel"
"R4C8JXCCak4","The Doc Rivers-Bill Simmons beef is what happens when the media are fans","2022-07-30T15:00:14Z","UCDRmGMSgrtZkOsh_NQl4_xw","Secret Base","17","22.01.08","basketball|beef|beef history|bill simmons|boston celtics|celtics|doc rivers|grantland|la clippers|los angeles clippers|nba|nba draft|paul pierce|sb nation|secret base|sports beef|the ringer|media feud|big three|sbnation|seth rosenthal","293740","0","0","1018","https://i.ytimg.com/vi/R4C8JXCCak4/default.jpg","False","True","Before he became a media mogul, Bill Simmons was a Celtics fan. While Simmons was getting super famous, the Celtics weren't very good. The man overseeing that not-very-goodnesss was coach Doc Rivers. So Bill's problems became Doc's problems, and vice versa. This is what happens when one of the biggest stars in sports media cares deeply and publicly about a particular team, and the guy running team isn't just going to take it all in stride. It got awkward, and it got beefy.Directed and edited by Ryan SimmonsWritten and produced by Seth RosenthalSubscribe: http://goo.gl/Nbabae Enter the Secret Base: http://www.sbnation.com/secret-base Follow us on Twitter: https://twitter.com/secretbase Follow us on Twitch: https://www.twitch.tv/secretbasesbn Follow us on Tiktok: https://www.tiktok.com/@secretbasesbn? Check out our full video catalog: http://goo.gl/9pMHRV Visit our playlists: http://goo.gl/NvpZFF Explore SB Nation: http://www.sbnation.com"
"9cT0jXI7l4E","Building a Next-Level Camera","2022-07-30T18:30:08Z","UCUQo7nzH1sXVpzL92VesANw","DIY Perks","26","22.01.08","[none]","847485","0","0","4381","https://i.ytimg.com/vi/9cT0jXI7l4E/default.jpg","False","True","Use POGDIYJULY16 for 16 FREE MEALS across 7 boxes + 3 FREE GIFTS at https://strms.net/hellofresh_diyperks ADCan this old lens become legendary? I think it can!Want to make one of these yourself? Download pack link coming soon."
"pekTdUA-KjU","i think i might have lied","2022-07-29T23:16:59Z","UCoo-9GEm2mpyYIXSptrKIpA","2 Danny 2 Furious","22","22.01.08","danny gonzalez|dannygonzalez|funny|skit|vine comedy|vines","894186","0","0","5367","https://i.ytimg.com/vi/pekTdUA-KjU/default.jpg","False","True","i might have liededited by Jake Mayer https://www.instagram.com/jakeshotfriend/"
"WS1S8XKNCIk","Guardians Of The Galaxy 3 Trailer: Adam Warlock First Look Breakdown and Marvel Phase 5 Easter Eggs","2022-07-31T01:41:57Z","UCDiFRMQWpcp8_KD4vwIVicw","Emergency Awesome","24","22.01.08","Trailer|Black Panther Wakanda Forever Trailer|Emergency Awesome|Guardians of the Galaxy 3 Trailer|guardians of the galaxy 3 trailer|guardians of the galaxy 3|guardians of the galaxy|Guardians of the Galaxy Adam Warlock|Ant Man 3 Trailer|Black Panther 2 Trailer|Marvel|Black Panther Wakanda Forever|trailer|Movies|Movie|2022|Scene|emergencyawesome|Charlie Schneider|Clip|movies|Avengers 5 Trailer|Avengers 6 Trailer|Avengers Secret Wars|Avengers Kang Dynasty","980365","0","0","843","https://i.ytimg.com/vi/WS1S8XKNCIk/default.jpg","False","True","Guardians Of The Galaxy 3 Trailer. Adam Warlock First Look, Marvel Phase 5 Easter Eggs, High Evolutionary, Avengers 5 Kang Dynasty Teaser & Marvel Comic Con ► https://bit.ly/AwesomeSubscribeBlack Panther Wakanda Forever Trailer https://www.youtube.com/watch?v=GFVKCPnmUN8&list=PLOIeYdZ3QczwWT3yd94Xc6n-ooI85uV_u&index=1Ant Man 3 Trailer Kang https://www.youtube.com/watch?v=olEMvPlsD88&list=PLOIeYdZ3QczwWT3yd94Xc6n-ooI85uV_u&index=1House of the Dragon Episode 1 Review https://www.youtube.com/watch?v=YEcEn0XQwvA&list=PLOIeYdZ3QczxGuSDE8NtOuthqbKFChC0q&index=1Avengers 5 Teaser Trailer https://www.youtube.com/watch?v=0ZcvioB2vwc&list=PLOIeYdZ3QczwWT3yd94Xc6n-ooI85uV_u&index=1She Hulk Trailer Daredevil https://www.youtube.com/watch?v=DDnfwqyt9Jw&list=PLOIeYdZ3QczwWT3yd94Xc6n-ooI85uV_u&index=1Spider-Man Freshman Year Trailer https://www.youtube.com/watch?v=B7wGe8XNXD0&list=PLOIeYdZ3QczwWT3yd94Xc6n-ooI85uV_u&index=1Emergency Awesome New Videos https://www.youtube.com/watch?v=FeOfhzu7ZdY&list=PLOIeYdZ3QczxQXxyV_2D8kuEs_QsuQIyJ&index=7Covering new Guardians of the Galaxy 3 Trailer. Adam Warlock First Look Scenes Explained. High Evolutionary Explained. Adam Warlock connection to the Infinity Stones. Thor Love and Thunder Guardians of the Galaxy 3 timeline. Marvel Phase 5 Easter Eggs. Adam Warlock in new Marvel Movies after Guardians of the Galaxy 3. Guardians of the Galaxy 2 Post Credit Scene for Adam Warlock and Timeline Explained. The new Guardians Roster. Rocket Raccoon Origin Story Revealed.Adam Warlock Guardians of the Galaxy 3 Fantastic Four Movie Connection. Adam Warlock Origin Story changes in the marvel movies. And Earlier Easter Eggs like Thor The Dark World Post Credit Scene with his cocoon. There will be a Guardians of the Galaxy Holiday Special which will take place between Thor Love and Thunder and Guardians of the Galaxy 3. The episode will air this christmas 2022. So I'll do a new trailer video as soon as that releases.Scarlet Witch High Evolutionary connection and backstory changes. Black Panther 2 Trailer, She Hulk Trailer, Secret Invasion Trailer, and lots more like Avengers 5 Kang Dynasty Trailer, Avengers 6 Secret Wars Trailer, Deadpool 3, Fantastic Four Teaser and videos at the Marvel Comic Con Panel. We'll get a new guardians of the galaxy 3 trailer at the end of this year. The Release Date is right after Ant-Man 3 Quantumania during Marvel Phase 5.My Full House Of the Dragon Episode videos will start soon! , X-Men Trailer and Marvel Zombies Trailer, Black Adam Trailer and other Marvel Comic Con Trailers. My She Hulk Episode videos will start soon too! Art via https://www.instagram.com/spdrmnkyxxiii/Twitch Channel https://twitch.tv/emergencyawesomeTwitter  https://twitter.com/awesomemergencyFacebook  https://facebook.com/emergencyawesomeInstagram  https://instagram.com/emergencyawesomeTumblr  https://robotchallenger.comMy Website https://emergencyawesome.com:: Video Playlists For Shows ::New Emergency Awesome Videos https://www.youtube.com/playlist?list=PLOIeYdZ3QczxQXxyV_2D8kuEs_QsuQIyJHouse of The Dragon Episodes Game Of Thrones Prequel https://www.youtube.com/playlist?list=PLOIeYdZ3QczxqJeNeCsF_ghizcTS9nM4XLoki Episodes https://www.youtube.com/playlist?list=PLOIeYdZ3Qczy8mUNqHU-35xtTd-JpJU3lThe Mandalorian Episodes https://www.youtube.com/playlist?list=PLOIeYdZ3QczzsN78nOjS-ABHwKaB7KONWGame of Thrones Episodes https://www.youtube.com/playlist?list=SPOIeYdZ3QczxGuSDE8NtOuthqbKFChC0qMarvel Movies and Avengers https://www.youtube.com/playlist?list=PLOIeYdZ3QczwWT3yd94Xc6n-ooI85uV_uRick and Morty Season 5 Episodes https://www.youtube.com/playlist?list=PLOIeYdZ3Qczyvx-lFYzOv9s6bOv7b9wYRAvatar The Last Airbender Episodes https://www.youtube.com/playlist?list=PLOIeYdZ3Qczx-z2jyyX4naSnE1A8d0hkCThe Witcher Season 2 Episodes Netflix https://www.youtube.com/playlist?list=PLOIeYdZ3QczyRsUjubTL0CQyPIu1g9OtVThe Boys Season 3 Episodes https://www.youtube.com/playlist?list=PLOIeYdZ3Qczw-KMQyuCrxcxV3mSQWTAdRSpiderman No Way Home Videos https://www.youtube.com/playlist?list=PLOIeYdZ3QczzbRhRiGhj3-MaZ_24kadOyThe Flash Season 8 Episodes https://www.youtube.com/playlist?list=PLOIeYdZ3QczwCLH9RIm-7ui56ameRYmdQThe Batman 2022 and DC Movies https://www.youtube.com/playlist?list=PLOIeYdZ3QczwCLH9RIm-7ui56ameRYmdQJustice League Snyder Cut Videos https://www.youtube.com/playlist?list=PLOIeYdZ3QczwCLH9RIm-7ui56ameRYmdQStar Wars Movies https://www.youtube.com/playlist?list=PLOIeYdZ3QczztMg8cT1WS0P8ATv-MhUEJTHANKS FOR WATCHING!!"
"ufMee67yIAo","Tottenham vs. Roma: Extended Highlights | Club Friendly | CBS Sports Golazo","2022-07-30T20:30:19Z","UCET00YnetHT7tOpu12v8jxg","CBS Sports Golazo","17","22.01.08","Champions League|Europa League|Soccer|UEFA|UCL|European Soccer|European Football|European Futbol|UEL","120611","0","0","227","https://i.ytimg.com/vi/ufMee67yIAo/default.jpg","False","True","Harry Kane and Tottenham take on Roma and Tammy Abraham in an international friendly in Israel.#Soccer #Friendly #Roma #Tottenham"
