video_id,title,publishedAt,channelId,channelTitle,categoryId,trending_date,tags,view_count,likes,dislikes,comment_count,thumbnail_link,comments_disabled,ratings_disabled,description
"SagXrBEvMvA","25 Enlightening Secrets in Elden Ring","2022-07-30T06:19:56Z","UCe0DNp0mKMqrYVaTundyr9w","VaatiVidya","20","22.01.08","guide|walkthrough|lore|dark|souls|dlc|two|bloodborne|story|vaatividya|vaati|vidya|videos|(video|game)|shadows|twice|from|software|sekiro|combat|tips|tricks|elden|ring|trailer|demon's souls|remake|ps5|playstation 5|queen marika|demigods|great runes|radagon|godwyn|mohg|morgott|godrick|ranni|rykard|radahn|malenia|miquella|melina|omen|dragons|margitt|rennala|caria|liurnia|leyndell|elden beast|gideon|empyrean|scarlet rot|outer god|demi|gods","879089","0","0","2000","https://i.ytimg.com/vi/SagXrBEvMvA/default.jpg","False","True","Visit http://www.audible.com/vaatividya or text vaatividya to 500-500. Let Audible help you discover new ways to laugh, be inspired, or be entertained.  New members can try it free for 30 days. ►Get Posters & Apparel at https://vaatividya.com/►Check out Limit Breakers: https://www.youtube.com/c/LimitBreakers►Check out Oroboro: https://www.twitch.tv/oroboroTIMESTAMPS00:00 Rare Astel Attack00:56 Fallingstar Beast's Stages of Evolution02:15 Hardest Rise Puzzle02:59 Invisible Paths04:27 Ways to Cross Invisible Paths04:43 Attacking at Ledges05:35 Items Behind the Sanctum06:37 Weapon Scaling Secret07:45 Soap08:40 Deadly Rot09:23 Deadly Poison09:54 Merchant Violin10:22 Merchant Feathers10:54 How to Pause in Elden Ring11:34 Rare Accords12:13 Backup Shielding12:39 Backstep Attacks13:30 Invade Spamming14:02 Songs of the Two Fingers14:57 Scabbards Look Nice15:50 The Jar of Warriors17:10 Every Ruin Has an Underground17:57 Flask QoL Changes18:21 Rune QoL Changes18:40 How to Beat Radahn at Low LevelKINDLE THE CHANNEL [become a patron]►http://www.patreon.com/vaatividyaSPECIAL THANKS TO►TheParryGod, for editing many recent videos - https://www.youtube.com/user/xricsxPLAYLISTS►My Best Videos: http://bit.ly/2oMp66a►Elden Ring News: https://bit.ly/2ZkDV2d►Sekiro Lore: https://bit.ly/2KGEzD1►Sekiro Secrets: https://bit.ly/2IsObhW►Dark Souls 3 Lore: http://bit.ly/2n0bU13►Dark Souls 3 News: http://bit.ly/1NQbgbW►Bloodborne Lore: http://bit.ly/1X9doOQ►Demon's Souls Lore: http://bit.ly/16mIF86►Dark Souls Remastered Lore: http://bit.ly/13x6nNs►Dark Souls 2 Lore: http://bit.ly/1dedWjI►Souls-like: http://bit.ly/1xCPDnuSOCIAL►Follow me on Twitter: https://twitter.com/VaatiVidya►Follow me on Tumblr: http://vaatividya.tumblr.com/►Follow me on Twitch.tv: http://www.twitch.tv/vaatividya►Follow me on Facebook: https://www.facebook.com/Vaatividya►Follow me on Patreon: http://www.patreon.com/vaatividya►Join me on Discord: http://discord.gg/vaatividyaTHUMBNAIL ART►Janice ChuPATRONS►I'd like to give sincere thanks to all my patrons - your contributions have changed the course of my life, allowing me to put more emphasis on video production in the future.►Special thanks to Soul of Cinder-tier Patrons: Nurfarious, Aidan, Aishlinn, AJ, Aj Banasiak, AmazinShawn, Andreas, Andronikos, anthony, Aritz, Armand, Axel, Benjamin, budhawillyboy, Cat, Chase, Chattan, Croonz, Dain, David, deathbydishwasher, Aydian, Diablo, Erlend, Finbarwrong, GoldenSunX, Goon1234, HugDucks, Ian, Italian, Jacob, Joshua, Justin, Justin, Kejo, Kuvoc, Kyle, Lena, Liam, Lucat, Lucian, Lucratiel, Loak, M, Malik, Matthew, Meistermuall, Michael, michael, Mike, & Morgan."
"HomqQmZLKlo","Stronk Cat vs SCP - CIA Movie 5 (Scary! Only Watch If You Are Brave) Brookhaven 🏡RP","2022-07-30T16:09:37Z","UCdvWE7xjoL-B1FS_NFwQqTw","EYYCHEEV","20","22.01.08","[none]","754986","0","0","2995","https://i.ytimg.com/vi/HomqQmZLKlo/default.jpg","False","True","Don't miss the Super Funny ending! 🤣This video took Stronk Cat one month to make. Hope you enjoy!Credits:Rickroll Master: @Beluga Actor:@BoBoBear Writer, Director, Editor: @EYYCHEEV - Stronk Cat🌟  Use Star Code: STRONK🐈  Subscribe if you Stronk: https://bit.ly/sub-to-eyycheev🐯  Roblox Group: https://www.roblox.com/groups/8070998🐯  Discord Server: https://discord.gg/nTkyB2ktRd🐯  Twitter: https://twitter.com/eyycheevGame:Brookhaven 🏡RP: https://www.roblox.com/games/4924922222/Brookhaven-RP"
"H_FpK6Q_wuE","BOAT TOUR: Inside the classic wooden yacht TALLY HO!","2022-07-30T16:00:06Z","UCg-_lYeV8hBnDSay7nmphUA","Sampson Boat Co","22","22.01.08","[none]","305833","0","0","1390","https://i.ytimg.com/vi/H_FpK6Q_wuE/default.jpg","False","True","Get Surfshark VPN at https://surfshark.deals/TALLYHO - Enter promo code TALLYHO for 83% off and 3 extra months FREE!Support TALLY HO; http://www.sampsonboat.co.uk/support---- EPISODE 131In this video we take a tour of Tally Ho’s interior, which is coming together pretty quickly now! George has been building some beautiful bunk-sides from the original 112-year-old Teak planks. Richard is building bunks and Oak cabinetry, and Patrick has fit a lot of Ash sole-boards.Meanwhile, Leo works on figuring out the companionway steps and battery locker, Clifton fits the Skylight sills, and Pete adds some more Purpleheart to the Centerline… there’s a lot going on!——To become a Patron - https://www.patreon.com/sampsonboatco To donate or support - http://sampsonboat.co.uk/support My Amazon Wishlist http://a.co/76y5IZPFor sneaky previews of what’s going on in between episodes, follow my FACEBOOK http://www.facebook.com/sampsonboatco and INSTAGRAM http://www.instagram.com/sampsonboatco. MANY THANKS! --- Music;Grace Behind the Curtain - Silent PartnerOtis McDonald - Joe BagalePickup Truck - Silent PartnerBOAT TOUR: Inside the classic wooden yacht TALLY HO! (EP131)"
"j4vIxEGYqVs","Grain Bin Clean Out","2022-07-30T15:53:50Z","UCp0rRUsMDlJ1meYAQ6_37Dw","Millennial Farmer","22","22.01.08","[none]","284509","0","0","712","https://i.ytimg.com/vi/j4vIxEGYqVs/default.jpg","False","True","Save 20% on your system and your first month is free when you sign up forinteractive monitoring. Visit https://SimpliSafe.com/MillennialFarmer to learn more!A PARTY LIKE NO OTHER! Join us July 1st, 2022 in Alexandria, MN to Celebrate 1 Million Subscribers (hopefully), enjoy some great music and contribute to a great cause! We're teaming up with Anderson Bash to kick off our Grain Bin Safety Campaign again! The goal of this campaign is to reduce the occurrence of grain bin accidents by raising awareness of the hazards and by raising funds to equip first responders with the tools and training needed to respond quickly when necessary in the event of a grain bin accident. The funds raised will be used to purchase Grain Bin Rescue kits and training for first responders. #GrainBinSafety Can we hit our $100,000 goal and 1 Million Subscribers?! Free Will Donation, Donate today! ►https://www.gofundme.com/f/grain-bin-safetyOrder Millennial Farmer Merchandise: ►https://www.mnmillennialfarmer.com/ Check out our 2nd Channel@Between The Rows Off The Husk With The Millennial Farmer Podcast Listen Here: ►https://www.mnmillennialfarmer.com/podcast Farmers Business Network FBN membership is now FREE! Start maximizing your farm's profit potential today. ►https://use.fbn.com/MN-MILLENNIAL-FARMER Yankum RopesPROMO CODE MFARMER►https://yankum.com/?afmc=1sGet my Sunglasses Gatorz ►https://www.gatorz.com?aff=mnmillennialfarmer&utm_campaign=referral-program Drink Northern Chill 20% off using code MNFARMER20 ► www.northernchill.com Maximum Hearing Protecting and Hearing Enhancement with Blue Tooth Technology ►https://goaxil.com/?rfsn=6419650.f3c859 Coupon Code: FARMER1 OTHER COOL STUFF like my watch here: ►https://www.amazon.com/shop/mnmillennialfarmer?listId=W464BJJLJY8I&ref=idea_share_inf Bringing Magical Moments to Millennial Farmer Fans:►https://www.cameo.com/millennialfarmer?utm_campaign=profile_share Book The Millennial Farmer to Speak at your Next Event: ►mnmillennialfarmer@gmail.com Field Work Podcast Listen on Apple Music, Google and Spotify: ►https://www.fieldworktalk.org/ Zach Johnson, the “Millennial Farmer” is a 5th-generation farmer who’s spent his life growing, working, and learning on his family’s farm. His wit and dry sense of humor appeal to children and adults alike. A product of the millennial generation, his appreciation of new technology blends with his old-fashioned work ethic, and he offers a unique ability to deliver his message in a way that resonates with lifelong farmers as well as those with no knowledge of agriculture. With growing consumer awareness about where their food comes from, Zach has identified the need for an independent voice from the front lines of agriculture. Zach actively promotes agriculture by sharing his day-to-day experiences in the agriculture world while providing farmer-to-farmer education to help facilitate a collaborative conversation between farmers and the public. Follow Along ►https://www.instagram.com/mnmillennialfarmer/ ►https://www.facebook.com/MNMILLENNIALFARMER/ ►https://twitter.com/farmmillennial Edited By: Becky Johnson"
"7NgK3PSgzbk","Danny Garcia vs. Jose Benavidez Jr: Highlights | SHOWTIME CHAMPIONSHIP BOXING","2022-07-31T04:23:38Z","UCFPoJNd0d4k1H9A6UOlikcg","SHOWTIME Sports","17","22.01.08","showtime|shosports|sports|Gary Russell Jr.|russell jr|russell|nyambayar|russell jr vs nyambayar|king tug|wbc featherweight|wbc|challenger|showtime boxing|boxing|shosports boxing|showtime sports boxing|shobox|shoboxing|teaser|Presser|Press Conference|Danny Garcia|garcia Benavodez|Jose benavidez|Jose Benavidez|Gary Antuanne Russell|Gary Russell|Danny Garcia Highlights|Vito Mielnicki|Sergiy Derevyanchenko|Philly|Phoenix","646847","0","0","1009","https://i.ytimg.com/vi/7NgK3PSgzbk/default.jpg","False","True","In a triple-header, two-division world champion and Brooklyn fan-favorite Danny Garcia impressed with a decision win over Jose Benavidez Jr. his 154-pound debut. Plus, Gary Antuanne Russell and Ali Eren Demirezen pick up huge wins.#SHOSports #dannygarcia #josebenavidez #garciabenavidez #boxing Don't miss out on the action! Visit the below links to sign up for reminders!Championship Boxing: https://s.sho.com/3oiG6REBellator: https://s.sho.com/3eSmXDbSubscribe to the SHOWTIME Sports YouTube channel: https://goo.gl/s8CWVTFollow SHOWTIME Sports:Facebook: https://www.facebook.com/ShoSports/Twitter: https://twitter.com/SHOsportsInstagram: https://instagram.com/shosportsOfficial Site: https://www.sho.com/sportsFollow SHOWTIME Boxing:Facebook: https://www.facebook.com/ShoBoxingTwitter: https://twitter.com/ShowtimeBoxingInstagram: https://instagram.com/showtimeboxingSnapchat: https://www.snapchat.com/add/showtimeboxingTumblr: http://showtimeboxing.tumblr.com/Follow SHOWTIME Basketball:Instagram: https://www.instagram.com/showtimebasketballTwitter: https://twitter.com/shobasketballFollow ALL THE SMOKE:Instagram: https://www.instagram.com/allthesmoke/YouTube: https://bit.ly/2OLkr50 Follow BELOW THE BELT with Brendan Schaub:Facebook: https://www.facebook.com/BelowTheBeltSHOTwitter: https://twitter.com/btbshowtimeInstagram: https://www.instagram.com/belowthebelt/YouTube: http://s.sho.com/BelowtheBeltFollow MORNING KOMBAT:Instagram: https://www.instagram.com/morningkombat/YouTube: https://bit.ly/2lPpvsjFollow INSIDE THE NFL:Facebook: https://www.facebook.com/insidetheNFLTwitter: https://twitter.com/insidetheNFLInstagram: https://www.instagram.com/insidetheNFL/Follow 4th and Forever:Instagram: https://www.instagram.com/4thandforever/YouTube: http://bit.ly/30iZqSZFollow SHOWTIME:Facebook: https://www.facebook.com/showtimeTwitter: https://twitter.com/ShowtimeInstagram: https://instagram.com/showtime/Youtube: https://www.youtube.com/user/SHOWTIMEOfficial Site: https://www.sho.com/"
"KeJHlsgz7cw","Spectacular Tiny House Boat with The Most STUNNING Interior! Full Tour","2022-07-30T13:00:10Z","UC8EQAfueDGNeqb1ALm0LjHA","Exploring Alternatives","26","22.01.08","tiny|house|float|home|boat|house boat|float home|living|lifestyle|retrofit|renovation|restoration|wood|wooden|tour|interior|shipwright|carpenter|Jason|Pax|Cayley|Exploring Alternatives|design|modern|rooftop|deck|bench|dinette|woodwork|galley|head|loft|catwalk|two story|storey|micro|liveaboard|marina|dock|Victoria|Canada|yearround|heat|heater|storage|staircase|ladder|living room|salon|saloon|epic|incredible|best|new|2022|for sale|moorage|mooring|BC|before|after|Expo|86|experience","248615","0","0","441","https://i.ytimg.com/vi/KeJHlsgz7cw/default.jpg","False","True","Pax is a tiny float home that was lovingly restored and renovated by Jason and Cayley over the course of a year and a half.  It was one of 25 boats built in Victoria, Canada for Expo '86 but it had fallen into disrepair.   With some incredible woodwork and craftsmanship by the pair, respectively a shipwright and a carpenter, it's now an absolutely stunning 1 bedroom home on the water!! You can follow Jason on Instagram here:https://www.instagram.com/wood_and_wind/ This boat is for sale and you can check out the boat listing here:https://www.realtor.ca/real-estate/24531504/a22-525-head-st-esquimalt-old-esquimaltThe houseboat is packed with neat features: a head with a composting toilet and a livestock trough bathtub, a chart table, a bright galley, a handmade curved cedar dinette, a storage staircase, cozy sleeping and relaxing lofts that are connected by a catwalk, and a ladder that leads to a rooftop deck.  Thanks for watching!Mat & Danielle-------------------------------------------------------------STAY IN TOUCH!-------------------------------------------------------------Website: www.exploringalternatives.caFacebook: https://www.facebook.com/exploringalternativesblogInstagram: https://www.instagram.com/exploringalternatives/-------------------------------------------------------------COMMENTS-------------------------------------------------------------We want our channel and our comments section to be an inclusive space where everyone feels welcome to watch and contribute.  For this reason, comments that are inappropriate or hateful will be reported and/or deleted.Please discuss and debate with respect, and report inappropriate or hateful comments directly to YouTube.-------------------------------------------------------------CREDITS-------------------------------------------------------------Music & Song Credits: All music in this video was composed, performed, and recorded by Mat of Exploring Alternatives.Editing Credits:Mat and Danielle of Exploring AlternativesFilming Credits:Alex Harrishttps://alexharrris.com/ Photo Credits:- Photos of the build provided by Jason and Cayley- Photos from the listing by Stellar Real Estate Marketing and provided to us by Maurice Connor#floathome #houseboat #tinyhouse"
"ZI9ZHBRc2yQ","THROWN to the SEA like a PAPER AIRPLANE!","2022-07-30T14:00:43Z","UCwpHKudUkP5tNgmMdexB3ow","Mentour Pilot","27","22.01.08","true crime|crime stoires|storytelling|captain|mentour pilot|mentor pilot|crash investigation|full epsiodes|aviation|pilot|crash|air crash investigation|final report|boeing|airbus|piper|cessna|disaster|fatal crash|air incident|air disasters 2022|UAE|dubai|challenger|male|maldives|turbulence|a380|wake","378578","0","0","1366","https://i.ytimg.com/vi/ZI9ZHBRc2yQ/default.jpg","False","True","Get 20% discount on the yearly subscription of Brilliant by using this code 👉🏻 https://brilliant.org/Mentourpilot/On the 7th January 2017 a #Challenger 604 private #business jet was travelling between Velana International Airport in Malé and #Dubai International Airport in the United Arab Emirates.  An Airbus A380 was passing overhead at the same time in the same location heading in the opposite direction when disaster struck.  How dangerous can wake #turbulence be?  Let’s fin out...If you want to support the work I do on the channel, join my Patreon crew and get awesome perks and help me move the channel forward! 👇👉🏻 https://www.patreon.com/mentourpilot👉🏻 Check out our other channel here: youtube.com/mentournowGet the Mentour Aviation app and discuss what You think about this! Download the app for FREE using the link below 👇📲https://www.mentourpilot.com/apps/📲 Join the Mentour Pilot Discord server here! 👉🏻 https://discord.gg/JntGWdnI have also created an Amazon page with Aviation books, material and flight simulator stuff that I think you will enjoy! 👉🏻 https://www.amazon.com/shop/mentourpilotFollow my life on instagram and get awesome pictures from the cockpit!📲 https://www.instagram.com/mentour_pilotTo find the right HEADSET for YOU, check out BOSE Aviation 👉🏻 https://boseaviation-emea.aero/headsetsArtwork in the studio 👉🏻 https://aeroprints.de/?lang=enGet some Awesome Mentour Pilot merch 👉🏻 https://mentour-crew.creator-spring.com/?Below you will find the links to videos and sources used in this episode. Enjoy checking them out! Sources-----------------------------------------------------Final Report:https://reports.aviation-safety.net/2017/20170107-0_CL60_D-AMSC_PRELIM.pdfVortex Example Video: Topfelyahttps://www.youtube.com/watch?v=hQ6Wy4S3hag&ab_channel=TopfelyaA380 Takeoff: Topfelyahttps://www.youtube.com/watch?v=4vhodQxe-FI&ab_channel=TopfelyaRVSM Example: Noel Philipshttps://www.youtube.com/channel/UC2O6HDtMOZf9FkUAepz9AtgEmirates A380: Maarten Visserhttps://en.wikipedia.org/wiki/Airbus_A380Challenger 650: Unknownhttps://www.businessairportinternational.com/news/vertis-aviation-adds-africa-based-challenger-604-to-portfolio.html#prettyPhoto/0/Wake Turbulence: IVAO - International Virtual Aviation Organisationhttps://mediawiki.ivao.aero/index.php?title=Wake_turbulenceCHAPTERS-----------------------------------------------------00:0000:35 - Flight History01:44 - Weather and Turbulence04:06 - Takeoff For Both Aircraft04:59 - Highways In The Sky06:36 - A Little Physics12:19 - The A380 Passes Overhead16:02 - More Problems16:45 - Diversion18:32 - Muscat Landing19:35 - Preliminary Findings"
"R4C8JXCCak4","The Doc Rivers-Bill Simmons beef is what happens when the media are fans","2022-07-30T15:00:14Z","UCDRmGMSgrtZkOsh_NQl4_xw","Secret Base","17","22.01.08","basketball|beef|beef history|bill simmons|boston celtics|celtics|doc rivers|grantland|la clippers|los angeles clippers|nba|nba draft|paul pierce|sb nation|secret base|sports beef|the ringer|media feud|big three|sbnation|seth rosenthal","293740","0","0","1018","https://i.ytimg.com/vi/R4C8JXCCak4/default.jpg","False","True","Before he became a media mogul, Bill Simmons was a Celtics fan. While Simmons was getting super famous, the Celtics weren't very good. The man overseeing that not-very-goodnesss was coach Doc Rivers. So Bill's problems became Doc's problems, and vice versa. This is what happens when one of the biggest stars in sports media cares deeply and publicly about a particular team, and the guy running team isn't just going to take it all in stride. It got awkward, and it got beefy.Directed and edited by Ryan SimmonsWritten and produced by Seth RosenthalSubscribe: http://goo.gl/Nbabae Enter the Secret Base: http://www.sbnation.com/secret-base Follow us on Twitter: https://twitter.com/secretbase Follow us on Twitch: https://www.twitch.tv/secretbasesbn Follow us on Tiktok: https://www.tiktok.com/@secretbasesbn? Check out our full video catalog: http://goo.gl/9pMHRV Visit our playlists: http://goo.gl/NvpZFF Explore SB Nation: http://www.sbnation.com"
"jIhgSccZ1OQ","Why 2b2t's Obsidian is Being DELETED","2022-07-30T13:59:26Z","UCHZ986wm_sJT6wntdDTIIcw","FitMC","20","22.01.08","minecraft|history|update|mobs|creeper|raid|nether|sea|monster|dragon|red|2b2t|anarchy|server|fitmc|fit|oldest|builds|tour|battle|spawn|grief|hack|client|incursion|tutorial|herobrine|hacked|exploit|glitch|mojang|flying|redstone|smp|live|campfire|blast|furnace|memes|house|respawn|pvp|popbob|animation|speedrun|duplication|bed|minecon|mc|unsolved|mystery|end|caves|cliffs|warden|fotmc|tb2t|1.19|wild|2n2t|maybe instead of reading youtube tags you should hit the gym loser","526534","0","0","1642","https://i.ytimg.com/vi/jIhgSccZ1OQ/default.jpg","False","True","Today we'll discuss Why 2b2t's Obsidian is Being DELETED in Minecraft, and the insane methods used to do so.Get Honey for FREE today - https://joinhoney.com/fitmcHoney finds coupons with one click. Thanks to Honey for sponsoring!My Twitter: https://twitter.com/FitMCMy Instagram: https://www.instagram.com/fitmcsippycupAdditional Thanks:flowerscow on deviantart (Steve render)IronException (Maps, renders)oofplux (Info, footage)Dawnfall (Info, renders)Socks (Footage)Music:Banjo TooiePSOSMB2If you enjoyed this video about Why 2b2t's Obsidian is Being DELETED, I would appreciate if you would consider hitting that like and subscribe button!This video has nothing to do with speedrunners, 100 days, Mojang's chat reporting, hardcore, minecraft but or any of those other topics."
"SiM1At3O53E","CA sheriff orders raid on Indiana Batmobile garage, allegedly as favor for friend - EXCLUSIVE","2022-07-30T03:25:19Z","UCYUbNjkuE4lsr2v1Id2O1oA","ABC7 News Bay Area","25","22.01.08","abc|abc7 news|batmobile raid indiana|San Mateo County sheriff Carlos Bolanos|Fiberglass Freaks of Logansport|batmobile factory raided|san mateo county political favor|i-team investigation|batmobile|batman","2292207","0","0","11149","https://i.ytimg.com/vi/SiM1At3O53E/default.jpg","False","True","Holy political favors, Batman! That's the allegation against San Mateo County Sheriff Carlos Bolanos for sending a four-man team across the country last week, to raid the garage that builds Batmobiles. Read the ABC7 News I-Team report here: https://abc7ne.ws/3Q8tglN#Batmobile #raid"
"UokftMGmVQ8","I Bought 1,000 Lottery Tickets and Won!","2022-07-31T11:45:01Z","UC1KEUx2QaKBYmsPLfjOB_8w","TFG Vlogs","22","22.01.08","i bought 1000 lottery tickets|1000 lottery tickets|lottery tickets|scratch off tickets big win|scratch off tickets|tfg vlogs|frustrated gamer vlogs|tfg|tfg vlogs lottery|lottery|lottery winner|winning the lottery|scratch offs|i bought 1000 Lottery Tickets and Won","149361","0","0","516","https://i.ytimg.com/vi/UokftMGmVQ8/default.jpg","False","True","I Bought 1,000 Lottery Tickets and Won | TFG Vlogs are back and today I will be buying 1000 scratch off lottery tickets to see how much money I make! Will we win the $1 million prize? There will be a new tfg vlog every Sunday so stay tuned! #LotteryTicket #TFGVlogs #TFG ► Can I Find REAL GOLD?! https://youtu.be/omEdhW-n0qc ► Follow me on Instagram! https://www.instagram.com/tfgvlogs"
"nMXbt2owOLI","New Punjabi Song 2022 | 2-4 -Deep Bajwa ft Gurlez Akhtar - DJ Flow | Latest Punjabi song 2022","2022-07-30T11:10:06Z","UCK9_-_jUGP4XpxvxZD6P7yA","Ishqpura07 films","10","22.01.08","new punjabi song 2022|deep bajwa|gurlej akhtar|latest punjabi song 2022|2-4|2-4 punjabi song|deep bajwa new song|deep bajwa song|gurlej akhter|deep bajwa punjabisong|gurlej akhtar new song|punjabi song gurlej akhtar|2-4 gurlej akhtar|Gurlej Akhter|gurlej akhtar song 2022|new gurlej akhter|deep bajwa song 2-4|punjabi song|latest punjabi song|deep bajwa gurlez akhtar|isqpura07|devu digital|song|new song","1428630","0","0","2187","https://i.ytimg.com/vi/nMXbt2owOLI/default.jpg","False","True","Ishqpura7  Proudly Presents a Video of ( 2-4 ਦੋ ਚਾਰ )Song, Sung by Deep Bajwa and Written by Laala Gill UP. The music is given by Dj Flow. The Video is Directed by Param Chahal. Enjoy and stay connected with us !! For More Updates Subscribe Our Official Youtube Channel For Upcoming songs : https://bit.ly/3JLLSWdIshqpura07Song - 2-4  ( ਦੋ ਚਾਰ )Singer - Deep Bajwa Ft. Gurlez Akhtar Female Lead - Mahi SharmaMusic - DJ FlowLyrics - Laala Gill UPDOP - Syad TanvirEditor - Jagjeet Singh Dhanoa Publicity Design - Sumit BamalMake up - Sudhir Desigen - Manvir Photogrply - Gourav Photography Editor - Jagjeet DhonaProducer - Monty Kamboj / Shera Begu / Kamal SandhuDirected By - Param ChahalYoutube Promotion : BEING DIGITALPromotion - Devu DigitalStay Connected with  ..SUbscribe us -- https://bit.ly/3JLLSWdIshqpura7"
"k_Xwk6Afo1U","MrBeast Hit 100,000,000 Subs So I Did This...","2022-07-30T14:45:02Z","UC70Dib4MvFfT1tU6MqeyHpQ","Preston","24","22.01.08","funny|challenge|family|comedy|preston|brianna","3372380","0","0","7230","https://i.ytimg.com/vi/k_Xwk6Afo1U/default.jpg","False","True","Preston’s Back to School Bundles and Giveaway are now LIVE on firemerch.com (http://firemerch.com/) 👊 Don’t forget to enter🔥MrBeast Hit 100,000,000 Subs So I Did This...with Preston 👊👕 MERCH - http://www.firemerch.com 👀 FOLLOW ME HERE!🡆 TikTok - https://www.tiktok.com/@preston🡆 Instagram - https://instagram.com/prestonplayz🡆 Twitter - https://twitter.com/Preston🡆 PrestonShorts - https://bit.ly/2VrTLIr🎮 Join my Fan Discord! 🡆 http://discord.gg/Preston------------------------------Additional music provided by Epidemic SoundClick here for a free trial! 🡆 http://share.epidemicsound.com/TBNR"
"WDZmnkfaDF4","ASMR Shivers Down Your Spine (childhood back tracing games)","2022-07-30T21:45:51Z","UClMJgjg2z_IrRm6J9KrhcuQ","Goodnight Moon","22","22.01.08","[none]","183927","0","0","452","https://i.ytimg.com/vi/WDZmnkfaDF4/default.jpg","False","True","Get your first purchase from Blueland for 15% off by clicking my link https://bit.ly/3OyhoYY ! Now shipping to the U.S., Canada, the U.K., Australia & New Zealand!"
