video_id,title,publishedAt,channelId,channelTitle,categoryId,trending_date,tags,view_count,likes,dislikes,comment_count,thumbnail_link,comments_disabled,ratings_disabled,description
"B-gHb2gPGIs","SIDEMEN TINDER IN REAL LIFE 4 (USA YOUTUBE EDITION)","2022-07-24T16:55:10Z","UCDogdKl7t7NHzQ95aEwkdMw","Sidemen","24","22.01.08","sidemen|sidemen sunday|#sidemensunday","22274803","0","0","46800","https://i.ytimg.com/vi/B-gHb2gPGIs/default.jpg","False","True","IMPAULSIVE:Logan: https://www.youtube.com/c/loganpaulvlogsMike: https://www.youtube.com/c/MikeMajlakVlogsGeorge: https://www.youtube.com/c/GeorgeJankoGIRLS:Elena Kamperi: https://www.instagram.com/elenakamperi/Sky Bri: https://www.instagram.com/realskybri/Ashley Got: https://www.instagram.com/ashley.got/Tana Mongeau: https://www.instagram.com/tanamongeau/Abby Rao: https://www.instagram.com/abbyrao/Juju: https://www.instagram.com/sincerelyjuju/Emily Willis: https://www.instagram.com/emilywillisx3/Mia Malkova: https://www.instagram.com/miamalkova/🎥: Access exclusive content at: https://watch.sideplus.com/checkout/subscribe/purchase🍗: Order food NOW at: https://www.eatsides.com/🍹: XIX Vodka: https://www.xixvodka.com/👉🏻: Subscribe to our Reacts Channel: https://www.youtube.com/SidemenReacts 👈🏻👕: Sidemen Clothing: http://www.sidemenclothing.com👉🏻 Subscribe to our 2nd Channel: https://www.youtube.com/MoreSidemen 👈🏻📸: Sidemen Instagram: http://www.instagram.com/Sidemen🐤: Sidemen Twitter: http://www.twitter.com/Sidemen✏️: SUBMIT A #SidemenSunday IDEA HEREhttps://forms.gle/JDuGrSzM4F6mdo6D9-----------------------------------------------------------------------------------------------------------------------▶️ SIDEMEN ◀️🔵 JOSH (Zerkaa)● http://www.youtube.com/Zerkaa● http://www.youtube.com/ZerkaaPlays● http://www.instagram.com/Zerkaa● http://www.twitter.com/ZerkaaHD🔴 HARRY (W2S)● http://www.youtube.com/W2S● http://www.youtube.com/W2SPlays● http://www.instagram.com/Wroetoshaw● http://www.twitter.com/Wroetoshaw🔵 VIK (Vikkstar123)● http://www.youtube.com/Vikkstar123● http://www.youtube.com/Vikkstar123HD● http://www.youtube.com/VikkstarPlays● http://www.instagram.com/Vikkstagram● http://www.twitter.com/Vikkstar123🔴 JJ (KSI)● http://www.youtube.com/KSI● http://www.youtube.com/KSIOlajidebtHD● http://www.instagram.com/KSI● http://www.twitter.com/KSIOlajidebt🔵 TOBI (Tobjizzle)● http://www.youtube.com/TBJZL● http://www.youtube.com/Editingaming● http://www.instagram.com/Tobjizzle● http://www.twitter.com/Tobjizzle🔴 ETHAN (Behzinga)● http://www.youtube.com/Behzinga● http://www.youtube.com/Beh2inga● http://www.instagram.com/Behzingagram● http://www.twitter.com/Behzinga🔵 SIMON (Miniminter)● http://www.youtube.com/Miniminter● http://www.youtube.com/MM7Games● http://www.instagram.com/Miniminter● http://www.twitter.com/Miniminter"
"tVWWp1PqDus","100 Girls Vs 100 Boys For $500,000","2022-07-23T20:00:09Z","UCX6OQ3DkcsbYNE6H8uQQuVA","MrBeast","24","22.01.08","[none]","43122997","0","0","100043","https://i.ytimg.com/vi/tVWWp1PqDus/default.jpg","False","True","Giving away $25k on Current! Sign up and use my code “BEAST250” for a chance to win*: https://www.current.com/beast250SUBSCRIBE OR I TAKE YOUR DOG╔═╦╗╔╦╗╔═╦═╦╦╦╦╗╔═╗║╚╣║║║╚╣╚╣╔╣╔╣║╚╣═╣ ╠╗║╚╝║║╠╗║╚╣║║║║║═╣╚═╩══╩═╩═╩═╩╝╚╩═╩═╝----------------------------------------------------------------follow all of these or i will kick you• TikTok - https://www.tiktok.com/@mrbeast• Twitter - https://twitter.com/MrBeast• Instagram - https://www.instagram.com/mrbeast• Facebook - https://www.facebook.com/MrBeast6000/• Official Merch  - https://www.shopmrbeast.com/• Beast Philanthropy - https://www.beastphilanthropy.org/Text me @ +1 (917) 259-6364I'm Hiring! - https://www.mrbeastjobs.com/Order a beast burger 🍔 -  https://mrbeastburger.comChocolate 🍫 Win a Tesla or be in a MrBeast video - Buy now ▸ https://feastables.com-----------------------------------------------------------------—Current is a financial technology company, not a bank. Banking services provided by Choice Financial Group, Member FDIC. The Current Visa Debit Card is issued by Choice Financial Group pursuant to a license from Visa U.S.A. Inc. and may be used everywhere Visa debit cards are accepted.*NO PURCHASE OR PAYMENT NECESSARY TO ENTER OR WIN. Open to legal residents of the 50 U.S./D.C., age 18+ (19+ in AL and NE, 21+ in MS). Void outside the 50 U.S./D.C. and where prohibited. Sweepstakes starts at 12:00:01 AM ET on 7/9/22; ends at 11:59:59 PM ET on 10/9/22. Odds of winning will depend upon the number of eligible entries received. For full Official Rules and how to enter without becoming a Current member, visit https://www.current.com/beast250. Sponsor: Finco Services, Inc. d/b/a Current, 30 Cooper Square, Floor 4, New York, NY 10003."
"wwkH0prchjQ","Minecraft Speedrunner VS $1,000,000 MrBeast Challenge","2022-07-30T09:15:09Z","UCTkXRDQl0luXxVQrRQvWS6w","Dream","20","22.01.08","Dream Minecraft|dream Minecraft youtube|minecraft|dream|Speedrunner vs 3 hunters|Speedrunner vs someone trying to stop them|Beating Minecraft but my friend tries to stop me|Minecraft but water rises every minute|minecraft but lava rises every minute|minecraft but challenge|minecraft challenge|challenge|minecraft 1.14|beating minecraft|rematch|finale|finale rematch|grand finale|grand","8813978","0","0","51811","https://i.ytimg.com/vi/wwkH0prchjQ/default.jpg","False","True","Minecraft Speedrunner VS $1,000,000 MrBeast Challenge. This was INSANE. A new challenge.Patreon (Plugin): https://www.patreon.com/DreamWasTakenFree $15 with Code DREAMYT: http://cash.app/13+Follow my socials:➽ Twitter - @dream➽ Instagram - @dreamwastaken➽ Snapchat - @dreampublicMerch: https://www.dream.shopMr Beast: @MrBeast BadBoyHalo: @BadBoyHalo George: @GeorgeNotFound Sapnap: @Sapnap This video is a different rendition of my normal challenge videos, where there are THREE hunters trying to stop me from beating Minecraft.We're so close to 30 million subscribers! Make sure to subscribe :) also congrats to Mr Beast on 100 million!!!In this challenge, the pot starts at 1 million dollars and it goes down $69 every 1 second. When I beat the game, the money that's left is given away to a RANDOM SUBSCRIBER! So make sure to subscribe! There's a catch though. If I don't beat the game quick enough, the money goes into the negatives, and that's how much I have to pay my 3 friends that are hunting me down!It's a race, and it's super intense and we had a lot of laughs. I love doing these challenges.If this video gets 1,000,000 likes, I might try and convince someone else to do it! Not Minecraft, But Water Rises or Minecraft, But Lava Rises, or any other but challenge like that. This is a speed run / speed runner of Minecraft against a killer / assassin#MrBeastHunt"
"dZklZVaU4AI","100,000,000 Subscriber Special","2022-07-31T21:00:01Z","UCX6OQ3DkcsbYNE6H8uQQuVA","MrBeast","24","22.01.08","[none]","4748398","0","0","37418","https://i.ytimg.com/vi/dZklZVaU4AI/default.jpg","False","True","Set a reminder for Thursday, August 4th 4pm EST #shorts #mrbeast"
"EE6YRQABzEI","SIDEMEN $100,000 vs $100 HOLIDAY (USA EDITION)","2022-07-31T18:42:35Z","UCDogdKl7t7NHzQ95aEwkdMw","Sidemen","24","22.01.08","sidemen|sidemen sunday|#sidemensunday","5481522","0","0","14467","https://i.ytimg.com/vi/EE6YRQABzEI/default.jpg","False","True","SIDEMEN $100,000 vs $100 USA HOLIDAY is FINALLY here! VARSITY COLLECTION AVAILABLE NOW: http://www.sidemenclothing.com🍹: XIX Vodka: https://www.xixvodka.com/🍗: Order food NOW at: https://www.eatsides.com/🎥: Access exclusive content at: https://www.sideplus.com/👉🏻: Subscribe to our Reacts Channel: https://www.youtube.com/SidemenReacts 👈🏻👕: Sidemen Clothing: http://www.sidemenclothing.com👉🏻 Subscribe to our 2nd Channel: https://www.youtube.com/MoreSidemen 👈🏻📸: Sidemen Instagram: http://www.instagram.com/Sidemen🐤: Sidemen Twitter: http://www.twitter.com/Sidemen✏️: SUBMIT A #SidemenSunday IDEA HEREhttps://forms.gle/JDuGrSzM4F6mdo6D9-----------------------------------------------------------------------------------------------------------------------▶️ SIDEMEN ◀️🔵 JOSH (Zerkaa)● http://www.youtube.com/Zerkaa● http://www.youtube.com/ZerkaaPlays● http://www.instagram.com/Zerkaa● http://www.twitter.com/ZerkaaHD🔴 HARRY (W2S)● http://www.youtube.com/W2S● http://www.youtube.com/W2SPlays● http://www.instagram.com/Wroetoshaw● http://www.twitter.com/Wroetoshaw🔵 VIK (Vikkstar123)● http://www.youtube.com/Vikkstar123● http://www.youtube.com/Vikkstar123HD● http://www.youtube.com/VikkstarPlays● http://www.instagram.com/Vikkstagram● http://www.twitter.com/Vikkstar123🔴 JJ (KSI)● http://www.youtube.com/KSI● http://www.youtube.com/KSIOlajidebtHD● http://www.instagram.com/KSI● http://www.twitter.com/KSIOlajidebt🔵 TOBI (Tobjizzle)● http://www.youtube.com/TBJZL● http://www.youtube.com/Editingaming● http://www.instagram.com/Tobjizzle● http://www.twitter.com/Tobjizzle🔴 ETHAN (Behzinga)● http://www.youtube.com/Behzinga● http://www.youtube.com/Beh2inga● http://www.instagram.com/Behzingagram● http://www.twitter.com/Behzinga🔵 SIMON (Miniminter)● http://www.youtube.com/Miniminter● http://www.youtube.com/MM7Games● http://www.instagram.com/Miniminter● http://www.twitter.com/Miniminter"
"QKK1qOdBIPw","My Daughter's SECRET NIGHT ROUTINE! *Instagram Q&A*","2022-07-31T14:00:12Z","UCKaCalz5N5ienIbfPzEbYuA","Jordan Matter","24","22.01.08","jordan matter|nailish|saysay matter|salish matter|hudson matter|morning routine|night routine|nighttime routine|beauty|nails|hairt|styling|facemask|face products|essie|florence by mills|millie bobby brown|grwm|get ready with me|hair|nidal wonder","3004149","0","0","17934","https://i.ytimg.com/vi/QKK1qOdBIPw/default.jpg","False","True","Wait to see what she does when I go to sleep 😱SALISH'S FAVORITE PRODUCTS: Hair: JVN https://jvnhair.com/collections/shop-all?utm_source=youtube&utm_medium=social&utm_campaign=jordanmatter / Hairitage https://hairitagebymindy.com/products/light-as-a-feather-leave-in-conditionerFace: Florence By Mills (Millie Bobby Brown) https://florencebymills.com/ / Tula https://www.tula.com/products/super-calm-gentle-milk-cleanserLips: Miss Spa https://miss-spa.com/collections/lips / Laneige https://us.laneige.com/collections/lip-products/products/lip-sleeping-maskNails: Sally Hansen https://www.sallyhansen.com/enus/?cid=usa_search_google_sally%20hansen_exact&gclid=CjwKCAjwrZOXBhACEiwA0EoRDxfc5dHLXEfWMxoV3vKUWYUJwuy5C0EtlJEc4reWG_-bDmd-8J9y1xoCuVMQAvD_BwE / Essie https://www.essie.comCandle: Coastal Wind https://www.target.com/p/milky-white-glass-glass-woodwick-with-wood-lid-and-stamped-logo-coastal-wind-and-lavender-threshold/-/A-83961168?preselect=83045025#lnk=sametabMy Daughter's Epic SUMMER MORNING ROUTINE! *Instagram Q&A* https://youtu.be/e_ACUluskzwSUBSCRIBE & FOLLOW:Me: https://www.youtube.com/user/jordanmatterSalish: https://www.instagram.com/saysaymatter/Hudson: https://www.youtube.com/c/HudsonMatterRohan: https://www.instagram.com/rohanthomp/Dog Bakery: https://www.instagram.com/thedogbakery/SUBSCRIBE, LIKE and SHARE this video! Turn on POST NOTIFICATIONS to get notified whenever I post! https://www.youtube.com/user/jordanmatterMERCH: https://shopjordanmatter.com/Business Inquiries: info@jordanmatter.comVideo by Sandy ChaseMusic licensed through Artlist and Epidemic SoundWow, if you're still reading you are awesome! BOOOMMMM!!"
"_spuxXnul0U","HELLUVA BOSS - THE CIRCUS // S2: Episode 1","2022-07-30T17:00:20Z","UCzfyYtgvkx5mLy8nlLlayYg","Vivziepop","1","22.01.08","Helluva Boss|Helluva Boss cartoon|Helluva Boss animation|Helluva Boss official|Helluva Boss Official episode|Helluva Boss Loona|Helluva Boss Blitz|Helluva Boss Moxxie|Helluva Boss Millie|Helluva Boss Blitzo|helluva boss vivziepop|helluva boss new|helluva boss new episode|helluva boss season 2|helluva boss season 2 episode 1|helluva boss season 2 the circus|helluva boss the circus","7077266","0","0","60951","https://i.ytimg.com/vi/_spuxXnul0U/default.jpg","False","True","So you guys like backstories? Cuz things sure did happened.WARNING: for daddy issues.HELLUVA BOSS MERCH AVAILABLE ► https://sharkrobot.com/vivziepopHELLUVA SEASON TWO IS HERE!! Thank you all for the patience and understanding! We have been hard at work on these new episodes and cannot wait to bring you more soon! For those expecting part II of the S1 finale, we ran into a roadblock but season two will continue until we are able to get it out! We are just happy we can bring you more now. Thank you endlessly for the support in the meantime, we hope you enjoy this labor of love!WANT MORE? WATCH OUR OTHER EPISODES!Pilot Episode ► https://www.youtube.com/watch?v=OlahNrlcgS4S1 Episode One ► https://www.youtube.com/watch?v=el_PChGfJN8S1 Episode Two ► https://www.youtube.com/watch?v=kpnwRg268FQS1 Episode Three ►  https://www.youtube.com/watch?v=RghsgkZKedgS1 Episode Four ► https://www.youtube.com/watch?v=1ZFseYPmkAkS1 Episode Five ► https://www.youtube.com/watch?v=h2ZmVAdezF8S1 Episode Six ► https://youtu.be/yXErLiSbxXQS1 Episode Seven ► https://youtu.be/8zyGQquL8VMOr Support on Patreon!https://www.patreon.com/VivienneMedranoThumbnail by Gasu!#HelluvaBoss #HelluvaBossSeason2 #SEASONTWO"
"cArmrPDp8sY","День сто пятьдесят шестой. Беседа с @Alexey Arestovych Алексей Арестович","2022-07-29T19:47:47Z","UCQVtD_N4OeD-9PshBq7NwyQ","ФЕЙГИН LIVE","25","22.01.08","фейгин live|фейгин лайф|марк фейгин|mark feygin|фейгин|марк фейгин стрим|фейгин марк|новости|политика|экономика|общество|прямой эфир|прямая трансляция|стрим|Society|Politics|общество и политика","1981899","0","0","5142","https://i.ytimg.com/vi/cArmrPDp8sY/default.jpg","False","True","#Фейгин #ФейгинLIVE День сто пятьдесят шестой. Беседа с Алексеем Арестовичем (Киев).https://feygin-live.customprint.market/uk сайт с фирменным дизайном, если вы проживаете в Украине.https://feygin-live.myspreadshop.ie сайт с фирменным дизайном, если вы проживаете в Европе, Азии и Ближнем Востоке.https://feygin-live-usa.myspreadshop.com сайт с фирменным дизайном, если вы проживаете в Северной и Южной Америке, Африке и Тихоокеанском регионе.Подписка на PATREON https://www.patreon.com/feygin_liveЗачем нужна подписка на PATREON https://youtu.be/vcVmXQD7hrsПоддержите ФЕЙГИН LIVE: https://donate.stream/feyginliveПоддержите ФЕЙГИН LIVE: https://www.donationalerts.com/r/feygin_liveРеквизиты для поддержки проекта:Перевод с любой банковской карты https://buy.stripe.com/3cs03j5drbasg2Q004 недоступный для контроля российских регуляторов! Paypal: https://paypal.com/donate/?hosted_button_id=M77VR7HP9FELL&source=urlЯндекс-кошелек (в рублях): https://yoomoney.ru/to/4100116535768948QIWI Кошелек: https://qiwi.com/n/FEYGINLIVEBitcoin: 16rWnEwYErcknE2QWAJwRcGMw8L6cCjXLhETH: 0xe02B9F3b530a0AAf58B626Ad819672FF5c355Aee (убедитесь, что сеть верна: Ethereum (ERC20).USDC: 0xe02B9F3b530a0AAf58B626Ad819672FF5c355AeeДля пожертвований из Украины и Казахстана перечисляйте на кошельки платформы advcash.com на аккаунт feyginlive@gmail.comПодписывайтесь на Марка Фейгина в соцсетях:Твиттер Марка Фейгина - https://twitter.com/FeyginMark4Фейсбук Марка Фейгина - https://www.facebook.com/mark.feygin.z Телеграмм-канал - https://t.me/MarkFeyginПодкасты - https://castbox.fm/ch/3077294Почта для корреспонденции - feyginlive@gmail.com"
"dILGoMZ0UTk","Мы с голой жопой, а у ВСУ - HIMARS и наша техника - Стрелков","2022-07-31T12:16:36Z","UCKCVeAihEfJr-pGH7B73Wyg","УНІАН","25","22.01.08","unian|униан|уніан|news|новости|новини|#стрелков|#гиркин|#всу|#зсу|#рф|#оккупанты|#шойгу|#путин","1674025","0","0","4983","https://i.ytimg.com/vi/dILGoMZ0UTk/default.jpg","False","True","#новости​ #новостионлайн​ #новостиукраины #новини​ #свежиеновости​ #новостимира #путин #шойгу #стрелков #оккупанты #зсу #всу #рф #гиркинUA - Гіркін вкотре підтверджує успішний бойовий розвиток ЗСУ. І як ця армія зможе перемогти?До сих пор не подписаны на УНИАН в Telegram? https://t.me/uniannetRU - Гиркин в очередной раз подтверждает успешное боевое развитие ВСУ. И как эта армия сможет победить?"
"rVUC29ord2M","BREAKING 100 RULES IN 24 HOURS!!","2022-07-27T20:31:29Z","UCwVg9btOceLQuNCdoQk9CXg","Ben Azelart","24","22.01.08","ben azelart|brent rivera|Lexi rivera|stokes twins|ben Azelart girlfriend|Lexi rivera boyfriend|mylifeaseva|lexi hensler|Andrew davila|pierson|Pierson wodzynski|Jeremy hutchins|dom brack|Brent and pierson|Airrack|mrbeast|preston|unspeakable|Mathew beem|Ryan trahan|Breaking 100 laws|breaking 100 rules|in 24 hours|breaking 100 laws in 24 hours|loosing 100000 calories","12711329","0","0","16112","https://i.ytimg.com/vi/rVUC29ord2M/default.jpg","False","True","We broke 100 of the craziest rules at places like the water park, trampoline park, zoo, and many more! GET THE MERCH! https://staywildshop.comSUBSCRIBE TO: @JayPrehistoricPets @SOLOFLOW Subscribe to my friends!@Alexa Rivera@Brent Rivera@Jeremy Hutchins@Dereks Days@Cam Huff@Pierson@Dom Brack@Andrew Davila@Lexi Hensler☆ FOLLOW ME!INSTAGRAM: @BenAzelart https://www.instagram.com/benazelart/YOUTUBE: Ben Azelart https://www.youtube.com/benazelart/SNAPCHAT: @BenAzelart"
"lUzpK0tGFcE","The MrBeast MEGA-STUDIO Tour!","2022-07-28T12:11:04Z","UCMiJRAwDNSNzuYeN2uWa0pA","Mrwhosetheboss","28","22.01.08","mrbeast|mr beast|mrbeast studio|mr beast studio|mrbeast gaming|mrbeast warehouse|studio|warehosue|mrbeast live|mrbeast last to leave|camera|gear","4215977","0","0","11472","https://i.ytimg.com/vi/lUzpK0tGFcE/default.jpg","False","True","The Complete MrBeast Studio Tour - including the team, camera gear, his Gaming PC, editing computers and MUCH MORE.  The first 1,000 people to use this link will get a 1 month free trial of Skillshare: https://skl.sh/mrwhosetheboss07221Subscribe for more content (IT'S FREE) : https://goo.gl/pLg6fEIt would make my day if you could also follow me on:🌈 Instagram: https://goo.gl/OUqBBa🐦 Twitter: https://goo.gl/EFhwqL😊 Facebook: https://goo.gl/Aluzl1Amazon Affiliate links:Amazon US: https://goo.gl/3yS2aPAmazon UK: https://goo.gl/gvrsGZMy Filming Gear:https://bit.ly/35CuxwIMusic is from Epidemic sound:http://share.epidemicsound.com/pHDFT"
"LXfcQYUlia4","что происходит сейчас? что было в 2017 году?","2022-07-29T07:30:07Z","UC3XGNDKlaOvXRSMY9cGt6ig","лиззка","24","22.01.08","lizzka|лизка|лиззка","1276700","0","0","7820","https://i.ytimg.com/vi/LXfcQYUlia4/default.jpg","False","True","0:00 вступление01:00 бывстрый рекап видео2:14 про ориентацию04:00 про тюрьму07:03 про наркотики09:09 про 201717:23 завершение"
