video_id,title,publishedAt,channelId,channelTitle,categoryId,trending_date,tags,view_count,likes,dislikes,comment_count,thumbnail_link,comments_disabled,ratings_disabled,description
"Nj-EG8c11vg","Арестович о больших именах среди предателей Украины","2022-07-25T11:00:27Z","UCCcprrrcbdaj14kYPjcbj9w","В гостях у Гордона","22","22.01.08","Dmitry Gordon (Person)|Дмитрий Гордон|Гордон|В гостях у Гордона|В гостях у Дмитрия Гордона|интервью|арестович|алексей арестович|арестович интервью|арестович гордон|гордон арестович|война в украине|война|интервью арестовича гордону|арестович у гордона|арестович в гостях у гордона|интервью гордона с арестовичем|арестович гордон последнее","1563095","0","0","2612","https://i.ytimg.com/vi/Nj-EG8c11vg/default.jpg","False","True","Фрагмент интервью Дмитрия Гордона с советником руководителя Офиса президента Украины Алексеем Арестовичем. 2022 годПолное интервью: https://www.youtube.com/watch?v=mkxXRdco3BMОфициальный канал программы В гостях у Дмитрия Гордонаhttps://www.youtube.com/user/vgostyahugordona?sub_confirmation=1Официальный канал Дмитрия Гордона https://www.youtube.com/user/DmytriyGordon?sub_confirmation=1Следите за новостями и читайте аналитику на общественно-политическом сайте ГОРДОН: http://gordonua.com/По вопросам рекламы пишите на editor@gordonua.comПрисоединяйтесь к нам в соцсетях!https://www.instagram.com/gordondmytrohttps://www.facebook.com/gordondmitryhttps://www.tiktok.com/@gordondmytro?https://twitter.com/dmitry_gordonhttps://t.me/dmytrogordon_officialhttps://www.facebook.com/gordonuacomhttps://t.me/s/gordonuacomhttps://cutt.ly/Viber_GORDONhttps://twitter.com/GordonuacomВ гостях у Дмитрия Гордона — авторская программа Дмитрия Гордона, которая с 2000 года выходит на украинском телевидении. Формат программы — беседы с выдающимися современниками: деятелями культуры, искусства, науки, спорта и политики. Это люди, которым есть что сказать о себе и об эпохе. В разные годы ее героями были Николай Амосов и Михаил Горбачев, Виктор Ющенко и Леонид Кравчук, Михаил Жванецкий и Евгений Евтушенко, Муслим Магомаев и Эдуард Шеварднадзе, Олег Блохин и Владислав Третьяк, Виктор Суворов и Виктор Шендерович, Михаил Саакашвили и Борис Березовский... Всего — более 1000 знаменитостейДрузья, мы рады комментариям и дискуссии, но нецензурная лексика будет удаляться, а злостные нарушители — баниться."
"GyVYvxSf-ZQ","Победим Украину за пару дней? Россияне начинают что-то ДОГАДЫВАТЬСЯ! - Антизомби","2022-07-22T06:00:11Z","UCurJsOc2S-CyK4T7jKIolIg","Вікна-новини","25","22.01.08","вікна|вікна стб|стб|новини|новини україна|війна в україні|війна в україні 2022|війна росія україна|война в украине|война россия украина|война в украине новости|війна в україні новини|вікна стб сьогодні|вікна стб новини|головні новини|российская пропаганда|Скабеева|Соловьёв|пропаганада российских сми|антизомби|пропаганда путина|симоньян|марагарита симоньян|Скабеева и Попов|кремлёвская пропаганда|враньё российких сми|удары по складам РФ|Скабеева и Симоньян","1104279","0","0","3051","https://i.ytimg.com/vi/GyVYvxSf-ZQ/default.jpg","False","True","Матери готовы променять своих сыновей на холодильник, а на федеральных каналах продолжают кричать о том, как быстро Россия захватит Украину. Россияне врут о своих успехах, о ресурсах и оборудовании. А как тогда объяснить постоянные удары по складам РФ?Станьте спонсором цього каналу, щоб отримувати бонуси:https://www.youtube.com/channel/UCurJsOc2S-CyK4T7jKIolIg/joinРахунок Вікна СТБ ➜ https://vikna.tv/donate/?donate=menu_buttonУсі ключові новини України та світу та історії, що не залишать вас байдужими читайте ТУТ ➡️ https://vikna.tv/ Побач більше!----------------------------------------------------------------------------------Підписуйтесь на YouTube канал «Вікна-Новини»: http://goo.gl/8rSzB Вікна-новини на Facebook: https://www.facebook.com/viknaSTB/Вікна-новини у Telegram: https://t.me/viknatv#Вікнановини #війнавУкраїні #новиниУкраїни #ВікнаСТБ #FreeДОМ"
"_T2Avd3tFHc","Traveling to the “Worst” Country in Europe","2022-07-31T17:00:17Z","UCvK4bOhULCpmLabd2pDMtnA","Yes Theory","24","22.01.08","yestheory|seek discomfort|yes theory strangers|yes theory travel|yes theory subscribers|getting out of your comfort zone|Amazon FBA|moldova|travel|worst country in europe|least visited country in europe|most boring town|most boring town in america|eastern europe|moldova travel|soviet travel|yes theory soviet|transnistria|country that doesn't exist on a map","834879","0","0","3924","https://i.ytimg.com/vi/_T2Avd3tFHc/default.jpg","False","True","HAPPY SEEKERS DAY! 30% OFF all-time BEST-SELLERS ON SEEK DISCOMFORT: ⚡️ http://seek-discomfort.com/yes-theory We decided that to celebrate 7 years of Yes Theory we'll keep this once-a-year offer available for 7 days :) Now's your chance to get some!! Enjoy and see you in September!!🙏🏼 Thank you for making these videos possible through your support of Seek DiscomfortTo see whether the internet had any truth in calling this country the worst in Europe... We decided to travel to it and spend 3 days exploring in the search for a spontaneous and immersive experience. With no plan, it truly could not have ended up better than this :)Thank you to Eric for bridging our world with Mikhail’s!https://instagram.com/erictabach?igshid=YmMyMTA2M2Y=Thank you to Staffan for coming along with so many good vibes!https://instagram.com/staffantaylor?igshid=YmMyMTA2M2Y=Special Thank You to Nathan from the channel https://www.youtube.com/c/BeyondTheGuitar for letting us use the cover of Married Life at the end of the video, check out his channel for more beautiful covers and guitar lessons✈ Book an Adventure: https://travel.yestheory.com/JOIN OUR COMMUNITY⁺ Seek Discomfort: https://www.youtube.com/seekdiscomfort📝 Follow Matt’s Newsletter: http://yestheory.com/newsletter/📸 Instagram -  https://www.instagram.com/yestheory/🐦 Twitter - https://twitter.com/yestheory🎬  Facebook- https://www.facebook.com/yestheory/☮️ If you want to join the Yes Fam Facebook group which is 100,000+ of our most engaged and badass community members, you can apply here: https://www.facebook.com/groups/yesfam/🎥 HOW WE MAKE OUR VIDEOS🎵 Where we find our music:1- Epidemic Sound. Amazing royalty free music for YouTube. Free 30 day trial here: http://share.epidemicsound.com/wFFbr  2- Musicbed. Amazing label-quality cinematic music. 30-day free trial here:http://share.mscbd.fm/YesTheory​3- Artlist. 2 Months Free High Quality Music: https://artlist.io/artlist-70446/?artlist_aid=YesTheory_593&utm_source=affiliate_p&utm_medium=YesTheory_593&utm_campaign=YesTheory_5934- Soundstripe: Get 15% off by using the code YESTHEORY at the link https://soundstripe.com?fpr=yestheory🎞 Our b-roll and stock footage:2 Months Free Stock Footage Videos: https://artgrid.io/artgrid-114820/?artlist_aid=YesTheory_593&utm_source=affiliate_p&utm_medium=YesTheory_593&utm_campaign=YesTheory_593For an amazing b-roll and footage library, checkout: http://storyblocks.com/YesTheory​📈  Our Most Popular YouTube Videos🎬  Traveling to the least visited country in the world: https://youtu.be/ODuEl4oNae0🎬  Becoming Superhuman with Iceman Wim Hof: https://youtu.be/8cvhwquPqJ0🎬  We Helicopter Bungee Jumped with Will Smith: https://youtu.be/KSu6gRp7UBA🎙 The Yes Theory Podcast: https://spoti.fi/3sFdq6vGET IN TOUCH🌍 Our website -  http://www.yestheory.com 🌍 Advertise With Us - partnerships@yestheory.com Who are we? We believe that life’s greatest moments and deepest connections exist outside of your comfort zone.Ask us a Question:Tweet us @yestheory"
"j38aDAYvv3k","Нажахані російські військові🤡 HIMARS роблять свою справу","2022-07-24T07:00:11Z","UCIXRoKJ4kHnB32r_vtb6IIw","ДжеДАІ","2","22.01.08","Россия|Война|Война в Украине|Росія|Війна|Війна в Україні|Секретні матеріали|журналістські розслідування|дефолт|росія|економіка|занепад росії|Секретные материалы|журналистские расследования|россия|экономика|упадок россии|Военная операция|Військова операція","927109","0","0","2697","https://i.ytimg.com/vi/j38aDAYvv3k/default.jpg","False","True","Точна і смертоносна робота Хімарсів та іншого свіжого озброєння від заходу приводить рашистів у дикий жах. Вони у страшних снах не могли такого собі уявити — як десятками злітають у повітря їхні склади та бази. Розкажемо про те, як пропагандисти й самі військові росії без цензури обговорюють роботу української артилерії. Вишенька на торті — плач терористка Гіркіна."
"5PjqRgGx9qo","100500 ЛАЙФХАЧЁНЫШЕЙ ОТ МАЭСТРО!","2022-07-31T10:31:06Z","UCsJR1qQDNyFvsX_9_bNM63A","Доктор Дью","23","22.01.08","DIY|самоделки|сделай себе|wow|топ самоделок|инструмент|у каждого|своими руками|полезный инструмент|простое|интересный|крутая идея|Как сделать|в домашних условиях|how to make","835233","0","0","5219","https://i.ytimg.com/vi/5PjqRgGx9qo/default.jpg","False","True","TWS-наушники CGPods из Тюмени https://bit.ly/3Jg3Ujw как Apple AirPods, но в 4 раза дешевле. 20 ч. работы без розетки, с влаго-защитой. Не жмут в ушах и не выпадают. По коду DEWSUM22 – скидка 200 р.Мой мерч на Ozon https://www.ozon.ru/highlight/543064Мой мерч на «Мам, купи!» https://mamcupy.com/catalog/doktor-diy Еще мерч:https://m.vk.com/product-184890023_5502228Сцылка для поддержать праэгт:https://www.donationalerts.com/r/pit_stopДля коммерческих предложений:pit_stop_saki@mail.ruТелега:https://t.me/by_pit_stopДзен:https://zen.yandex.ru/id/608b09e59845ac5e08c72f37Основной канал:https://www.youtube.com/user/masterpitstopЛичная страница:https://vk.com/by_pit_stop"
"r0coFw9jUgE","Вскрыли ЗАБРОШЕННЫЙ КОНТЕЙНЕР С БАНКОМАТАМИ а ТАМ.....","2022-07-18T14:00:16Z","UCwipTluVS2mjuhPtx2WU7eQ","Дима Масленников","24","22.01.08","Вскрыли ЗАБРОШЕННЫЙ КОНТЕЙНЕР С БАНКОМАТАМИ С а ТАМ.....|Вскрыли ЗАБРОШЕННЫЙ КОНТЕЙНЕР С БАНКОМАТАМИ|Вскрыли ЗАБРОШЕННЫЙ КОНТЕЙНЕР|ЗАБРОШЕННЫЙ КОНТЕЙНЕР|С БАНКОМАТАМИ С а ТАМ.....|аукцион|аукцион контейнеров|купил на аукционе|вскрыли заброшенный контейнер с банкоматами|банкомат|с банкоматами с а там.....|находка|контейнеры|заброшенный контейнер|вскрыли заброшенный контейнер|дима масленников|масленников|дмитрий масленников|эксперимент|сударь","6966905","0","0","14369","https://i.ytimg.com/vi/r0coFw9jUgE/default.jpg","False","True","OneTwoTrip: отели и апартаменты по всему миру, а также всё для ваших путешествий в одном приложении http://12trip.me/ha73kkkВскрыли ЗАБРОШЕННЫЙ КОНТЕЙНЕР С БАНКОМАТАМИ а ТАМ.....вскрыли заброшенный контейнер с банкоматами а там.....! В мире часто бывает ЗАБРОШЕННЫЕ КОНТЕЙНЕРЫ, мы купили и вскрыли его а там ! Как вы думаете, сможем ли мы найти что-то в заброшенном контейнере, в котором БАНКОМАТЫ!Сударь - https://www.youtube.com/channel/UCPB8r4961RpDXGe3frtsmIQВскрыли ЗАБРОШЕННЫЙ КОНТЕЙНЕР С БАНКОМАТАМИ а ТАМ.....Подпишись на меня в соц. сетях:Tik-tok- https://vm.tiktok.com/QLwaf6/​Группа в вк - https://vk.com/pognalishow​VK - http://vk.com/dima_maslen​"
"NxBY_gfQbfc","ПОДРОСТКИ ЦЕЛУЮТСЯ? МАКС В БЕШЕНСТВЕ! КАМПУС НЕ ПОЕДЕТ В ЗАГОРОДНЫЙ ДОМ!!!","2022-07-30T06:00:09Z","UCWGK2_WVaXWv-QrkgT9-KDw","KiKiDo","22","22.01.08","сериал про подростков|Сериал Кампус|Камиль|Аминка|Кикидо|ЛП|молодежный сериал|Сериал 2021|Сериал Кикидо|кикидо новые серии|сериал про любовь|популярные блогеры|школа|лп|Друзья|леди диана|диана","2276736","0","0","1958","https://i.ytimg.com/vi/NxBY_gfQbfc/default.jpg","False","True","ПОДРОСТКИ ЦЕЛУЮТСЯ? МАКС В БЕШЕНСТВЕ! КАМПУС НЕ ПОЕДЕТ В ЗАГОРОДНЫЙ ДОМ!!!Инстаграм Семьи - https://clck.ru/TZC5ZInstagram Камиля - https://clck.ru/TZC88Instagram Аминки - https://clck.ru/TZCBBInstagram Мамы - https://clck.ru/TZCExTikTok - https://clck.ru/TZCJGLike Амина - https://clck.ru/TZCTsLike Камиль - https://clck.ru/TZCWCКанал Милана Хаметова - https://www.youtube.com/channel/UCkJpb5Ie9JAnWsASKDe_xpQ/videosПо вопросам сотрудничества пишите - kikidopr@gmail.com#Кампус #Амина #СериалКампус"
"4u5I8GYB79Y","The Deadliest Virus on Earth","2022-07-26T13:58:55Z","UCsXVk37bltHxD1rDPwtNM8Q","Kurzgesagt – In a Nutshell","27","22.01.08","[none]","5926644","0","0","13510","https://i.ytimg.com/vi/4u5I8GYB79Y/default.jpg","False","True","Go ‘beyond the nutshell’ at https://brilliant.org/nutshell by diving deeper into these topics and more with 20% off an annual subscription!Sources & further reading:https://sites.google.com/view/sources-rabies/In the 1970s thousands of Chickenheads rained from the sky in Europe, making foxes and other wildlife confused and very happy. Why? They were filled with a vaccine to fight the deadliest virus known to humanity – since the 1930s a rabies epidemic had been sweeping across wildlife populations in Europe and humans wanted to finally get rid of the virus once and for all. Rabies is named after Lyssa, the ancient Greek spirit of mad rage, and has been haunting us for at least 4000 years. It can turn animals into angry beasts and humans into zombies that fear water. But what makes Lyssa fascinating is not just how bizarre and deadly its infection is, but also how incredibly good it is at avoiding our defenses.OUR CHANNELS▀▀▀▀▀▀▀▀▀▀▀▀▀▀▀▀▀▀▀▀▀▀▀▀▀▀German:        https://kgs.link/youtubeDESpanish:        https://kgs.link/youtubeESFrench:          https://kgs.link/youtubeFRPortuguese:  https://kgs.link/youtubePTArabic:           https://kgs.link/youtubeARHindi:             https://kgs.link/youtubeHIJapanese:     https://kgs.link/youtubeJAKorean:          https://kgs.link/youtubeKOHOW CAN YOU SUPPORT US?▀▀▀▀▀▀▀▀▀▀▀▀▀▀▀▀▀▀▀▀▀▀▀▀▀▀This is how we make our living and it would be a pleasure if you support us!Get Merch designed with ❤ https://shop-us.kurzgesagt.org  Join the Patreon Bird Army 🐧  https://kgs.link/patreon  DISCUSSIONS & SOCIAL MEDIA▀▀▀▀▀▀▀▀▀▀▀▀▀▀▀▀▀▀▀▀▀▀▀▀▀▀Reddit:            https://kgs.link/redditInstagram:     https://kgs.link/instagramTwitter:           https://kgs.link/twitterFacebook:      https://kgs.link/facebookDiscord:          https://kgs.link/discordNewsletter:    https://kgs.link/newsletterOUR VOICE▀▀▀▀▀▀▀▀▀▀▀▀▀▀▀▀▀▀▀▀▀▀▀▀▀▀The Kurzgesagt voice is from Steve Taylor:  https://kgs.link/youtube-voiceOUR MUSIC ♬♪▀▀▀▀▀▀▀▀▀▀▀▀▀▀▀▀▀▀▀▀▀▀▀▀▀▀700+ minutes of Kurzgesagt Soundtracks by Epic Mountain:Spotify:            https://kgs.link/music-spotifySoundcloud:   https://kgs.link/music-soundcloudBandcamp:     https://kgs.link/music-bandcampYoutube:          https://kgs.link/music-youtubeFacebook:       https://kgs.link/music-facebookThe Soundtrack of this video:Soundcloud: https://bit.ly/3ow2RmaBandcamp: https://bit.ly/3b88SCbIf you want to help us caption this video, please send subtitles to subtitle@kurzgesagt.orgYou can find info on what subtitle files work on YouTube here:https://support.google.com/youtube/answer/2734698?hl=en-GB&ref_topic=7296214Thank you!🐦🐧🐤 PATREON BIRD ARMY 🐤🐧🐦▀▀▀▀▀▀▀▀▀▀▀▀▀▀▀▀▀▀▀▀▀▀▀▀▀▀Many Thanks to our wonderful Patreons (from http://kgs.link/patreon) who support us every month and made this video possible:Daniel Schilling, Jacob, Eui-seong Kim, Lucas Pastorfield-Li, Bryan Cain, Tommy Etkin, Matko Stokov, Wilson, Tsuseki, Hany Abdulsamad, Scentynelle, N. Sims, Thomas Roa, Jen M, John Roberts (Seth Vilo), Kourosh, Matyáš Bureš, Midnight Rain, Sineenuch Wongsomboon, CorralPeltzer, Yamigishi, Quinn Cone, Jan Strohbeck, Sam Bloomquist, Ryan Morgan, Ryan Grady, benjamin jedrocha, Void, Wolfee__, Matthew Slatosky, Jeudy Portuguez, Kai Smash Universe, FrankieSalamander, Nobutoshi Kakuho, Edgar Hernández, Daniel Barbier, Platinum24, Clement Pont, Derek Campbell, GeneSequence, Luca Rahmann, Mohammad Alamleh, veggiepug, Roger Thiede, Tarventar, Z. Angel, Geoff Stuart, kirby, Anatolii Bohatyrenko, jebus, Rocío Sierra, Jake the Human, Tanner Lorz, Drew Gingerich, Max, Dan Scott, M 3, Blue [stealthboy], Luc Bednarek, TL , Virginia Toepfer"
"MOCOkH05gPw","Что задумала Россия для захвата Украины? | Донбасс Реалии","2022-07-24T15:00:12Z","UC7qnYpVcuFbURi3E2E6_f6Q","Радіо Свобода","25","22.01.08","донбасс|донбасс реалии|война на донбассе|россия захват|присоединение донбасса|аннексия донбасса|россия присоединит донбасс|тактика россии|оружие на донбассе|потери рф|потери россии|потери россии в украине|оккупированные территории украины|оккупированные города украины|війна на донбасі|окуповані території україни|окупований донбас|бої на донбасі|бои на донбассе|донбас|донбас реалії|радіо свобода|радио свобода|радио свобода донбасс|радіо свобода донбас","1636485","0","0","3484","https://i.ytimg.com/vi/MOCOkH05gPw/default.jpg","False","True","Где Россия готовит новый удар? Чего ждать в ближайшие месяцы? Украинская армия держит оборону на востоке. Танки, артиллерия, пехота: потери российской армии. Новое оружие на передовой. Что рассказывают украинские военные? Танки, артиллерия, пехота: потери российской армии. Российская армия: тактика и основные направления на Донбассе. Россия готовит аннексию оккупированных территорий.Авторы: Ярослав Кречко, Роман Пагулич, Ольга Теребинская, Егор Логинов00:00 Украинская армия держит оборону на востоке01:22 Северск. Донецкая область 03:47 Украинская разведка 05:53 Российская армия. Основные направления на востоке: Изюм, Северск, Бахмут 08:10 Украинская армия на Донбассе  13:30 Потери российской армии в Украине 15:08 Россия готовит аннексию оккупированных территорий 17:37 Что Россия решила сделать с Мариуполем?Смотрите выпуски «Донбасс Реалии» 👉 http://bit.ly/donbassrealiiПодписаться на наши каналыРадио Свобода Украина: http://bit.ly/radiosvoboda-ukraineПрограммы и трансляции: http://bit.ly/radiosvoboda-youtubeМы в соцсетяхhttps://facebook.com/donbassrealii https://twitter.com/donbassrealii https://www.instagram.com/donbassrealiihttps://t.me/donbassrealiihttps://vk.com/donbassrealii https://ok.ru/donbassrea https://soundcloud.com/donbassrealyМобильное приложениеApp Store http://bit.ly/RadioSvoboda-AppleStoreGoogle Play http://bit.ly/Radiosvoboda-GooglePlay#война #потери #донбасс #донбассреалии #радиосвобода"
