video_id,title,publishedAt,channelId,channelTitle,categoryId,trending_date,tags,view_count,likes,dislikes,comment_count,thumbnail_link,comments_disabled,ratings_disabled,description
"S2ABIOsm6sw","Фейгин. Возврат Херсона, арест Гордона, шнырь Шарий, Арестович, Путин, циничный Эрдоган, агент Кедми","2022-07-25T15:00:12Z","UCCcprrrcbdaj14kYPjcbj9w","В гостях у Гордона","22","22.01.08","Dmitry Gordon (Person)|Дмитрий Гордон|Гордон|В гостях у Гордона|В гостях у Дмитрия Гордона|интервью|интервью гордона|интервью гордона с фейгиным|интервью фейгина гордону|гордон фейгин интервью|фейгин гордон интервью|марк фейгин|фейгин|фейгин гордон|гордон фейгин|фейгин интервью|фейгин у гордона|фейгин в гостях у гордона|Соловьев|Киселев|Скабеева|Симоньян|HIMARS|Антоновский мост|Орбан|Арестович|Херсон|Кедми|Шарий|Путин|Эрдоган|Саймс|арест Гордона","2266289","0","0","3054","https://i.ytimg.com/vi/S2ABIOsm6sw/default.jpg","False","True","Интервью Дмитрия Гордона с адвокатом, экс-депутатом Государственной думы России Марком Фейгиным. 2022 годОфициальный канал программы В гостях у Дмитрия Гордонаhttps://www.youtube.com/user/vgostyahugordona?sub_confirmation=1Официальный канал Дмитрия Гордона https://www.youtube.com/user/DmytriyGordon?sub_confirmation=1Следите за новостями и читайте аналитику на общественно-политическом сайте ГОРДОН: http://gordonua.com/По вопросам рекламы пишите на editor@gordonua.comОфициальный магазин с мерчем, конфетами и зефиром Дмитрия Гордона: https://gordonshop.com.uaПрисоединяйтесь к нам в соцсетях!https://www.instagram.com/gordondmytrohttps://www.facebook.com/gordondmitryhttps://www.tiktok.com/@gordondmytro?https://twitter.com/dmitry_gordonhttps://t.me/dmytrogordon_officialhttps://www.facebook.com/gordonuacomhttps://t.me/s/gordonuacomhttps://cutt.ly/Viber_GORDONhttps://twitter.com/Gordonuacom0:00 «Ситуация на фронтах внушает оптимизм. Тяжелая фаза на востоке уже пройдена»0:48 о начале деоккупации юга Украины2:00 о ничтожном результате российской армии: «Время работает на пользу Украины»2:59 «Тон пропагандистской своры не изменился»5:13 «Меня удивляет, что в Израиле нет реакции на агента Кедми»6:48 «Американским спецслужбам выгодно контролировать Саймса»7:38 «Скоро по Шарию будет масса новостей»8:40 «Шарий засветился, он безусловно получал деньги от России и был на кураторский связи»10:21 о криминальных способностях Шария: «Он такой шнырь, который нужен был России»12:20 «В аппарате Путина коктейль из страха и неуверенности. Они не понимают, ради чего все это»14:08 о жулике Мишустине15:18 «Чтобы появилось желание что-то изменить, санкции должны быть тотальными»17:30 «Путин ищет способ избежать военного поражения»19:20 «Август – роковой месяц для России»20:06 «Пути назад у Путин нет, он сам себя загнал»21:15 «Эрдоган нравственно амбивалентен и циничен»25:07 «Орбан завязан по деньгам и участвует в газовых делах»27:26 о том, что в мозгах россиян29:22 «Ничего, кроме бунта, у россиян не осталось»30:17 «Вы беднеете и подыхаете, а ради чего?»32:28 об интервью с Арестовичем35:42 Гордону: «Лубянка ненавидела вас всегда»37:40 о компенсации России за ущемление прав и преследование ГордонаФейгин. Возврат Херсона, арест Гордона, шнырь Шарий, Арестович, Путин, циничный Эрдоган, агент КедмиВ гостях у Дмитрия Гордона — авторская программа Дмитрия Гордона, которая выходит с 1996 года. Формат программы — беседы с выдающимися современниками: деятелями культуры, искусства, науки, спорта и политики. Это люди, которым есть что сказать о себе и об эпохе. В разные годы ее героями были Михаил Ходорковский, Вахтанг Кикабидзе, Александр Невзоров, Виталий и Владимир Кличко, Андрей Шевченко, Гарри Каспаров, Владимир Зеленский, Моргенштерн, Андрей Данилко, Андрей Макаревич, Роман Виктюк, Армен Джигарханян, Николай Амосов, Михаил Горбачев, Виктор Ющенко, Леонид Кравчук, Михаил Жванецкий, Евгений Евтушенко, Муслим Магомаев, Олег Блохин, Виктор Суворов, Михаил Саакашвили, Борис Березовский... Всего — более 1000 знаменитостейДрузья, мы рады комментариям и дискуссии, но нецензурная лексика будет удаляться, а злостные нарушители — баниться."
"o_FnI0kCX7w","WORLD RECORD - Mondo Duplantis clears 6.21m | World Athletics Championships Oregon 22","2022-07-25T04:34:50Z","UCQk7fWv15ChjMJLCRVmtApw","World Athletics","17","22.01.08","world|athletics|championships|champion|2021|2022|eugene|oregon|olympics|mondo|duplantis|sweden|pole|vault|record|6.21|6.21m|world record","912541","0","0","638","https://i.ytimg.com/vi/o_FnI0kCX7w/default.jpg","False","True","⭐️ Follow us on Twitter - https://twitter.com/WorldAthletics ⭐️⭐️ Follow us on Facebook - https://www.facebook.com/WorldAthletics/ ⭐️⭐️ Follow us on Instagram - https://www.instagram.com/worldathlet... ⭐️⭐️ Follow us on TikTok - https://www.tiktok.com/@worldathletics/ ⭐️Make sure you subscribe for athletics highlights, interviews with the athletes, training tips and more!"
"RKHAHi8K3IA","День сто пятьдесят четвёртый. Беседа с @Alexey Arestovych Алексей Арестович","2022-07-27T19:51:16Z","UCQVtD_N4OeD-9PshBq7NwyQ","ФЕЙГИН LIVE","25","22.01.08","фейгин live|фейгин лайф|марк фейгин|mark feygin|фейгин|марк фейгин стрим|фейгин марк|новости|политика|экономика|общество|прямой эфир|прямая трансляция|стрим|Society|Politics|общество и политика|арестович фейгин|алексей арестович|олексій арестович|арестович интервью|фейгин арестович|украина|арестович|россия|путин|зсу|арестович алексей|всу|alexey arestovich|фронт|нато|фейгін арестович|фейгин лайф арестович|зеленский|фейгін","1777811","0","0","4070","https://i.ytimg.com/vi/RKHAHi8K3IA/default.jpg","False","True","#Фейгин #ФейгинLIVE День сто пятьдесят четвёртый. Беседа с  Алексеем Арестовичем (Киев).https://feygin-live.customprint.market/uk сайт с фирменным дизайном, если вы проживаете в Украине.https://feygin-live.myspreadshop.ie сайт с фирменным дизайном, если вы проживаете в Европе, Азии и Ближнем Востоке.https://feygin-live-usa.myspreadshop.com сайт с фирменным дизайном, если вы проживаете в Северной и Южной Америке, Африке и Тихоокеанском регионе.Подписка на PATREON https://www.patreon.com/feygin_liveЗачем нужна подписка на PATREON https://youtu.be/vcVmXQD7hrsПоддержите ФЕЙГИН LIVE: https://donate.stream/feyginliveПоддержите ФЕЙГИН LIVE: https://www.donationalerts.com/r/feygin_liveРеквизиты для поддержки проекта:Перевод с любой банковской карты https://buy.stripe.com/3cs03j5drbasg2Q004 недоступный для контроля российских регуляторов! Paypal: https://paypal.com/donate/?hosted_button_id=M77VR7HP9FELL&source=urlЯндекс-кошелек (в рублях): https://yoomoney.ru/to/4100116535768948QIWI Кошелек: https://qiwi.com/n/FEYGINLIVEBitcoin: 16rWnEwYErcknE2QWAJwRcGMw8L6cCjXLhETH: 0xe02B9F3b530a0AAf58B626Ad819672FF5c355Aee (убедитесь, что сеть верна: Ethereum (ERC20).USDC: 0xe02B9F3b530a0AAf58B626Ad819672FF5c355AeeДля пожертвований из Украины и Казахстана перечисляйте на кошельки платформы advcash.com на аккаунт feyginlive@gmail.comПодписывайтесь на Марка Фейгина в соцсетях:Твиттер Марка Фейгина - https://twitter.com/FeyginMark4Фейсбук Марка Фейгина - https://www.facebook.com/mark.feygin.z Телеграмм-канал - https://t.me/MarkFeyginПодкасты - https://castbox.fm/ch/3077294Почта для корреспонденции - feyginlive@gmail.com"
"o_NHcWKtgBY","ЭКСКЛЮЗИВ: Юлик о разводе, хейте и грязи в сети","2022-07-30T15:26:19Z","UCdu1AosJcTPsQYFolNHki8Q","SNAILKICK","24","22.01.08","snailkick|snail|kick|снейлкик|снэйлкик|неблогер|не|блогер|блог|badroom|bad|room|55х55|fun|юмор|смешно|весело|умора|лол|lol|головныемюсли|карейка даша|реакция|тикток|tiktok|юлик|каплан|развод|скандал","966830","0","0","13837","https://i.ytimg.com/vi/o_NHcWKtgBY/default.jpg","False","True","Магазин наборов стринг арт: https://ringstring.ru/?utm_source=snailkick&utm_medium=0722Промокод: SNAILKICK - скидка 15%📮 Почта для коммерческих предложений и связи: snailkicktv@gmail.com📸 Оператор: https://t.me/niqitin🔥 Быть в курсе: https://t.me/snailkick💵 Поддержать: https://boosty.to/snailkick ☯ https://zen.yandex.ru/snailkickVK: https://vk.com/snailkick и https://vk.com/snailkick_tm#SNAILKICK #ЮЛИК #РАЗВОД"
"b2biGGdQN0Q","Game Theory: Turn It Off It̵̰̹͂͘ O̷̒̆f̶̝͒f̶͑ i̶͕̝͗T̷̔͘ Ṑ̵̗̝̪͗ͅF̴̛̍͐͊ḟ̶̭͕̾ (Amanda The Adventurer)","2022-07-31T18:05:05Z","UCo_IB5145EVNcf8hw1Kku7w","The Game Theorists","20","22.01.08","amanda the adventurer|amanda the adventurer gameplay|amanda the adventurer all endings|amanda the adventurer gacha|amanda the adventurer theory|amanda the adventurer update|scary|horror|scary game|dora the explorer scary game|dora scary game|dora horror games|dora the explorer horror game|dora the explorer horror|dora the explorer scary|game theory|game theorists|matpat|amanda the adventurer horror game|amanda the adventurer secrets","1750757","0","0","5712","https://i.ytimg.com/vi/b2biGGdQN0Q/default.jpg","False","True","SUBSCRIBE to Catch all the Theories! ► https://goo.gl/kQWHkJ   Well, it is about time I talk about the Dora the Explorer inspired horror game called Amanda The Adventurer. This game has been making the rounds on YouTube, including my own playthrough on GTLive. That means we are past due for a theory. What secrets and horrors is Amanda hiding? Let's dive in!The game ►  https://jpgamedesign.itch.io/amanda-the-adventurerGet Your Theory Wear! ►  https://theorywear.com/SUBSCRIBE to Catch all the Theories! ► https://goo.gl/kQWHkJ    Need Royalty Free Music for your Content? Try Epidemic Sound.Get A 30 Day Free Trial! ► http://share.epidemicsound.com/MatPat   More THEORIES: FNAF, The FINAL Timeline ►► https://bit.ly/2MlHYFeFNAF, The Monster We MISSED! ►► https://youtu.be/_ygN8HLCaJgFNAF This Theory Changes Everything ► https://bit.ly/2JUQUn6FNAF, You Were Meant To Lose ► https://youtu.be/7bn8hM9k0b0FNAF 6, No More Secrets ► https://bit.ly/2LVCq4u   Credits:Writers: Matthew Patrick and Tom RobinsonEditors: Dan Cybert Seibert, AbsolutePixel and Tyler MascolaSound Editor: Yosi Berman #AmandaTheAdventurer #AmandaTheAdventurerGame #Dora #DoraTheExplorer #CreepyPasta #ScaryGame #MatPat #Theory #GameTheory"
"aIsFywuZPoQ","BLONDE | Official Trailer | Netflix","2022-07-28T13:00:03Z","UCWOA1ZGywLbqmigxE4Qlvuw","Netflix","24","22.01.08","Adrien Brody|Ana de Armas|Andrew Dominik|Bobby Cannavale|Joyce Carol Oates|Marilyn Monroe|Netflix|actress|art|beautiful|beauty|blonde|blonde bombshell|classic hollywood|hollywood|icon|kennedys|makeup trailer|marilyn|marilyn monroe fan|marilyn monroe fans|marilyn monroe quotes|monroe|mystery|norma jeane|old hollywood|pinup|true crime|vintage","6213413","0","0","8251","https://i.ytimg.com/vi/aIsFywuZPoQ/default.jpg","False","True","Discover a life both known and unknown in this boldly imaginative film from Director Andrew Dominik that explores the complicated life of Hollywood icon Marilyn Monroe. Based on the novel of the same name by Joyce Carol Oates, Blonde, starring Ana de Armas as Marilyn Monroe, Adrien Brody, Bobby Cannavale, Xavier Samuel, and Julianne Nicholson premieres on Netflix, 28 September.SUBSCRIBE: http://bit.ly/29qBUt7About Netflix:Netflix is the world's leading streaming entertainment service with 221 million paid memberships in over 190 countries enjoying TV series, documentaries, feature films and mobile games across a wide variety of genres and languages. Members can watch as much as they want, anytime, anywhere, on any Internet-connected screen. Members can play, pause and resume watching, all without commercials or commitments.BLONDE | Official Trailer | Netflixhttps://youtube.com/Netflix"
"k9J4H5gkLqw","I took Ninja's Masterclass and it ruined my life","2022-07-31T17:59:00Z","UCTSRIY3GLFYIpkR2QwyeklA","Drew Gooden","23","22.01.08","drew gooden|comedy|commentary|reaction|vine|drew gooden vine|road work ahead guy|parody|rant|cringe|ninja|masterclass|twitch|review|how to stream|stream tutorial|ninja review","1391770","0","0","8233","https://i.ytimg.com/vi/k9J4H5gkLqw/default.jpg","False","True","Sponsored by HelloFresh. Use my code IMALITTLESTINKER16 for up to 16 FREE MEALS + 3 Surprise Gifts across 6 HelloFresh boxes plus free shipping at https://bit.ly/33JtJrsNEW MERCH: https://www.drewgoodenshop.com/intro - 00:00the class - 03:15my journey - 18:5124 hour stream - 24:56i'm in the box - 36:27streamers showed (and people I like to watch)https://www.twitch.tv/julienhttps://www.twitch.tv/chrismelbergerhttps://www.twitch.tv/39daphhttps://www.twitch.tv/itswillhttps://www.twitch.tv/kofiewhyhttps://www.twitch.tv/ashleyrobotohttps://www.twitch.tv/banthonyhttps://www.twitch.tv/eddyburbackall music from epidemic sound, except for:Stage Kids - Welcome to the Jungle https://youtu.be/y0PwEwI4sVkOld School Runescape OST - Adventure https://youtu.be/Z2Oci7962pIVoyage - Enter https://youtu.be/1o95Xo7oG64Death Note OST - Death Note Theme Song (Instrumental) https://youtu.be/RoC8_SRLDEUMass Effect Trilogy - Galaxy Map Theme https://youtu.be/6RO7K4W-c9gbauerklos - oh okay https://youtu.be/5Ge5r_082p4here's the only place online I could find that comedy bang bang clip of mike hanford:https://mariogolf.info/post/174653803326/drscudworth-political-cartoonist-tom-perdyfollow me:twitter - https://www.twitter.com/drewisgoodeninstagram - https://www.instagram.com/drewisgoodentwitch - https://www.twitch.tv/drewisgooden"
"oVEwzD9IhSo","Doctor Reacts To Survivor Medical Emergencies","2022-07-31T14:00:20Z","UC0QHWhjbe5fGJEPz3sVb6nw","Doctor Mike","27","22.01.08","doctor mike|dr mike|drmike|dr. mike|mikhail varshavski|doctor mikhail varshavski|mike varshavski|doctor reacts|survivor|cbs|jeff probst|injury|bug in ear|alone|reality show|game show|$1 Million|1000000|$1000000|beach|sand|swim|johnny fairplay","1276915","0","0","3022","https://i.ytimg.com/vi/oVEwzD9IhSo/default.jpg","False","True","Click here to get 2 free filet mignons and $15 off your first ButcherBox: https://butcherbox.com/doctormike Includes FREE Shipping. Be sure to enter your email to access the deal. Thanks to ButcherBox for sponsoring this video.Survivor is coming up on its 43rd season this fall (whaaat??), and with all that reality TV goodness in the can already I knew there would be some medical moments to react to. Turns out, I was right, in that there have been a bunch of ailments on the show over the years! These injuries span the entire length of the whole series, so if you're a long time Survivor and Jeff Probst fan, this one is for you!I LOVE reading your comments and take your suggestions seriously. If there’s a subject you want me to discuss or something you’d like for me to react to, leave a comment down below. Many of my videos have been born out of suggestions directly from you, so don’t hold back!-Doctor Mike VarshavskiHelp us continue the fight against medical misinformation and change the world through charity by becoming a Doctor Mike Resident on Patreon where every month I donate 100% of the proceeds to the charity, organization, or cause of your choice! Residents get access to bonus content, an exclusive discord community, and many other perks for just $10 a month. Become a Resident today:https://www.patreon.com/doctormikePlease SUBSCRIBE for new videos every Wednesday afternoon and Sunday morning!  https://goo.gl/87kYq6Let’s connect:IG https://goo.gl/41ZS7w - Doctor MikeReddit https://www.reddit.com/r/DoctorMike/Twitter https://goo.gl/kzmGs5 - Real Doctor MikeFacebook https://goo.gl/QH4nJS - Real Doctor MikeContact Email: DoctorMikeMedia@Gmail.comP.O. Box (send me stuffs):340 W 42nd St # 2695NY, NY 10108Executive Producer: Doctor MikeProduction Director and Editor: Dan OwensManaging Editor and Producer: Sam BowersEditor and Designer: Caroline Weigum* Select photos/videos provided by Getty Images *** The information in this video is not intended nor implied to be a substitute for professional medical advice, diagnosis or treatment. All content, including text, graphics, images, and information, contained in this video is for general information purposes only and does not replace a consultation with your own doctor/health professional **"
"SQrdgiG_r9w","ДТ75 Болотник. 8 месяцев в болоте! Финал эвакуации!","2022-07-31T13:00:02Z","UC2hsvTzqdjsGOUnM-Ilai6Q","Combat Crew","2","22.01.08","combat crew|комбат крю|combatcrew","656331","0","0","3857","https://i.ytimg.com/vi/SQrdgiG_r9w/default.jpg","False","True","Контактные линзы ADRIA (Юж.Корея). https://bit.ly/Adria_combat  На 40% дешевле топовых однодневных западных линз. Защита от УФ-лучей, двойное увлажнение, HD-зрение. Тест-набор: 770 р. Скидка 150р. по коду 922811Яндекс Дзен: https://zen.yandex.ru/combatcrew_youtubeНаш Телеграмм: https://t.me/combatcrewНаш магазин: https://combatcrew.ruПо вопросам сотрудничества: info@combatcrew.ruГруппа в Вк: https://vk.com/combatcrewLive Канал: https://www.youtube.com/user/MrPautini4Стать спонсором канала: https://www.youtube.com/channel/UC2hsvTzqdjsGOUnM-Ilai6Q/join"
"LigyKwsrmyQ","2022 Discraft's Great Lakes Open | R2F9 | Ellis, Klein, McBeth, Heimburg | Jomez Disc Golf","2022-07-31T13:00:10Z","UCmGyCEbHfY91NFwHgioNLMQ","JomezPro","17","22.01.08","jomez productions|jomez disc golf|jomezpro|disc golf|disc golf pro tour|disc golf tournament coverage|jomez|2022 disc golf","127535","0","0","145","https://i.ytimg.com/vi/LigyKwsrmyQ/default.jpg","False","True","Thank you for watching JomezPro Disc Golf tournament coverage of the MPO lead card second round at the 2022 Discraft's Great Lakes Open.Card: Corey Ellis, Kyle Klein, Paul McBeth, Calvin HeimburgCourse: Kensington Toboggan DGC | Milford, MIBigSexyBarri Commentary: Jeremy Big Jerm Koling, Nate “Sexy” Sexton, Paul Uli Ulibarri📆 2022 Tournament Coverage Schedule at https://jomezpro.com/schedule🔥 Access EXCLUSIVE content & giveaways right now at https://jomezpro.com/patreon⛓️ SHOP official JomezPro discs and merch at https://www.jomezpro.com/📱 Check out more JomezPro:https://jomezpro.com/https://instagram.com/jomezprohttps://www.tiktok.com/@jomezprohttps://twitter.com/jomezprohttps://facebook.com/jomezpro🎵 Star Frame has been producing our theme music since 2016 https://starframe.bandcamp.comLearn about the Disc Golf Pro Tour: https://www.dgpt.comFront 9 Chapters00:00 Start02:07 PLAYER PROFILES03:03 HOLE 1  06:46 HOLE 210:44 HOLE 314:44 HOLE 419:12 HOLE 522:52 HOLE 6 26:39 HOLE 730:55 HOLE 834:17 HOLE 937:29 UDISC LEADERBOARD CHECK-IN37:54 FOUNDERS CLUB LISTCopyright ©2012-2021. All rights reserved. JomezPro™, FollowFlight™, SloMez™, NoMez™, BigSexy Commentary™, BigBarri Commentary™, BigSexyBarri Commentary™ are all protected trademarks of Jomez Productions, LLC. #jomezpro #discgolf Why are you still reading this? Get out and play some Disc Golf!"
"tUFmM0p-5N8","I let my subscribers decide my whole HAIR MAKEOVER","2022-07-31T15:00:39Z","UC2qn0BbyTywWCuAy1f1ecfg","Naomi Jon","24","22.01.08","funny|relatable|blue hair|hair dye|hair fail|beauty fail|fail|naomi and vincent|henna freckles|bleach fail|bleach|hairdresser reacts|tik tok","487428","0","0","2500","https://i.ytimg.com/vi/tUFmM0p-5N8/default.jpg","False","True","Watch my On Our Own Music Videohttps://bit.ly/3xSnopbStream On Our Own 🥦https://lnk.site/on-our-own______In this video my followers will decide my shabby shaloon makeover!! from bleaching to cutting to dyeing - I put my hairs fate into my broccolis hands. AND YOU SURPRISED ME lol(oh and we're also gonna talk about some SERIOUS TOPICS)SUBSCRIBE TO MY CHANNEL HERE: http://bit.ly/2gBt8udDon't forget to follow me on all of my social media! ⬇️INSTA: https://www.instagram.com/naomijon/TWITTER: http://bit.ly/2BdQtfUTIK TOK: @naomijon🥦TWITCH: https://www.twitch.tv/treshtopia2ND CHANNEL: https://www.youtube.com/channel/UCa6J...BUSINESS: Naomijon@gmx.deAnzeigeGET MY LASH COLLECTIONhttps://melodylashes.com/ml-tese______I think your favorite colors are purple and pink, broccolis#hairdye #haircolor #DIY #hairDIY #colorfulhair #hairmakeover #hairtransformation #transformation #hairfail #fail #beautyfail #hairtrend #viralhair #tiktokhair #splithair #hairtutorial #egirlhair #egirl #trend #dipdye #purplehair #goingblonde #bleaching #bleach #haircut #bluehair #pinkhair"
"k_Xwk6Afo1U","MrBeast Hit 100,000,000 Subs So I Did This...","2022-07-30T14:45:02Z","UC70Dib4MvFfT1tU6MqeyHpQ","Preston","24","22.01.08","funny|challenge|family|comedy|preston|brianna","3372380","0","0","7230","https://i.ytimg.com/vi/k_Xwk6Afo1U/default.jpg","False","True","Preston’s Back to School Bundles and Giveaway are now LIVE on firemerch.com (http://firemerch.com/) 👊 Don’t forget to enter🔥MrBeast Hit 100,000,000 Subs So I Did This...with Preston 👊👕 MERCH - http://www.firemerch.com 👀 FOLLOW ME HERE!🡆 TikTok - https://www.tiktok.com/@preston🡆 Instagram - https://instagram.com/prestonplayz🡆 Twitter - https://twitter.com/Preston🡆 PrestonShorts - https://bit.ly/2VrTLIr🎮 Join my Fan Discord! 🡆 http://discord.gg/Preston------------------------------Additional music provided by Epidemic SoundClick here for a free trial! 🡆 http://share.epidemicsound.com/TBNR"
