video_id,title,publishedAt,channelId,channelTitle,categoryId,trending_date,tags,view_count,likes,dislikes,comment_count,thumbnail_link,comments_disabled,ratings_disabled,description
"_spuxXnul0U","HELLUVA BOSS - THE CIRCUS // S2: Episode 1","2022-07-30T17:00:20Z","UCzfyYtgvkx5mLy8nlLlayYg","Vivziepop","1","22.01.08","Helluva Boss|Helluva Boss cartoon|Helluva Boss animation|Helluva Boss official|Helluva Boss Official episode|Helluva Boss Loona|Helluva Boss Blitz|Helluva Boss Moxxie|Helluva Boss Millie|Helluva Boss Blitzo|helluva boss vivziepop|helluva boss new|helluva boss new episode|helluva boss season 2|helluva boss season 2 episode 1|helluva boss season 2 the circus|helluva boss the circus","7077266","0","0","60951","https://i.ytimg.com/vi/_spuxXnul0U/default.jpg","False","True","So you guys like backstories? Cuz things sure did happened.WARNING: for daddy issues.HELLUVA BOSS MERCH AVAILABLE ► https://sharkrobot.com/vivziepopHELLUVA SEASON TWO IS HERE!! Thank you all for the patience and understanding! We have been hard at work on these new episodes and cannot wait to bring you more soon! For those expecting part II of the S1 finale, we ran into a roadblock but season two will continue until we are able to get it out! We are just happy we can bring you more now. Thank you endlessly for the support in the meantime, we hope you enjoy this labor of love!WANT MORE? WATCH OUR OTHER EPISODES!Pilot Episode ► https://www.youtube.com/watch?v=OlahNrlcgS4S1 Episode One ► https://www.youtube.com/watch?v=el_PChGfJN8S1 Episode Two ► https://www.youtube.com/watch?v=kpnwRg268FQS1 Episode Three ►  https://www.youtube.com/watch?v=RghsgkZKedgS1 Episode Four ► https://www.youtube.com/watch?v=1ZFseYPmkAkS1 Episode Five ► https://www.youtube.com/watch?v=h2ZmVAdezF8S1 Episode Six ► https://youtu.be/yXErLiSbxXQS1 Episode Seven ► https://youtu.be/8zyGQquL8VMOr Support on Patreon!https://www.patreon.com/VivienneMedranoThumbnail by Gasu!#HelluvaBoss #HelluvaBossSeason2 #SEASONTWO"
"nxs0RHpT_Hg","BLACKPINK - 'BORN PINK' ANNOUNCEMENT TRAILER","2022-07-31T15:00:27Z","UCOmHUn--16B90oW2L6FRR3A","BLACKPINK","10","22.01.08","YG Entertainment|YG|와이지|K-pop|BLACKPINK|블랙핑크|블핑|제니|로제|리사|지수|LISA|JISOO|JENNIE|ROSÉ|BLINK|블링크|BORN PINK|본핑크|블랙핑크 본핑크|BLACKPINK BORN PINK","8692081","0","0","165741","https://i.ytimg.com/vi/nxs0RHpT_Hg/default.jpg","False","True","#BLACKPINK #블랙핑크 #BORNPINK #ANNOUNCEMENT #TRAILER #YG"
"wwkH0prchjQ","Minecraft Speedrunner VS $1,000,000 MrBeast Challenge","2022-07-30T09:15:09Z","UCTkXRDQl0luXxVQrRQvWS6w","Dream","20","22.01.08","Dream Minecraft|dream Minecraft youtube|minecraft|dream|Speedrunner vs 3 hunters|Speedrunner vs someone trying to stop them|Beating Minecraft but my friend tries to stop me|Minecraft but water rises every minute|minecraft but lava rises every minute|minecraft but challenge|minecraft challenge|challenge|minecraft 1.14|beating minecraft|rematch|finale|finale rematch|grand finale|grand","8813978","0","0","51811","https://i.ytimg.com/vi/wwkH0prchjQ/default.jpg","False","True","Minecraft Speedrunner VS $1,000,000 MrBeast Challenge. This was INSANE. A new challenge.Patreon (Plugin): https://www.patreon.com/DreamWasTakenFree $15 with Code DREAMYT: http://cash.app/13+Follow my socials:➽ Twitter - @dream➽ Instagram - @dreamwastaken➽ Snapchat - @dreampublicMerch: https://www.dream.shopMr Beast: @MrBeast BadBoyHalo: @BadBoyHalo George: @GeorgeNotFound Sapnap: @Sapnap This video is a different rendition of my normal challenge videos, where there are THREE hunters trying to stop me from beating Minecraft.We're so close to 30 million subscribers! Make sure to subscribe :) also congrats to Mr Beast on 100 million!!!In this challenge, the pot starts at 1 million dollars and it goes down $69 every 1 second. When I beat the game, the money that's left is given away to a RANDOM SUBSCRIBER! So make sure to subscribe! There's a catch though. If I don't beat the game quick enough, the money goes into the negatives, and that's how much I have to pay my 3 friends that are hunting me down!It's a race, and it's super intense and we had a lot of laughs. I love doing these challenges.If this video gets 1,000,000 likes, I might try and convince someone else to do it! Not Minecraft, But Water Rises or Minecraft, But Lava Rises, or any other but challenge like that. This is a speed run / speed runner of Minecraft against a killer / assassin#MrBeastHunt"
"pLnxq7EDguU","LIVERPOOL WINS THE FA COMMUNITY SHIELD 3-1 vs. MAN CITY! 🏆 | Full Highlights | ESPN FC","2022-07-30T18:47:21Z","UC6c1z7bA__85CIWZ_jpCK-Q","ESPN FC","17","22.01.08","Liverpool|Liverpool vs. Manchester City|Manchester City|full highlights|football highlights|liverpool highlights|liverpool manchester city|manchester city highlights|darwin nunez|mohamed salah|julian alvarez|erling haaland|fa community shield|fa community shield 2022|community shield|liverpool|highlights|soccer|football|full match|man city|man city highlights|soccer highlights","490422","0","0","856","https://i.ytimg.com/vi/pLnxq7EDguU/default.jpg","False","True","Trent Alexander-Arnold, Mohamed Salah and Darwin Nunez score against Man City to deliver Liverpool its first Community Shield in 18 years.Watch the Game Highlights from Liverpool vs. Manchester City, 07/30/2022"
"7NgK3PSgzbk","Danny Garcia vs. Jose Benavidez Jr: Highlights | SHOWTIME CHAMPIONSHIP BOXING","2022-07-31T04:23:38Z","UCFPoJNd0d4k1H9A6UOlikcg","SHOWTIME Sports","17","22.01.08","showtime|shosports|sports|Gary Russell Jr.|russell jr|russell|nyambayar|russell jr vs nyambayar|king tug|wbc featherweight|wbc|challenger|showtime boxing|boxing|shosports boxing|showtime sports boxing|shobox|shoboxing|teaser|Presser|Press Conference|Danny Garcia|garcia Benavodez|Jose benavidez|Jose Benavidez|Gary Antuanne Russell|Gary Russell|Danny Garcia Highlights|Vito Mielnicki|Sergiy Derevyanchenko|Philly|Phoenix","646847","0","0","1009","https://i.ytimg.com/vi/7NgK3PSgzbk/default.jpg","False","True","In a triple-header, two-division world champion and Brooklyn fan-favorite Danny Garcia impressed with a decision win over Jose Benavidez Jr. his 154-pound debut. Plus, Gary Antuanne Russell and Ali Eren Demirezen pick up huge wins.#SHOSports #dannygarcia #josebenavidez #garciabenavidez #boxing Don't miss out on the action! Visit the below links to sign up for reminders!Championship Boxing: https://s.sho.com/3oiG6REBellator: https://s.sho.com/3eSmXDbSubscribe to the SHOWTIME Sports YouTube channel: https://goo.gl/s8CWVTFollow SHOWTIME Sports:Facebook: https://www.facebook.com/ShoSports/Twitter: https://twitter.com/SHOsportsInstagram: https://instagram.com/shosportsOfficial Site: https://www.sho.com/sportsFollow SHOWTIME Boxing:Facebook: https://www.facebook.com/ShoBoxingTwitter: https://twitter.com/ShowtimeBoxingInstagram: https://instagram.com/showtimeboxingSnapchat: https://www.snapchat.com/add/showtimeboxingTumblr: http://showtimeboxing.tumblr.com/Follow SHOWTIME Basketball:Instagram: https://www.instagram.com/showtimebasketballTwitter: https://twitter.com/shobasketballFollow ALL THE SMOKE:Instagram: https://www.instagram.com/allthesmoke/YouTube: https://bit.ly/2OLkr50 Follow BELOW THE BELT with Brendan Schaub:Facebook: https://www.facebook.com/BelowTheBeltSHOTwitter: https://twitter.com/btbshowtimeInstagram: https://www.instagram.com/belowthebelt/YouTube: http://s.sho.com/BelowtheBeltFollow MORNING KOMBAT:Instagram: https://www.instagram.com/morningkombat/YouTube: https://bit.ly/2lPpvsjFollow INSIDE THE NFL:Facebook: https://www.facebook.com/insidetheNFLTwitter: https://twitter.com/insidetheNFLInstagram: https://www.instagram.com/insidetheNFL/Follow 4th and Forever:Instagram: https://www.instagram.com/4thandforever/YouTube: http://bit.ly/30iZqSZFollow SHOWTIME:Facebook: https://www.facebook.com/showtimeTwitter: https://twitter.com/ShowtimeInstagram: https://instagram.com/showtime/Youtube: https://www.youtube.com/user/SHOWTIMEOfficial Site: https://www.sho.com/"
"_T2Avd3tFHc","Traveling to the “Worst” Country in Europe","2022-07-31T17:00:17Z","UCvK4bOhULCpmLabd2pDMtnA","Yes Theory","24","22.01.08","yestheory|seek discomfort|yes theory strangers|yes theory travel|yes theory subscribers|getting out of your comfort zone|Amazon FBA|moldova|travel|worst country in europe|least visited country in europe|most boring town|most boring town in america|eastern europe|moldova travel|soviet travel|yes theory soviet|transnistria|country that doesn't exist on a map","834879","0","0","3924","https://i.ytimg.com/vi/_T2Avd3tFHc/default.jpg","False","True","HAPPY SEEKERS DAY! 30% OFF all-time BEST-SELLERS ON SEEK DISCOMFORT: ⚡️ http://seek-discomfort.com/yes-theory We decided that to celebrate 7 years of Yes Theory we'll keep this once-a-year offer available for 7 days :) Now's your chance to get some!! Enjoy and see you in September!!🙏🏼 Thank you for making these videos possible through your support of Seek DiscomfortTo see whether the internet had any truth in calling this country the worst in Europe... We decided to travel to it and spend 3 days exploring in the search for a spontaneous and immersive experience. With no plan, it truly could not have ended up better than this :)Thank you to Eric for bridging our world with Mikhail’s!https://instagram.com/erictabach?igshid=YmMyMTA2M2Y=Thank you to Staffan for coming along with so many good vibes!https://instagram.com/staffantaylor?igshid=YmMyMTA2M2Y=Special Thank You to Nathan from the channel https://www.youtube.com/c/BeyondTheGuitar for letting us use the cover of Married Life at the end of the video, check out his channel for more beautiful covers and guitar lessons✈ Book an Adventure: https://travel.yestheory.com/JOIN OUR COMMUNITY⁺ Seek Discomfort: https://www.youtube.com/seekdiscomfort📝 Follow Matt’s Newsletter: http://yestheory.com/newsletter/📸 Instagram -  https://www.instagram.com/yestheory/🐦 Twitter - https://twitter.com/yestheory🎬  Facebook- https://www.facebook.com/yestheory/☮️ If you want to join the Yes Fam Facebook group which is 100,000+ of our most engaged and badass community members, you can apply here: https://www.facebook.com/groups/yesfam/🎥 HOW WE MAKE OUR VIDEOS🎵 Where we find our music:1- Epidemic Sound. Amazing royalty free music for YouTube. Free 30 day trial here: http://share.epidemicsound.com/wFFbr  2- Musicbed. Amazing label-quality cinematic music. 30-day free trial here:http://share.mscbd.fm/YesTheory​3- Artlist. 2 Months Free High Quality Music: https://artlist.io/artlist-70446/?artlist_aid=YesTheory_593&utm_source=affiliate_p&utm_medium=YesTheory_593&utm_campaign=YesTheory_5934- Soundstripe: Get 15% off by using the code YESTHEORY at the link https://soundstripe.com?fpr=yestheory🎞 Our b-roll and stock footage:2 Months Free Stock Footage Videos: https://artgrid.io/artgrid-114820/?artlist_aid=YesTheory_593&utm_source=affiliate_p&utm_medium=YesTheory_593&utm_campaign=YesTheory_593For an amazing b-roll and footage library, checkout: http://storyblocks.com/YesTheory​📈  Our Most Popular YouTube Videos🎬  Traveling to the least visited country in the world: https://youtu.be/ODuEl4oNae0🎬  Becoming Superhuman with Iceman Wim Hof: https://youtu.be/8cvhwquPqJ0🎬  We Helicopter Bungee Jumped with Will Smith: https://youtu.be/KSu6gRp7UBA🎙 The Yes Theory Podcast: https://spoti.fi/3sFdq6vGET IN TOUCH🌍 Our website -  http://www.yestheory.com 🌍 Advertise With Us - partnerships@yestheory.com Who are we? We believe that life’s greatest moments and deepest connections exist outside of your comfort zone.Ask us a Question:Tweet us @yestheory"
"tmRaJdUh9uY","The problem with Anime girls... [animation]","2022-07-31T16:52:48Z","UCNnKprAG-MWLsk-GsbsC2BA","Flashgitz","23","22.01.08","Flashgitz|Flashgitz anime|Flashgitz genshin impact|genshin impact cartoon|genshin impact funny|genshin impact fan|genshin impact mona|flashgitz mona|genshin cartoon|genshin parody|genshin mona cartoon|genshin mona parody","800270","0","0","3923","https://i.ytimg.com/vi/tmRaJdUh9uY/default.jpg","False","True","Celebrate Genshin Impact v2.8 with me: https://hoyo.link/8e6E8BA6Thanks to Genshin Impact for sponsoring this video.Use code “XTNDKTEBWA59” to redeem for 60 primogems and 5x Adventurer’s Experience.Special thanks to our Patron Producers!Albert HutchinsAndrew PalmerAdam KnopowCreated by ► Tom Hinchliffe & Don GregerBoards ►BoyPorcelain https://www.twitter.com/OKillustrationsRadioplay/Animatic/editing/assembly ►Nate De OliveiraAssets ►Redminus https://www.twitter.com/RedminusAnimation ►BoyPorcelain https://www.twitter.com/OKillustrationsCaleb https://www.twitter.com/caleb_jordannTwisted4000 https://www.twitter.com/twisted4kStorkToons https://www.youtube.com/c/GlenorsvenStorkToonsSuperYoumna https://www.instagram.com/superyoumnaRyan Simmons https://www.instagram.com/ryansimmons.animationBackgrounds ►Naav Draws https://www.instagram.com/naav_draws/Adila Noor https://twitter.com/taksesalSoured Apple https://twitter.com/SouredAppleChompolon https://twitter.com/chompolinoMaya Dumas https://twitter.com/lexivineRichtsu https://www.instagram.com/richtsuuGreg Bartlett https://twitter.com/ZeedoxAnime illustration ►SourLiveArt https://instagram.com/sourliveartMusic ►Zach Heyde https://youtube.com/playlist?list=PLXtP4ANq7nIUYo6VZEEHtd8H3HP_MthUCSound ► Justin Greger https://twitter.com/imadeasongAd Compositing ► Oddest of the OddVO ► Gamer - DonMona - Frankie Lollia https://www.twitch.tv/frankielolliaAnime Jesus - AJ SparkxSinging ►Nano Nii https://twitter.com/NanoNiiNii Instagram ►https://www.instagram.com/flashgitz/https://www.instagram.com/flashgitzdonhttps://www.instagram.com/flashgitzt0mTwitter ►https://www.twitter.com/flashgitztomhttps://www.twitter.com/flashgitzdonhttps://www.twitter.com/flashgitzanimsPatreon ►https://patreon.com/flashgitzMerch ►https://crowdmade.com/flashgitzDiscord ►https://discord.gg/nJCcJj6"
"YknJOItf4Yw","Brandon Moreno Octagon Interview | UFC 277","2022-07-31T04:20:11Z","UCvgfXK4nTYKudb0rFR6noLA","UFC - Ultimate Fighting Championship","17","22.01.08","ufc|mma|ultimate fighting championship|UFC 277|co|main|event|card|best|of|highlight|kick|punch|knockout|ko|finish|win|fight|fighter|bout|july 30|2022|saturday|flyweight|division|opponent|matchup|brandon|moreno|kai|kara|france|Deiveson|figueiredo|champion|champ|belt|title|joe|rogan|interim|rematch|octagon|interview|question|answer|post fight","1409948","0","0","2889","https://i.ytimg.com/vi/YknJOItf4Yw/default.jpg","False","True","Newly crowned UFC interim flyweight champion Brandon Moreno was joined by current champ Deiveson Figueiredo and Joe Rogan in the Octagon following his third-round knockout win over Kai Kara France in the co-main event Saturday at UFC 277.Subscribe to get all the latest UFC content: https://ufc.ac/3u8FIJpExperience UFC live with UFC FIGHT PASS, the digital subscription service of the UFC. Visit https://ufcfightpass.com/To order UFC Pay-Per-Views on ESPN+, visit https://ufc.ac/3NKBvmx (U.S. only)To order UFC Pay-Per-Views, visit http://welcome.ufcfightpass.com/#PPV (Non U.S.)👉 Shop official UFC Gear, visit https://ufcstore.com👉 Shop official UFC Memorabilia, visit https://ufccollectibles.com👉 Shop official UFC VIP Live Event Experiences, visit https://ufc.ac/3Oz2gLHConnect with UFC online and on Social:🔴 Website: http://www.ufc.com🔵 Twitter: http://www.twitter.com/ufc🔵 Facebook: http://www.facebook.com/ufc🔴 Instagram: http://www.instagram.com/ufc🟡 Snapchat: UFC🟣 Twitch: https://www.twitch.tv/ufcConnect with UFC FIGHT PASS on Social:🔵 Twitter: http://www.twitter.com/ufcfightpass🔵 Facebook: http://www.facebook.com/ufcfightpass🔴 Instagram: http://www.instagram.com/ufcfightpass#UFC #UFC277"
"G1vtJsi8KY8","Garcia vs Benavidez HIGHLIGHTS: July 30, 2022 | PBC on Showtime","2022-07-31T08:10:33Z","UCWXYAGB9SadlL6p5Bb66wWw","Premier Boxing Champions","17","22.01.08","Boxing|PBC|premier boxing champions|ko|tko|knockouts|fighter|boxer|mayweather|al haymon|showtime boxing|wilder|thurman|spence|porter|broner|fighting|best of|highlights|wbo|wba|wbc|ibo|ibf|boxing highlights|jose benavidez|danny garcia|danny garcia highlights|garcia benavodez|jose benavidez jr.|danny garcia vs jose benavidez jr|danny garcia vs benavidez|Danny Garcia vs Jose Benavidez|garcia vs benavidez|jose benavidez highlights|garcia vs benavidez highlights","459273","0","0","923","https://i.ytimg.com/vi/G1vtJsi8KY8/default.jpg","False","True","Two-division world champion Danny “Swift Garcia dominated in his super welterweight debut Saturday night, cruising to a majority decision victory over exciting contender Jose Benavidez Jr. in the SHOWTIME main event from Barclays Center in Brooklyn headlining a Premier Boxing Champions event. He saved perhaps his most expressive moment post-fight when he broke down in the ring discussing his struggles with mental health with SHOWTIME reporter Jim Gray, showing the authenticity that has made him such a fan-favorite in Brooklyn.  “I did take a break going through mental things, things went dark, I went through anxiety, deep depression, just trying to be strong,” said a visibly emotional Garcia. “It was the pressure of life, being a good dad, just letting it out right now, because it was all stuck inside. It rained on me for a year and a half and the only way to do better was to fight again. I’m a fighter. If you battle anxiety and depression, you can get out of it, that’s what I did today. I fought.” Philadelphia’s Garcia (37-3, 21 KOs) has become a staple at Barclays Center ever since headlining the arena’s first boxing event in 2012, and his return on Saturday night against Benavidez (27-2-1, 18 KOs), saw him pick up his seventh victory in Brooklyn.#DannyGarcia #JoseBenavidez #GarciaBenavidezVisit PremierBoxingChampions.com for more info.SIGN UP FOR FIGHT ALERTS: https://pbcham.ps/FightAlertsFOLLOW US:https://twitter.com/premierboxinghttps://instagram.com/premierboxinghttps://www.facebook.com/premierboxingchampions"
"RsYyxrrxlV8","We Built a Greenhouse in a Geodesic Dome","2022-07-31T14:59:26Z","UC4laAHbk8VSgmvB47tsd2XQ","Eamon & Bec","19","22.01.08","eamon and bec|emon and bec|bec and eamon|cabin|cabin in the woods|cabin life|building a greenhouse|we built a greenhouse|building a greenhouse in canada|geodesic dome|off grid greenhouse","270908","0","0","1301","https://i.ytimg.com/vi/RsYyxrrxlV8/default.jpg","False","True","our desire to eat organic produce grew strong after Bec's cancer diagnosis so we knew we needed a greenhouse to take charge of our food supply  🌱  To get a 1 year supply of Vitamin D + 5 individual travel packs FREE with your first purchase, go to https://athleticgreens.com/eamonandbecThis is part 2 of our greenhouse build in a geodesic dome... Watch part 1:Preparing for the End of the World https://youtu.be/RLQeRYIwezYA big thank you to Ben and the entire Arctic Acres team for the opportunity to build the most amazing geodesic dome that we'll be using as a greenhouse. Check out their domes here: https://arcticacres.ca/0:47 get caught up!1:05 insulating the side walls2:13 a SKYLIGHT?!4:33 Day 45:00 painting the exterior6:20 front door install7:26 how to prevent leaks?8:39 Day 510:47 installing fans 13:25 building the pool18:16 Day 7: a familiar face is back19:35 let's build some garden beds22:51 the tractor disaster24:38 planting our first seedsAthletic Greens is a comprehensive, all-in-one greens powder engineered to fill the nutritional gaps in your diet and support your body’s nutritional needs across four pillars of health: Gut health, Immune support, Energy and Recovery! It’s packed with 75 vitamins and minerals and whole food-sourcedingredients, combining the perfect amount of micronutrients, absorption and taste to jumpstart your daily routine. Athletic Greens is also available in the US, Canada, UK and Europe."
"WkDqWKKiH0o","OFFLINETV TRIES A HIGH ROPES COURSE","2022-07-30T20:01:40Z","UCDK9qD5DAQML-pzrtA7A4oA","OfflineTV","20","22.01.08","OfflineTV|Scarra|Poki|Pokimane|Lily|LilyPichu|DisguisedToast|Toast|TwitchTV|twitch|Streaming|Vlog|Fail|Epic|Gamers|Streamers|OTV|OTV Plays|OfflineTV plays|Michael Reeves|Michael|Reeves|offlinetv high ropes|tightrope|high ropes|ropes course|high ropes course|high rope course|offlinetv ropes course|otv ropes course|otv ropes|michael reeves spider monkey","1278908","0","0","2988","https://i.ytimg.com/vi/WkDqWKKiH0o/default.jpg","False","True","It was literally 120° out 🔥Level up your tech accessories with CASETiFY - Go to https://www.casetify.com/offlinetv today to get 15% off your order! Thanks to Casetify for sponsoring this video!---------------------------------------------------------------👕 Merch & Apparel:• OfflineTV - https://offlinetv.com📸 Follow OfflineTV:• Twitter - https://www.twitter.com/OfflineTV• Instagram - https://www.instagram.com/OfflineTV• TikTok - https://www.tiktok.com/@offlinetv• Reddit - https://www.reddit.com/r/offlineTV📝 OfflineTV Roster:• Scarra - https://twitter.com/scarra• Pokimane - https://twitter.com/pokimanelol• LilyPichu - https://twitter.com/LilyPichu• Disguised Toast - https://twitter.com/DisguisedToast• Michael Reeves - https://twitter.com/michaelreeves• QuarterJade - https://twitter.com/QuarterJade• Masayoshi - https://twitter.com/ItzMasayoshi• Sydeon - https://twitter.com/Sydeon• Yvonnie - https://twitter.com/yvonnie🎥 Producer & Director:• Brodin - https://twitter.com/brodinplett🎞️ Edited by: • Dunois - https://twitter.com/DunoisKR#OfflineTV #Challenge #Subscribe"
"cjG-ZxzjkpM","Uncle Roger Review MOST TRADITIONAL EGG FRIED RICE (Adam Liaw)","2022-07-31T14:00:27Z","UCVjlpEjEY9GpksqbEesJnNA","mrnigelng","23","22.01.08","nigel ng|uncle roger|nigel ng comedy","937822","0","0","2099","https://i.ytimg.com/vi/cjG-ZxzjkpM/default.jpg","False","True","Adam Liaw is masterchef winner and fellow Malaysian, but we not gonna go easy on him. How is Yangzhou fried rice?Original weejio: https://youtu.be/slCxLUgkrmwGet the final tickets to Uncle Roger tour: https://www.livenation.co.uk/artist-nigel-ng-1322783Use code UNCLEROGER to get 10% off Uncle Roger's favorite soup dumplings (US only): https://thexcj.com/discount/UNCLEROGER💰 Support me so I can keep making weejios for you!Merch: https://unclerogermerch.com/Channel membership: https://www.youtube.com/channel/UCVjlpEjEY9GpksqbEesJnNA/joinShoutouts: https://www.cameo.com/mrnigelng---Edited by: Nigel Ng and Frankie LoweWritten by: Nigel Ng and Morgan ReesUncle Roger is the creation of comedian Nigel Ng.Follow my socials for more content ⬇️💬 Discord: https://discord.gg/2WT3gfc2Qw📸 Instagram: https://www.instagram.com/mrnigelng/👪 Facebook: https://www.facebook.com/nigelngcomedy/🤖 Reddit: https://www.reddit.com/r/UncleRoger/🕺 tiktok: https://www.tiktok.com/@mrnigelng🐦 Twitter: https://twitter.com/MrNigelNg🌎 If you want me to tour your area, put your city in here: http://bit.ly/nigelngmail© Orange Heart Productions"
"-capZjxVKiM","Dream - MrBeast $1,000,000 Challenge (Extra Scenes)","2022-07-30T10:09:36Z","UChU3JRloULzdFX3aCu7BiSA","DreamXD","22","22.01.08","[none]","1067512","0","0","5411","https://i.ytimg.com/vi/-capZjxVKiM/default.jpg","False","True","This is extra scenes from Dream's channel of the Minecraft Speedrunner VS Mr Beast $1,000,000 Challenge video. Free $15 with Code DREAMYT download cashapp now: http://cash.app/13+Original Video: https://www.youtube.com/watch?v=wwkH0prchjQThis video was crazy fun and intense. Definitely one of the hardest challenges.Minecraft challenge videos are fun to do :)"
"pOZAuTFwXgI","I Finished My...I Mean Rens Castle! :: Hermitcraft S9","2022-07-31T16:00:12Z","UClu2e7S8atp6tG2galK9hgg","BdoubleO100","20","22.01.08","minecraft|hermitcraft|bdoubleo|bdubs|bdoubleo100|bdouble0|hermitcraft 9|hermitcraft season 9|minecraft hermitcraft","230328","0","0","927","https://i.ytimg.com/vi/pOZAuTFwXgI/default.jpg","False","True","Minecraft time on the Hermitcraft Server Season 9 SMP Episode 12.  Go to https://expressvpn.com/bdubs and get 3 months of ExpressVPN for free.Today on the Hermitcraft Minecraft SMP,  we finish the castle for the king! and spend hours and hours and hours trying to get someone to sing a duet with us. Become a Memeber:https://www.youtube.com/channel/UClu2e7S8atp6tG2galK9hgg/joinMY LINKS:▬▬▬▬▬▬▬▬▬▬▬▬▬▬▬▬▬▬▬▬▬▬▬Instagram: @BdoubleOinstaTwitter: http://www.twitter.com/bdoubleo100Patreon: https://www.patreon.com/BdoubleO100▬▬▬▬▬▬▬▬▬▬▬▬▬▬▬▬▬▬▬▬▬▬▬Hermitcraft Website: http://hermitcraft.com/#minecraft #hermitcraft"
"p_VssaTwwLY","Harry Styles Audition: EXTENDED CUT | The X Factor UK","2022-07-30T15:00:36Z","UCEY1ejsweY4DgMwOVJeEaBA","The X Factor UK","24","22.01.08","the x factor|X Factor UK|xfactor|x-factor|Simon Cowell|X Factor Final|Nicole Scherzinger|the x factor auditions|X Factor 2020|X Factor 2021|x factor auditions|Sharon Osborne|louis walsh|dermot O'leary|the x factor final|performance|x factor live shows|best of x factor|best of|uk singers|amazing singers|uk talent show|Hey Soul Sister|Train|Harry Styles|One Direction|1D|Unseen|extended|never seen before","771489","0","0","1644","https://i.ytimg.com/vi/p_VssaTwwLY/default.jpg","False","True","Meet Harry Styles again for the very first time, but with EXTRA footage that's never been aired before!Featuring an unseen performance of Train's 'Hey, Soul Sister'. SUBSCRIBE: http://bit.ly/TXFSubFacebook: http://bit.ly/TXFFBTwitter: http://bit.ly/TXFTwiInstagram: https://bit.ly/3QAQxhe"
