video_id,title,publishedAt,channelId,channelTitle,categoryId,trending_date,tags,view_count,likes,dislikes,comment_count,thumbnail_link,comments_disabled,ratings_disabled,description
"vDGTCiZYhl4","I Added Your DUMB Ideas To Minecraft..","2022-07-31T17:00:35Z","UCS5Oz6CHmeoF7vSad0qqXfw","DanTDM","20","22.01.08","dantdm|dan tdm|gaming|video games|funny|minecraft","774151","0","0","6161","https://i.ytimg.com/vi/vDGTCiZYhl4/default.jpg","False","True","SUBSCRIBE OR FOR LAUGHSIn this DanTDM Minecraft video, I'm putting your dumb ideas into Minecraft. This is funny.Edited by: DanTDM & https://twitter.com/Bree7eEdits & http://www.twitter.com/NoGoodDavisTwitter: http://www.twitter.com/DanTDMInstagram: http://www.instagram.com/DanTDM"
"zD6SWDm1zf4","MM07292022","2022-07-30T03:06:33Z","UCOKAdrQ0sKR9H1hi88RmQkA","MegaMillions","20","22.01.08","[none]","569535","0","0","1870","https://i.ytimg.com/vi/zD6SWDm1zf4/default.jpg","False","True","$1 Billion Mega Millions Jackpot - Friday, 29 July, 2022. Good Luck Everyone!"
"edAcHy1_95w","HIGHLIGHTS | Arsenal vs Sevilla (6-0) | Gabriel Jesus scores a hat-trick on Emirates Stadium debut!","2022-07-31T11:00:31Z","UCpryVRk_VDudG8SHXgWcG0w","Arsenal","17","22.01.08","Arsenal|Arsenal FC|Arsenal Football Club|Football|Club|EPL|Premier League|Soccer|Sport|Team|bernd leno|Mana Iwabuchi|Kieran Tierney|Teirney|meidema|Aaron Ramsdale|Takehiro Tomiyasu|granit xhaka|gabriel martinelli|bukayo saka|Thomas partey|Gabriel Magalhaes|Nicolas Pepe|Odegaard|Odegard|Ødegaard|Smithrowe|smith rowe|arsenal highlights|arsenal training|mikel arteta|gabriel jesus|gabreil|jesus|sevilla","1886713","0","0","2172","https://i.ytimg.com/vi/edAcHy1_95w/default.jpg","False","True","We finished our pre-season campaign in fine style by thrashing Sevilla 6-0 to claim the Emirates Cup, with Gabriel Jesus making an instant impression on his new supporters by grabbing a hat-trick.A capacity crowd were treated to four goals in the opening 20 minutes, courtesy of braces from Bukayo Saka and Jesus, with the Brazilian striker completing his treble on 77 minutes before Eddie Nketiah got in on the act in the final minute.The performance, clinical finishing and clean sheet ensured it was a wonderful afternoon’s work for Mikel Arteta’s men, who look well-prepared for the Premier League starting in six days’ time.The atmosphere was buoyant at Emirates Stadium before kick-off, which only increased during the opening 20 minutes as we ran riot and found the net four times to stun our opponents.The scoring began in the 10th minute when Martin Odegaard clipped a ball over the top for Saka to chase, who was inexplicably pushed over by Karim Rekik, leaving referee Andy Madley no option but to award a penalty, which Saka stroked home.The lead was swiftly doubled two minutes later when Ben White’s crossfield pass picked out Jesus on the left touchline, who then found Granit Xhaka. After edging his way into the box, his low cross was parried by Bono into the path of the onrushing Jesus, who had the simple task of tucking the chance away.And after giving the majority of supporters their first glimpse of his famous telephone celebration in Arsenal colours, he was at it again two minutes later. Again the threat came down the left but this time through Gabriel Martinelli, and with the Sevilla defence sleeping, a teasing cross allowed Jesus to race in behind and dispatch the delivery into the net.Sevilla had completely lost their heads, and that was typified by our fourth goal. A routine pass back to Bono saw the goalkeeper fluff a weak clearance straight to Saka, whose first-time effort trickled through the shot-stopper’s legs to cap off an incredible start.Glee was spreading around the stadium, and none more so than on the pitch, with Arteta’s team producing plenty of slick passing and looking threatening every time they entered the final third.During a couple of rare forays forward for the visitors in the first half, Youssef En-Nesyri flashed a shot just wide before heading straight at Aaron Ramsdale - a feat Thomas Partey repeated following a corner, before a remarkable half ended with Bono clawing back some redemption by making a double save to deny both Jesus and Odegaard, and then denying Martinelli one-on-one.It was a much tighter affair immediately after the break, with Rekik heading a corner just wide 10 minutes after the restart, but we were working through the gears again and after Jesus dragged an attempt from 25 yards wide, Oleksandr Zinchenko picked out Odegaard in the box but he blasted over.Midway through the second half there was almost a delightful goal to cheer when Partey chipped a ball over the backline for Xhaka, and his side-footed volley narrowly missed the top corner, but on 77 minutes the long wait for another goal ended.A Martinelli corner caused havoc as Gabriel forced Bono into a close-range save, but Jesus was on hand to drive home the rebound, complete his treble and register his seventh goal in just five pre-season outings.White almost put the cap on the result when a clever free-kick routine saw him attempt to lob Bono but it drifted wide, but in the final minute a sixth was added when Xhaka showed good skill to play in Martinelli, and after carrying the ball 40 yards the Brazilian unselfishly squared to Nketiah to complete the rout.The final whistle was greeted with rapturous applause by those in attendance, who stayed to watch Odegaard get his hands on the Emirates Cup trophy to mark our sixth triumph in the competition’s history.Enjoy match highlights, training and behind the scenes to get closer to the likes of Bukayo Saka, Emile Smith Rowe, Gabriel Jesus, Vivianne Miedema, Nicolas Pepe, Leah Williamson, Bernd Leno, Nikita Parris, Mana Iwabuchi, Jordan Nobbs, Takehiro Tomiyasu, Kim Little, Gabriel Martinelli, Aaron Ramsdale, Beth Mead, Ben White, Thomas Partey and more.Subscribe to the Official Arsenal YouTube Channel: https://arsn.al/youtubeFollow us on Facebook: https://arsn.al/facebookFollow us on Twitter: https://arsn.al/twitterFollow us on Instagram: https://arsn.al/instagramFollow us on TikTok: https://arsn.al/tiktok"
"4P6l35M61GY","Note Block Universe - Animation vs. Minecraft Shorts Ep 29","2022-07-30T12:00:11Z","UCbKWv2x9t6u8yZoB3KcPtnw","Alan Becker","1","22.01.08","animation vs minecraft|alan becker|minecraft animation stickman|minecraft animation|stick figure|stick fight|roller coaster|stickman animation|minecraft animations|note blocks|stick iq|avm shorts|animator vs animation|minecraft vs animation|alan becker minecraft|jaiden animations|minecraft story mode|family friendly","5223121","0","0","32164","https://i.ytimg.com/vi/4P6l35M61GY/default.jpg","False","True","Green has to use music to ask where Purple went.🖐 ASK ME ANYTHING! https://www.youtube.com/noogai89/join👕 MERCH! https://store.alanbecker.store💬DISCORD SERVER ► https://discord.gg/alanbecker 🕹️ANIMATORS VS GAMES ► https://www.youtube.com/AnimatorsVSGames📷INSTAGRAM ► http://www.instagram.com/alanbecker ✏️TWITTER ► http://twitter.com/alanthebeckerAnimated by Terkoiz, Fordz, Ellis02, Shuriken255, AJAnims, Able Rai, Simple Fox, SmoilySheep, Oxob3000, Hexal, Nemo, KayalMusic by Aaron Grooves (first half), and Scott Buckley (second half)Sound Design by Pepper, Alexandr Samarov, EgorBackgrounds by TheKaemble, Avenoire, Brian Nguyen"
"ukIGxgdbqqI","Stray Kids Time Out M/V","2022-07-31T14:59:53Z","UCaO6TYtlC8U5ttz62hTrZgg","JYP Entertainment","10","22.01.08","JYP Entertainment|JYP","2367475","0","0","59324","https://i.ytimg.com/vi/ukIGxgdbqqI/default.jpg","False","True","Stray Kids(스트레이 키즈) Time Out M/V Stray Kids Mixtape : Time OutiTunes & Apple Music: https://stray-kids.lnk.to/MixtapeTimeOut/AppleMusicSpotify: https://stray-kids.lnk.to/MixtapeTimeOut/Spotify🌊Listen to ＜Mixtape : Time Out＞ now!✨http://Stray-Kids.lnk.to/MixtapeTimeOutStray Kids Official YouTube: https://www.youtube.com/c/StrayKidsStray Kids Official Facebook: https://www.facebook.com/JYPEStrayKids/Stray Kids Official Instagram: https://www.instagram.com/realstraykids/Stray Kids Official Twitter: https://twitter.com/Stray_KidsStray Kids Official TikTok: https://www.tiktok.com/@jypestraykidsStray Kids Official Fan's: https://fans.jype.com/StrayKids#StrayKids #스트레이키즈 #TimeOut#Mixtape_TimeOut#YouMakeStrayKidsStay Copyrights 2022 ⓒ JYP Entertainment. All Rights Reserved."
"rxTwcrM8ITM","McKinney fire in Northern California explodes to 30,000 acres","2022-07-31T13:39:50Z","UCVhtkN7-c8mA8GXEoxS4YQw","KTVU FOX 2 San Francisco","25","22.01.08","mckinney fire|wildfire|california fire|northern california|siskiyou|newsom|ktvu","312389","0","0","1115","https://i.ytimg.com/vi/rxTwcrM8ITM/default.jpg","False","True","The McKinney fire burning in Siskiyou County has exploded in size over the weekend. Officials said it is already larger than the Oak Fire burning near Yosemite.Subscribe to KTVU's YouTube channel:https://www.youtube.com/channel/UCVhtkN7-c8mA8GXEoxS4YQw?sub_confirmation=1KTVU delivers the best in-depth reports, interviews and breaking news coverage in the San Francisco Bay Area and CaliforniaWatch KTVU's newscasts on https://www.ktvu.com/liveDownload KTVU's news and weather apps for free at https://www.ktvu.com/mobile-appsSubscribe to KTVU's newsletter at https://www.ktvu.com/newslettersFollow KTVU on Facebook: https://www.facebook.com/ktvuFollow KTVU on Twitter: https://twitter.com/KTVUFollow KTVU on Instagram: https://www.instagram.com/ktvu2/"
"Hw2VVK8A2CQ","UPDATE FINALLY","2022-07-30T19:51:02Z","UCYgu0fttWftjyrBULuuaxZA","Deanna Giulietti","22","22.01.08","[none]","102294","0","0","916","https://i.ytimg.com/vi/Hw2VVK8A2CQ/default.jpg","False","True","I would love to hear what you think!"
"SiM1At3O53E","CA sheriff orders raid on Indiana Batmobile garage, allegedly as favor for friend - EXCLUSIVE","2022-07-30T03:25:19Z","UCYUbNjkuE4lsr2v1Id2O1oA","ABC7 News Bay Area","25","22.01.08","abc|abc7 news|batmobile raid indiana|San Mateo County sheriff Carlos Bolanos|Fiberglass Freaks of Logansport|batmobile factory raided|san mateo county political favor|i-team investigation|batmobile|batman","2292207","0","0","11149","https://i.ytimg.com/vi/SiM1At3O53E/default.jpg","False","True","Holy political favors, Batman! That's the allegation against San Mateo County Sheriff Carlos Bolanos for sending a four-man team across the country last week, to raid the garage that builds Batmobiles. Read the ABC7 News I-Team report here: https://abc7ne.ws/3Q8tglN#Batmobile #raid"
"jXrxDKwlA_s","It's been a minute...","2022-07-29T14:00:29Z","UCKuHFYu3smtrl2AwwMOXOlg","Will Smith","24","22.01.08","[none]","3131707","0","0","24154","https://i.ytimg.com/vi/jXrxDKwlA_s/default.jpg","False","True","Thanx y’all"
"w1csR1MHTbM","HIGHLIGHTS | Real Madrid 2-0 Juventus  | Los Angeles","2022-07-31T05:16:20Z","UCWV3obpZVGgJ3j9FVhEjF2Q","Real Madrid","17","22.01.08","Real Madrid|Madrid|Real Madrid CF|Madridistas|Santiago Bernabéu|Bernabéu|Hala Madrid|Carlo Ancelotti|レアル・マドリード|ريال مدريد|레알 마드리드","1587769","0","0","0","https://i.ytimg.com/vi/w1csR1MHTbM/default.jpg","False","True","Inside two minutes of kick-off, Real Madrid came close to going ahead with the first move of the game when Kroos’ deep pass found Valverde, who whipped in a cross from the right-hand side for Benzema to turn into the net, only for the linesman to rule it out for off-side. Karim Benzema then stepped up to tuck home a penalty and make it 1-0, who was later followed by Marco Asensio in the second half after a magnificent team play led by Eden Hazard. Carlo Ancelotti’s team showed superb skill and teamwork in order to secure a victory in their final match.🎥  SUBSCRIBE YOUTUBE: https://www.youtube.com/subscription_center?add_user=realmadridcf📱 FOLLOW US INSTAGRAM: https://instagram.com/realmadridTIKTOK: https://www.tiktok.com/@realmadridTWITTER: https://twitter.com/realmadridTWITCH: https://www.twitch.tv/realmadridSNAPCHAT: https://snapchat.com/add/realmadridFACEBOOK: https://facebook.com/realmadrid💳 BECOME A MADRIDISTA: https://www.realmadrid.com/en/fans/madridistas/international🙌 JOIN THE MADRIDISTA NATION: https://www.facebook.com/becomesupporter/RealMadrid/?entrypoint_surface=youtube"
"TPICjKOyCUw","Tohi - Baby Oonam Dooste Mane ft. Tataloo & Pishro (Official Audio)","2022-07-31T04:48:11Z","UC7gWCUKoEq4BcxYtb_A7TGA","Tohi","10","22.01.08","[none]","510487","0","0","37680","https://i.ytimg.com/vi/TPICjKOyCUw/default.jpg","False","True","​@Tohi @Amir Tataloo @Reza Pishro ALIEN ALBUMMusic Producer: @Hasan Baba Music Art Cover by Damirchi & Khishkarwww.instagram.com/tohiwww.tohimusic.com"
"iBEQI8CGJxQ","Corey Holcomb Talks Marriage, Hollywood, Will Smith, Getting Sick, and Making Music | FULL INTERVIEW","2022-07-30T17:30:05Z","UCvIFYR01Rp0VX5vegE_uHKQ","BigBoyTV","24","22.01.08","corey holcomb|corey holcomb big boy|corey holcomb will smith|corey holcomb jada smith|corey holcomb chris rock|corey holcomb dave chappelle|corey holcomb interview|corey holcomb full interview|corey holcomb stand up|corey holcomb comedy|will smith|jada smith|jaden smith|chris rock|dave chappelle|oscars|BigBoyTV|big boy's neighborhood|big boy|interview|comedy|stand up|92.3|corey holcomb big boy interview|big boy radio|5150|full interview|radio interview","176095","0","0","566","https://i.ytimg.com/vi/iBEQI8CGJxQ/default.jpg","False","True","SUBSCRIBE TO THE NEW CHANNEL ► https://bit.ly/BigBoysNeighborhoodCorey Holcomb dropped by the neighborhood to speak with Big Boy about marriage, dating, having children, speaking his mind, and stand-up comedy. The comedian also discusses Will Smith, Chris Rock, The Oscars, Dave Chappelle, Johnny Depp, Amber Heard, TMZ, getting sick on tour, and The Corey Holcomb 5150 Show. Plus, he performs his song “I Can’t Sleep” live with Big Boy. Watch the full interview exclusively on BigBoyTV.Opinions and views expressed by Corey Holcomb in this interview are his own.Corey Holcomb Discusses Relationships, Cheating, and More | Full Interview https://youtu.be/AixA6uvebx8SUBSCRIBE► https://bit.ly/2DNKRddCONNECT - BIG BOY► Instagram: https://bit.ly/2G7GT0E► Facebook: https://bit.ly/2DPuD2W► Twitter: https://bit.ly/1NBKwYwCONNECT - NEIGHBORHOOD► Instagram: https://bit.ly/2G1LYaZ► Facebook: https://bit.ly/2DPkCTs► Twitter: https://bit.ly/2pxUHvi► Listen to Full Shows: https://ihr.fm/3v8QRtw► Blog: https://www.radiobigboy.com#CoreyHolcomb"
"ciKHSOrpNKg","Impossible Who's That Pokemon Catching Challenge","2022-07-30T15:42:53Z","UCLc_ZQgQ8h2XKUAQpqcvIdw","PM7","20","22.01.08","pokemon|pm7|pokemen7|pokemen7 plays|mandjtv|mandjtv plays|pm7 mandjtv|pm7 vs mandjtv|pokemen7 mandjtv|guess the pokemon|whos that pokemon|pokemon challenge|impossible whos that pokemon challenge|hardest whos that pokemon|impossible whos that pokemon catching challenge|pokemon catching challenge|whos that pokemon challenge|whos that pokemon catching challenge|pokemon quiz|new pokemon|cursed whos that pokemon|original pokemon|new pokemon challenge|challenge","366741","0","0","1401","https://i.ytimg.com/vi/ciKHSOrpNKg/default.jpg","False","True","We play who's that Pokemon and then try to catch the correct Pokemon to win!SUBSCRIBE: ➡️ http://bit.ly/pm7_sub ⬅️🏆John Michael Cup Playlist: https://bit.ly/JMCup1✅Mikey's Channel: ​http://bit.ly/mandjtv_plays▶️Second Channel! https://bit.ly/pm7plus_sub📹VOD Channel! https://bit.ly/pm7vods_sub🎞️Clips Channel! https://bit.ly/pm7clips_sub💸Support The Channel and Get Perks! https://bit.ly/pm7_member🐦Twitter! https://bit.ly/pm7_twitter📸Instagram! https://bit.ly/pm7_instagram👽Reddit! https://bit.ly/pm7_reddit⏰TikTok! https://bit.ly/pm7_tiktokArt by https://twitter.com/guyrodwell_Edited by https://www.youtube.com/channel/UCias_4TWH7N0czxFASEkkzg#Pokemon #Gaming #Challenge"
"k_Xwk6Afo1U","MrBeast Hit 100,000,000 Subs So I Did This...","2022-07-30T14:45:02Z","UC70Dib4MvFfT1tU6MqeyHpQ","Preston","24","22.01.08","funny|challenge|family|comedy|preston|brianna","3372380","0","0","7230","https://i.ytimg.com/vi/k_Xwk6Afo1U/default.jpg","False","True","Preston’s Back to School Bundles and Giveaway are now LIVE on firemerch.com (http://firemerch.com/) 👊 Don’t forget to enter🔥MrBeast Hit 100,000,000 Subs So I Did This...with Preston 👊👕 MERCH - http://www.firemerch.com 👀 FOLLOW ME HERE!🡆 TikTok - https://www.tiktok.com/@preston🡆 Instagram - https://instagram.com/prestonplayz🡆 Twitter - https://twitter.com/Preston🡆 PrestonShorts - https://bit.ly/2VrTLIr🎮 Join my Fan Discord! 🡆 http://discord.gg/Preston------------------------------Additional music provided by Epidemic SoundClick here for a free trial! 🡆 http://share.epidemicsound.com/TBNR"
"NrWx9Xi7dfE","I lost my BISCUITS for Luka Doncic on NBA 2K22","2022-07-31T02:00:09Z","UCSEQjmaQ-N3lcPzyvBcFWfg","Troydan","20","22.01.08","nba2k22|nba 2k22|nba2k23|nba 2k23|basketball|luka doncic|Luka Dončić|luka|end game luka|pack opening|nba pack opening|locker code|lockercodes|nba locker code|basketball pack opening|kareem|end game|packs|troydan packs|troydan pack opening|troydan|troydanreacts|biscuits|popeyes biscuits","274503","0","0","457","https://i.ytimg.com/vi/NrWx9Xi7dfE/default.jpg","False","True","Troydan opens packs for End Game Luka Doncic and End Game Kareem Abdul-Jabbar are here on NBA2K22. Will this be the worst pack opening troydan has ever had?►Join the discord http://discord.gg/troydan ►Follow on Twitter @Troydan►or follow on Instagram @Troydan"
"HomqQmZLKlo","Stronk Cat vs SCP - CIA Movie 5 (Scary! Only Watch If You Are Brave) Brookhaven 🏡RP","2022-07-30T16:09:37Z","UCdvWE7xjoL-B1FS_NFwQqTw","EYYCHEEV","20","22.01.08","[none]","754986","0","0","2995","https://i.ytimg.com/vi/HomqQmZLKlo/default.jpg","False","True","Don't miss the Super Funny ending! 🤣This video took Stronk Cat one month to make. Hope you enjoy!Credits:Rickroll Master: @Beluga Actor:@BoBoBear Writer, Director, Editor: @EYYCHEEV - Stronk Cat🌟  Use Star Code: STRONK🐈  Subscribe if you Stronk: https://bit.ly/sub-to-eyycheev🐯  Roblox Group: https://www.roblox.com/groups/8070998🐯  Discord Server: https://discord.gg/nTkyB2ktRd🐯  Twitter: https://twitter.com/eyycheevGame:Brookhaven 🏡RP: https://www.roblox.com/games/4924922222/Brookhaven-RP"
"Ud8KRhkAXFo","How I Got the Most Expensive Pet in Minecraft...","2022-07-30T15:30:10Z","UC_3rZIKC-FvhYwM76LGDp7Q","RageTrain","20","22.01.08","Ragetrain|Ragetrain Minecraft|Rage Train Minecraft|RageTrain hypixel|RageTrain Hypixel Skyblock|Minecraft|rage train|most expensive pet|minecraft pet|most expensive minecraft pet|most expensive pet in minecraft","322452","0","0","1082","https://i.ytimg.com/vi/Ud8KRhkAXFo/default.jpg","False","True","How I Got the Most Expensive Pet in Minecraft...Install Raid for Free ✅ IOS/ANDROID/PC: https://clcr.me/9K5jwi and get a special starter pack 💥 Available only for the next 30 daysDiscord ➤ https://discord.gg/ragetrainUse code RageTrain at the Hypixel Store's Support a Creator checkout box to help support the channel!➤ https://store.hypixel.net/Twitch ➤ https://www.twitch.tv/ragetrainPrevious episode ➤ https://youtu.be/a-TpBfIjdrYEdited By ➤  MeIn this video I recap my journey of buying and maxing out the most expensive pet in minecraft.🔔 TURN ON NOTIFICATIONS SO YOU NEVER MISS A VIDEO!👍 Drop a Like if you Enjoyed the Video!​#Hypixel #Minecraft"
"NlWEZKrcwMo","Skeng - Gvnman Session (Official Music Video)","2022-07-30T23:33:54Z","UCI8XzkDP8ZrWUxEMfTe-SWQ","Skeng","10","22.01.08","[none]","680723","0","0","4211","https://i.ytimg.com/vi/NlWEZKrcwMo/default.jpg","False","True","Skeng - Gvnman Session Produced By: John Coop Records X DiTruth Records Beat Composed By: Shacko X Coop#coop #ditruth #rg"
"Uv6iK2kS3qQ","Shein: When Public Image No Longer Matters | Corporate Casket","2022-07-30T18:00:20Z","UCpDmn2FfVYdPIDwRTcf5-OA","iilluminaughtii","27","22.01.08","iilluminaughtii|illuminaughti|illuminaughty|video essay|documentary|mini documentary|mini doc","492996","0","0","3244","https://i.ytimg.com/vi/Uv6iK2kS3qQ/default.jpg","False","True","Go to http://mintmobile.com/casper to cut your wireless bill to $15 a month!Welcome to the Corporate Casket, a semiweekly series where bad businesses go to die. We will discuss any and everything from bad charities, terrible CEOs, and businesses that have a lot to hide. Shein took the world by storm starting in 2012. As the newest hit in fast fashion, the company appealed to every demographic, offering trendy styles at incredibly affordable prices. Every day, someone posts a tiktok or youtube video, showing off treasure chests full of clothes. But the bright colors that represent the company hide a dark corporate empire that exploits everyone from the creators to the consumers.Connect with me: https://linktr.ee/iilluminaughtiiSources: https://justpaste.it/9pn2tWriters/Researchers/Helpers:Jess HubbertThis episode was edited by:Catechism: https://www.youtube.com/channel/UC1X38twKH-ePKOMQclh8a6g&Kelpie&Michael: https://www.flowcode.com/page/michaelseim&Collin Robinson twitter.com/CollinR027&The Mysterious BrianThis episode's audio was mixed by:G. Thomas Craig Artists:Sprites made by https://plegberb.tumblr.com/Outro song is Cake by RetrovisionYou made it all the way to the bottom of my description box so, hello there.#iilluminaughtii #shein 00:00 Hook02:03 Intro08:29 The Downfalls of Fast-Fashion11:30 Design Fails13:57 Profiting from Pain and Stolen Art17:02 Ad20:02 Stealing From Creators25:14 Outro"
"s765-C__jiU","Stolas' Childhood & Asmodeus Crystals! Everything You Missed in 2x01 Of Helluva Boss: The Circus!","2022-07-30T20:51:37Z","UCPDExPQ09Vc6_Gj_Ga6MwKw","Cartoon Universe","1","22.01.08","helluva boss|helluva boss season 2|helluva boss 2x1|helluva boss 2x01|helluva boss the circus|helluva boss premire|helluva boss new episode|helluva boss stolas|stolas childhood|bltizo childhood|stolas and blitzo kids|stolas and blitz kids|helluva boss flashbacks|helluva boss history|helluva boss stolitz|helluva boss stella|helluva boss ars goetia|helluva boss paimon|helluva boss stolas family|helluva boss blitzo family|helluva boss episode 8","198927","0","0","689","https://i.ytimg.com/vi/s765-C__jiU/default.jpg","False","True","Season 2 episode 1 of Helluva Boss is finally here, and we have a Lot to break down! Here is Everything you might have missed, and al the things I personally found interesting.✧✸Join the Cartoon Universe Discord✸✧:discord.gg/cartoonuv✸✧Support Cartoon Universe on Patreon✧✸: https://www.patreon.com/cartoonuniverseFOLLOW CARTOON UNIVERSETwitter - https://twitter.com/CartoonUVInstagram - https://www.instagram.com/cartoonuv/Facebook - https://www.facebook.com/CartoonUVTumblr - http://thecartoonuniverse.tumblr.com/HAILEYTwitter - https://twitter.com/HAK_er97Tumblr - http://randomuniverses.tumblr.com/DEEPCUTYouTube: https://www.youtube.com/channel/UCb5aUpZh_QfzbFUiLSw-fYQLogo and Mini Hailey's by Kitsune Zakuro -https://www.youtube.com/channel/UCXD0pNXyQuHtsSAdckwWdiADeepcut's Mini-Me Designed By Cherry Treats Art -https://www.youtube.com/channel/UCoWcbas6Z-A22LvoMz1xbpwEnd Screen Animations by Bobaquail- https://bobaquail.tumblr.com#helluvaboss #hazbinhotel #vivziepop"
"FFAlxxnO6iU","LAST TO LEAVE BACKYARD TRAMPOLINE PARK WINS $10,000!!","2022-07-30T14:00:16Z","UCtNBFUsxj2YVbEc5HquzFqg","Carter Sharer","24","22.01.08","[none]","524311","0","0","705","https://i.ytimg.com/vi/FFAlxxnO6iU/default.jpg","False","True","🔥SHOP NOW!!🔥━► https://www.teamrar.com/ We built an entire TRAMPOLINE PARK in the back yard of our new Team RAR house, and we're doing a LAST TO LEAVE challenge for $10,000!! Our challengers all the way from Los Angeles are @Ryan Prunty, @Stove's Kitchen, @Bailey Payne, @Lizzy Capri and of course me, Carter Sharer. Liz built a girl's lounge complete with Mr. Beast chocolate and an Amazon Prime TV, while Ryan, Stove and Bailey had the ultimate FLOOR IS LAVA showdown. Did Bailey win fair and square?! Comment below!! 💌SEND US YOUR FAN MAIL!!💌Team RAR4501 New Bern Ave Suite 130, Box # 360Raleigh NC, 27610❇️ MORE EPIC VLOGS ❇️LAST TO LEAVE BOAT CAR KEEPS IT!! https://youtu.be/A9UQG7onfpYI Used Apple Air Tags to CHEAT at Hide & Seek!! (DIDN'T GET CAUGHT) https://youtu.be/9qDIK5X-aloI BUILT the World's Biggest Backyard WATERPARK!! https://youtu.be/DHK8OyvEtBII Built a SECRET Hidden Gaming Room In My House!! (PART 1) https://youtu.be/ebtGY4QpI-s-----------------------------------------------------------------------------------------------------------📷INSTAGRAM → @CarterSharer https://www.instagram.com/cartersharer/📷INSTAGRAM → @OfficalTeamRAR https://www.instagram.com/officialteamrar/📷INSTAGRAM → @LizzyCapri https://www.instagram.com/lizzycapri/📘FACEBOOK → CARTER SHARER OFFICIAL https://goo.gl/WM7mBuSubscribe to my channel! https://goo.gl/XjjCA8-----------------------------------------------------------------------------------------------------------Business Inquiries: carter@nightmedia.coWARNING: This video is only for entertainment purposes. Do not attempt to recreate any of the acts in this video, as they may be dangerous if not done correctly, and could result in serious injury. If you rely on the information portrayed in this video, you assume the responsibility for the results. Have fun, but always think ahead, and remember that every project you try is at YOUR OWN RISK.This footage is property of Team RAR inc. and is not allowed to be repurposed without written consent from Team RAR inc. For any requests from media contact us at carter@nightmedia.co"
