video_id,title,publishedAt,channelId,channelTitle,categoryId,trending_date,tags,view_count,likes,dislikes,comment_count,thumbnail_link,comments_disabled,ratings_disabled,description
"_spuxXnul0U","HELLUVA BOSS - THE CIRCUS // S2: Episode 1","2022-07-30T17:00:20Z","UCzfyYtgvkx5mLy8nlLlayYg","Vivziepop","1","22.01.08","Helluva Boss|Helluva Boss cartoon|Helluva Boss animation|Helluva Boss official|Helluva Boss Official episode|Helluva Boss Loona|Helluva Boss Blitz|Helluva Boss Moxxie|Helluva Boss Millie|Helluva Boss Blitzo|helluva boss vivziepop|helluva boss new|helluva boss new episode|helluva boss season 2|helluva boss season 2 episode 1|helluva boss season 2 the circus|helluva boss the circus","7077266","0","0","60951","https://i.ytimg.com/vi/_spuxXnul0U/default.jpg","False","True","So you guys like backstories? Cuz things sure did happened.WARNING: for daddy issues.HELLUVA BOSS MERCH AVAILABLE ► https://sharkrobot.com/vivziepopHELLUVA SEASON TWO IS HERE!! Thank you all for the patience and understanding! We have been hard at work on these new episodes and cannot wait to bring you more soon! For those expecting part II of the S1 finale, we ran into a roadblock but season two will continue until we are able to get it out! We are just happy we can bring you more now. Thank you endlessly for the support in the meantime, we hope you enjoy this labor of love!WANT MORE? WATCH OUR OTHER EPISODES!Pilot Episode ► https://www.youtube.com/watch?v=OlahNrlcgS4S1 Episode One ► https://www.youtube.com/watch?v=el_PChGfJN8S1 Episode Two ► https://www.youtube.com/watch?v=kpnwRg268FQS1 Episode Three ►  https://www.youtube.com/watch?v=RghsgkZKedgS1 Episode Four ► https://www.youtube.com/watch?v=1ZFseYPmkAkS1 Episode Five ► https://www.youtube.com/watch?v=h2ZmVAdezF8S1 Episode Six ► https://youtu.be/yXErLiSbxXQS1 Episode Seven ► https://youtu.be/8zyGQquL8VMOr Support on Patreon!https://www.patreon.com/VivienneMedranoThumbnail by Gasu!#HelluvaBoss #HelluvaBossSeason2 #SEASONTWO"
"nxs0RHpT_Hg","BLACKPINK - 'BORN PINK' ANNOUNCEMENT TRAILER","2022-07-31T15:00:27Z","UCOmHUn--16B90oW2L6FRR3A","BLACKPINK","10","22.01.08","YG Entertainment|YG|와이지|K-pop|BLACKPINK|블랙핑크|블핑|제니|로제|리사|지수|LISA|JISOO|JENNIE|ROSÉ|BLINK|블링크|BORN PINK|본핑크|블랙핑크 본핑크|BLACKPINK BORN PINK","8692081","0","0","165741","https://i.ytimg.com/vi/nxs0RHpT_Hg/default.jpg","False","True","#BLACKPINK #블랙핑크 #BORNPINK #ANNOUNCEMENT #TRAILER #YG"
"G4-fbH9TAfM","2022 Binibining Pilipinas Grand Coronation Night","2022-07-31T17:43:46Z","UC0_SYKrjYZStvrpRhxdB-MQ","Bb. Pilipinas Official","24","22.01.08","[none]","2855590","0","0","2013","https://i.ytimg.com/vi/G4-fbH9TAfM/default.jpg","False","True","Tonight will be a crowning moment to remember! Are you all ready to meet the new Binibining Pilipinas 2022 Queens?#BbPilipinas2022 #BBPGrandCoronationNight"
"wwkH0prchjQ","Minecraft Speedrunner VS $1,000,000 MrBeast Challenge","2022-07-30T09:15:09Z","UCTkXRDQl0luXxVQrRQvWS6w","Dream","20","22.01.08","Dream Minecraft|dream Minecraft youtube|minecraft|dream|Speedrunner vs 3 hunters|Speedrunner vs someone trying to stop them|Beating Minecraft but my friend tries to stop me|Minecraft but water rises every minute|minecraft but lava rises every minute|minecraft but challenge|minecraft challenge|challenge|minecraft 1.14|beating minecraft|rematch|finale|finale rematch|grand finale|grand","8813978","0","0","51811","https://i.ytimg.com/vi/wwkH0prchjQ/default.jpg","False","True","Minecraft Speedrunner VS $1,000,000 MrBeast Challenge. This was INSANE. A new challenge.Patreon (Plugin): https://www.patreon.com/DreamWasTakenFree $15 with Code DREAMYT: http://cash.app/13+Follow my socials:➽ Twitter - @dream➽ Instagram - @dreamwastaken➽ Snapchat - @dreampublicMerch: https://www.dream.shopMr Beast: @MrBeast BadBoyHalo: @BadBoyHalo George: @GeorgeNotFound Sapnap: @Sapnap This video is a different rendition of my normal challenge videos, where there are THREE hunters trying to stop me from beating Minecraft.We're so close to 30 million subscribers! Make sure to subscribe :) also congrats to Mr Beast on 100 million!!!In this challenge, the pot starts at 1 million dollars and it goes down $69 every 1 second. When I beat the game, the money that's left is given away to a RANDOM SUBSCRIBER! So make sure to subscribe! There's a catch though. If I don't beat the game quick enough, the money goes into the negatives, and that's how much I have to pay my 3 friends that are hunting me down!It's a race, and it's super intense and we had a lot of laughs. I love doing these challenges.If this video gets 1,000,000 likes, I might try and convince someone else to do it! Not Minecraft, But Water Rises or Minecraft, But Lava Rises, or any other but challenge like that. This is a speed run / speed runner of Minecraft against a killer / assassin#MrBeastHunt"
"_T2Avd3tFHc","Traveling to the “Worst” Country in Europe","2022-07-31T17:00:17Z","UCvK4bOhULCpmLabd2pDMtnA","Yes Theory","24","22.01.08","yestheory|seek discomfort|yes theory strangers|yes theory travel|yes theory subscribers|getting out of your comfort zone|Amazon FBA|moldova|travel|worst country in europe|least visited country in europe|most boring town|most boring town in america|eastern europe|moldova travel|soviet travel|yes theory soviet|transnistria|country that doesn't exist on a map","834879","0","0","3924","https://i.ytimg.com/vi/_T2Avd3tFHc/default.jpg","False","True","HAPPY SEEKERS DAY! 30% OFF all-time BEST-SELLERS ON SEEK DISCOMFORT: ⚡️ http://seek-discomfort.com/yes-theory We decided that to celebrate 7 years of Yes Theory we'll keep this once-a-year offer available for 7 days :) Now's your chance to get some!! Enjoy and see you in September!!🙏🏼 Thank you for making these videos possible through your support of Seek DiscomfortTo see whether the internet had any truth in calling this country the worst in Europe... We decided to travel to it and spend 3 days exploring in the search for a spontaneous and immersive experience. With no plan, it truly could not have ended up better than this :)Thank you to Eric for bridging our world with Mikhail’s!https://instagram.com/erictabach?igshid=YmMyMTA2M2Y=Thank you to Staffan for coming along with so many good vibes!https://instagram.com/staffantaylor?igshid=YmMyMTA2M2Y=Special Thank You to Nathan from the channel https://www.youtube.com/c/BeyondTheGuitar for letting us use the cover of Married Life at the end of the video, check out his channel for more beautiful covers and guitar lessons✈ Book an Adventure: https://travel.yestheory.com/JOIN OUR COMMUNITY⁺ Seek Discomfort: https://www.youtube.com/seekdiscomfort📝 Follow Matt’s Newsletter: http://yestheory.com/newsletter/📸 Instagram -  https://www.instagram.com/yestheory/🐦 Twitter - https://twitter.com/yestheory🎬  Facebook- https://www.facebook.com/yestheory/☮️ If you want to join the Yes Fam Facebook group which is 100,000+ of our most engaged and badass community members, you can apply here: https://www.facebook.com/groups/yesfam/🎥 HOW WE MAKE OUR VIDEOS🎵 Where we find our music:1- Epidemic Sound. Amazing royalty free music for YouTube. Free 30 day trial here: http://share.epidemicsound.com/wFFbr  2- Musicbed. Amazing label-quality cinematic music. 30-day free trial here:http://share.mscbd.fm/YesTheory​3- Artlist. 2 Months Free High Quality Music: https://artlist.io/artlist-70446/?artlist_aid=YesTheory_593&utm_source=affiliate_p&utm_medium=YesTheory_593&utm_campaign=YesTheory_5934- Soundstripe: Get 15% off by using the code YESTHEORY at the link https://soundstripe.com?fpr=yestheory🎞 Our b-roll and stock footage:2 Months Free Stock Footage Videos: https://artgrid.io/artgrid-114820/?artlist_aid=YesTheory_593&utm_source=affiliate_p&utm_medium=YesTheory_593&utm_campaign=YesTheory_593For an amazing b-roll and footage library, checkout: http://storyblocks.com/YesTheory​📈  Our Most Popular YouTube Videos🎬  Traveling to the least visited country in the world: https://youtu.be/ODuEl4oNae0🎬  Becoming Superhuman with Iceman Wim Hof: https://youtu.be/8cvhwquPqJ0🎬  We Helicopter Bungee Jumped with Will Smith: https://youtu.be/KSu6gRp7UBA🎙 The Yes Theory Podcast: https://spoti.fi/3sFdq6vGET IN TOUCH🌍 Our website -  http://www.yestheory.com 🌍 Advertise With Us - partnerships@yestheory.com Who are we? We believe that life’s greatest moments and deepest connections exist outside of your comfort zone.Ask us a Question:Tweet us @yestheory"
"RsYyxrrxlV8","We Built a Greenhouse in a Geodesic Dome","2022-07-31T14:59:26Z","UC4laAHbk8VSgmvB47tsd2XQ","Eamon & Bec","19","22.01.08","eamon and bec|emon and bec|bec and eamon|cabin|cabin in the woods|cabin life|building a greenhouse|we built a greenhouse|building a greenhouse in canada|geodesic dome|off grid greenhouse","270908","0","0","1301","https://i.ytimg.com/vi/RsYyxrrxlV8/default.jpg","False","True","our desire to eat organic produce grew strong after Bec's cancer diagnosis so we knew we needed a greenhouse to take charge of our food supply  🌱  To get a 1 year supply of Vitamin D + 5 individual travel packs FREE with your first purchase, go to https://athleticgreens.com/eamonandbecThis is part 2 of our greenhouse build in a geodesic dome... Watch part 1:Preparing for the End of the World https://youtu.be/RLQeRYIwezYA big thank you to Ben and the entire Arctic Acres team for the opportunity to build the most amazing geodesic dome that we'll be using as a greenhouse. Check out their domes here: https://arcticacres.ca/0:47 get caught up!1:05 insulating the side walls2:13 a SKYLIGHT?!4:33 Day 45:00 painting the exterior6:20 front door install7:26 how to prevent leaks?8:39 Day 510:47 installing fans 13:25 building the pool18:16 Day 7: a familiar face is back19:35 let's build some garden beds22:51 the tractor disaster24:38 planting our first seedsAthletic Greens is a comprehensive, all-in-one greens powder engineered to fill the nutritional gaps in your diet and support your body’s nutritional needs across four pillars of health: Gut health, Immune support, Energy and Recovery! It’s packed with 75 vitamins and minerals and whole food-sourcedingredients, combining the perfect amount of micronutrients, absorption and taste to jumpstart your daily routine. Athletic Greens is also available in the US, Canada, UK and Europe."
"m32tFAo-M_g","Fally Ipupa - Bloqué (Clip officiel)","2022-07-31T10:00:23Z","UCBFYkrVI8OfHm9PzbAGFqlA","Fally Ipupa","10","22.01.08","Fally Ipupa|Bad Boy|Musique|Afro|Clip officiel|fally ipupa|aya nakamura|eloko oyo|fally|fally ipupa eloko oyo|booba|bad boy|kiname|fally ipupa bad boy|fally eloko oyo|aya|fally ipupa 2016|fally ipupa 2017|fally ipupa amour assassin|fally ipupa nourrisson|fally ipupa service|fally ipupa original|eloko|fally ipupa anissa|eloko oyo fally ipupa|fally ipupa eloko oyo audio|booba kiname","735081","0","0","3618","https://i.ytimg.com/vi/m32tFAo-M_g/default.jpg","False","True","Bloqué disponible : https://FallyIpupa.lnk.to/Bloque-Réalisation : Jonathan Lopez, Junior Balmous, Fally IpupaAssistant réalisation : Junior Seke, Eto'o Jordan-Abonnez-vous à la chaine : http://po.st/FallyIpupa-Retrouvez Fally Ipupa sur :https://www.instagram.com/fallyipupa01https://www.facebook.com/FallyIpupaOfficialhttps://twitter.com/fallyipupa01"
"cjG-ZxzjkpM","Uncle Roger Review MOST TRADITIONAL EGG FRIED RICE (Adam Liaw)","2022-07-31T14:00:27Z","UCVjlpEjEY9GpksqbEesJnNA","mrnigelng","23","22.01.08","nigel ng|uncle roger|nigel ng comedy","937822","0","0","2099","https://i.ytimg.com/vi/cjG-ZxzjkpM/default.jpg","False","True","Adam Liaw is masterchef winner and fellow Malaysian, but we not gonna go easy on him. How is Yangzhou fried rice?Original weejio: https://youtu.be/slCxLUgkrmwGet the final tickets to Uncle Roger tour: https://www.livenation.co.uk/artist-nigel-ng-1322783Use code UNCLEROGER to get 10% off Uncle Roger's favorite soup dumplings (US only): https://thexcj.com/discount/UNCLEROGER💰 Support me so I can keep making weejios for you!Merch: https://unclerogermerch.com/Channel membership: https://www.youtube.com/channel/UCVjlpEjEY9GpksqbEesJnNA/joinShoutouts: https://www.cameo.com/mrnigelng---Edited by: Nigel Ng and Frankie LoweWritten by: Nigel Ng and Morgan ReesUncle Roger is the creation of comedian Nigel Ng.Follow my socials for more content ⬇️💬 Discord: https://discord.gg/2WT3gfc2Qw📸 Instagram: https://www.instagram.com/mrnigelng/👪 Facebook: https://www.facebook.com/nigelngcomedy/🤖 Reddit: https://www.reddit.com/r/UncleRoger/🕺 tiktok: https://www.tiktok.com/@mrnigelng🐦 Twitter: https://twitter.com/MrNigelNg🌎 If you want me to tour your area, put your city in here: http://bit.ly/nigelngmail© Orange Heart Productions"
"IAM91tmc83M","Cache cache dans une des plus grandes Villa d’Afrique du Sud (Ft. Les croûtons enfin presque)","2022-07-30T12:30:14Z","UCL9aTJb0ur4sovxcppAopEw","Inoxtag","24","22.01.08","INOXTAG|INOX|CROUTON|inoxtag|croutons|cache cache afrique du sud|afrique du sud crouton|vlog valouzz|cache cache michou|cache cache inoxtag|croutons vacances","2066215","0","0","3015","https://i.ytimg.com/vi/IAM91tmc83M/default.jpg","False","True","Nouvelle vidéo ! Aujourd’hui cache-cache avec la team croutons dans la villa en Afrique du Sud, vais-je réussir à bien me cacher ? Est-ce que Valouzz est fort à cache-cache ? Est-ce que Pidi et Lebouseuh vont me trouver rapidement ? Je vous laisse découvrir la vidéo. Un petit pouce bleu et un abonnement les bg on oublie pas ! Ps: Petite pensée à Michou on aura voulu qu’il soit là !🎥 Chaîne secondaire : https://inoxtag.tv/inoxtag2.0💙 T'abonner : https://inoxtag.tv/subscribe🔔✅ Activez la cloche de notification, afin d'être au courant de mes prochains lives ou vidéos !💜 Twitch: https://inoxtag.tv/twitch🐤 Twitter: @Inoxtag / https://inoxtag.tv/twitter🚀 Actualités: @InoxtagTV_ / https://inoxtag.tv/news📸 Instagram: @Inoxtag / https://inoxtag.tv/instagram📞 Discord: https://inoxtag.tv/discord📡 Reddit: https://inoxtag.tv/reddit💎 Deviens Sponsor: https://inoxtag.tv/sponsor💌 SponsorShip : inoxtag@talentweb.frMontage : Aeron - Hakki SENMiniature : Aziatack"
"tmRaJdUh9uY","The problem with Anime girls... [animation]","2022-07-31T16:52:48Z","UCNnKprAG-MWLsk-GsbsC2BA","Flashgitz","23","22.01.08","Flashgitz|Flashgitz anime|Flashgitz genshin impact|genshin impact cartoon|genshin impact funny|genshin impact fan|genshin impact mona|flashgitz mona|genshin cartoon|genshin parody|genshin mona cartoon|genshin mona parody","800270","0","0","3923","https://i.ytimg.com/vi/tmRaJdUh9uY/default.jpg","False","True","Celebrate Genshin Impact v2.8 with me: https://hoyo.link/8e6E8BA6Thanks to Genshin Impact for sponsoring this video.Use code “XTNDKTEBWA59” to redeem for 60 primogems and 5x Adventurer’s Experience.Special thanks to our Patron Producers!Albert HutchinsAndrew PalmerAdam KnopowCreated by ► Tom Hinchliffe & Don GregerBoards ►BoyPorcelain https://www.twitter.com/OKillustrationsRadioplay/Animatic/editing/assembly ►Nate De OliveiraAssets ►Redminus https://www.twitter.com/RedminusAnimation ►BoyPorcelain https://www.twitter.com/OKillustrationsCaleb https://www.twitter.com/caleb_jordannTwisted4000 https://www.twitter.com/twisted4kStorkToons https://www.youtube.com/c/GlenorsvenStorkToonsSuperYoumna https://www.instagram.com/superyoumnaRyan Simmons https://www.instagram.com/ryansimmons.animationBackgrounds ►Naav Draws https://www.instagram.com/naav_draws/Adila Noor https://twitter.com/taksesalSoured Apple https://twitter.com/SouredAppleChompolon https://twitter.com/chompolinoMaya Dumas https://twitter.com/lexivineRichtsu https://www.instagram.com/richtsuuGreg Bartlett https://twitter.com/ZeedoxAnime illustration ►SourLiveArt https://instagram.com/sourliveartMusic ►Zach Heyde https://youtube.com/playlist?list=PLXtP4ANq7nIUYo6VZEEHtd8H3HP_MthUCSound ► Justin Greger https://twitter.com/imadeasongAd Compositing ► Oddest of the OddVO ► Gamer - DonMona - Frankie Lollia https://www.twitch.tv/frankielolliaAnime Jesus - AJ SparkxSinging ►Nano Nii https://twitter.com/NanoNiiNii Instagram ►https://www.instagram.com/flashgitz/https://www.instagram.com/flashgitzdonhttps://www.instagram.com/flashgitzt0mTwitter ►https://www.twitter.com/flashgitztomhttps://www.twitter.com/flashgitzdonhttps://www.twitter.com/flashgitzanimsPatreon ►https://patreon.com/flashgitzMerch ►https://crowdmade.com/flashgitzDiscord ►https://discord.gg/nJCcJj6"
"0WcU8kDTwKo","Liverpool v Manchester City | Key Moments | FA Community Shield 2022","2022-07-30T19:03:53Z","UCChcWqwYXCEs657MQ00qVWA","The Emirates FA Cup","17","22.01.08","Key Moments|Liverpool|Manchester City|darwin nunez|darwin nunez goals|Community Shield|Community Shied 2022|football highlights","1928814","0","0","1229","https://i.ytimg.com/vi/0WcU8kDTwKo/default.jpg","False","True","Follow @EmiratesFACup on Twitter for in-game highlights and match updates!https://twitter.com/emiratesfacupSubscribe:https://www.youtube.com/thefacupTo find out more about The Emirates FA Cup visit:TheFA.com/EmiratesFACupThe Emirates FA Cup on Facebookhttp://www.facebook.com/TheFACup"
"edAcHy1_95w","HIGHLIGHTS | Arsenal vs Sevilla (6-0) | Gabriel Jesus scores a hat-trick on Emirates Stadium debut!","2022-07-31T11:00:31Z","UCpryVRk_VDudG8SHXgWcG0w","Arsenal","17","22.01.08","Arsenal|Arsenal FC|Arsenal Football Club|Football|Club|EPL|Premier League|Soccer|Sport|Team|bernd leno|Mana Iwabuchi|Kieran Tierney|Teirney|meidema|Aaron Ramsdale|Takehiro Tomiyasu|granit xhaka|gabriel martinelli|bukayo saka|Thomas partey|Gabriel Magalhaes|Nicolas Pepe|Odegaard|Odegard|Ødegaard|Smithrowe|smith rowe|arsenal highlights|arsenal training|mikel arteta|gabriel jesus|gabreil|jesus|sevilla","1886713","0","0","2172","https://i.ytimg.com/vi/edAcHy1_95w/default.jpg","False","True","We finished our pre-season campaign in fine style by thrashing Sevilla 6-0 to claim the Emirates Cup, with Gabriel Jesus making an instant impression on his new supporters by grabbing a hat-trick.A capacity crowd were treated to four goals in the opening 20 minutes, courtesy of braces from Bukayo Saka and Jesus, with the Brazilian striker completing his treble on 77 minutes before Eddie Nketiah got in on the act in the final minute.The performance, clinical finishing and clean sheet ensured it was a wonderful afternoon’s work for Mikel Arteta’s men, who look well-prepared for the Premier League starting in six days’ time.The atmosphere was buoyant at Emirates Stadium before kick-off, which only increased during the opening 20 minutes as we ran riot and found the net four times to stun our opponents.The scoring began in the 10th minute when Martin Odegaard clipped a ball over the top for Saka to chase, who was inexplicably pushed over by Karim Rekik, leaving referee Andy Madley no option but to award a penalty, which Saka stroked home.The lead was swiftly doubled two minutes later when Ben White’s crossfield pass picked out Jesus on the left touchline, who then found Granit Xhaka. After edging his way into the box, his low cross was parried by Bono into the path of the onrushing Jesus, who had the simple task of tucking the chance away.And after giving the majority of supporters their first glimpse of his famous telephone celebration in Arsenal colours, he was at it again two minutes later. Again the threat came down the left but this time through Gabriel Martinelli, and with the Sevilla defence sleeping, a teasing cross allowed Jesus to race in behind and dispatch the delivery into the net.Sevilla had completely lost their heads, and that was typified by our fourth goal. A routine pass back to Bono saw the goalkeeper fluff a weak clearance straight to Saka, whose first-time effort trickled through the shot-stopper’s legs to cap off an incredible start.Glee was spreading around the stadium, and none more so than on the pitch, with Arteta’s team producing plenty of slick passing and looking threatening every time they entered the final third.During a couple of rare forays forward for the visitors in the first half, Youssef En-Nesyri flashed a shot just wide before heading straight at Aaron Ramsdale - a feat Thomas Partey repeated following a corner, before a remarkable half ended with Bono clawing back some redemption by making a double save to deny both Jesus and Odegaard, and then denying Martinelli one-on-one.It was a much tighter affair immediately after the break, with Rekik heading a corner just wide 10 minutes after the restart, but we were working through the gears again and after Jesus dragged an attempt from 25 yards wide, Oleksandr Zinchenko picked out Odegaard in the box but he blasted over.Midway through the second half there was almost a delightful goal to cheer when Partey chipped a ball over the backline for Xhaka, and his side-footed volley narrowly missed the top corner, but on 77 minutes the long wait for another goal ended.A Martinelli corner caused havoc as Gabriel forced Bono into a close-range save, but Jesus was on hand to drive home the rebound, complete his treble and register his seventh goal in just five pre-season outings.White almost put the cap on the result when a clever free-kick routine saw him attempt to lob Bono but it drifted wide, but in the final minute a sixth was added when Xhaka showed good skill to play in Martinelli, and after carrying the ball 40 yards the Brazilian unselfishly squared to Nketiah to complete the rout.The final whistle was greeted with rapturous applause by those in attendance, who stayed to watch Odegaard get his hands on the Emirates Cup trophy to mark our sixth triumph in the competition’s history.Enjoy match highlights, training and behind the scenes to get closer to the likes of Bukayo Saka, Emile Smith Rowe, Gabriel Jesus, Vivianne Miedema, Nicolas Pepe, Leah Williamson, Bernd Leno, Nikita Parris, Mana Iwabuchi, Jordan Nobbs, Takehiro Tomiyasu, Kim Little, Gabriel Martinelli, Aaron Ramsdale, Beth Mead, Ben White, Thomas Partey and more.Subscribe to the Official Arsenal YouTube Channel: https://arsn.al/youtubeFollow us on Facebook: https://arsn.al/facebookFollow us on Twitter: https://arsn.al/twitterFollow us on Instagram: https://arsn.al/instagramFollow us on TikTok: https://arsn.al/tiktok"
"WkDqWKKiH0o","OFFLINETV TRIES A HIGH ROPES COURSE","2022-07-30T20:01:40Z","UCDK9qD5DAQML-pzrtA7A4oA","OfflineTV","20","22.01.08","OfflineTV|Scarra|Poki|Pokimane|Lily|LilyPichu|DisguisedToast|Toast|TwitchTV|twitch|Streaming|Vlog|Fail|Epic|Gamers|Streamers|OTV|OTV Plays|OfflineTV plays|Michael Reeves|Michael|Reeves|offlinetv high ropes|tightrope|high ropes|ropes course|high ropes course|high rope course|offlinetv ropes course|otv ropes course|otv ropes|michael reeves spider monkey","1278908","0","0","2988","https://i.ytimg.com/vi/WkDqWKKiH0o/default.jpg","False","True","It was literally 120° out 🔥Level up your tech accessories with CASETiFY - Go to https://www.casetify.com/offlinetv today to get 15% off your order! Thanks to Casetify for sponsoring this video!---------------------------------------------------------------👕 Merch & Apparel:• OfflineTV - https://offlinetv.com📸 Follow OfflineTV:• Twitter - https://www.twitter.com/OfflineTV• Instagram - https://www.instagram.com/OfflineTV• TikTok - https://www.tiktok.com/@offlinetv• Reddit - https://www.reddit.com/r/offlineTV📝 OfflineTV Roster:• Scarra - https://twitter.com/scarra• Pokimane - https://twitter.com/pokimanelol• LilyPichu - https://twitter.com/LilyPichu• Disguised Toast - https://twitter.com/DisguisedToast• Michael Reeves - https://twitter.com/michaelreeves• QuarterJade - https://twitter.com/QuarterJade• Masayoshi - https://twitter.com/ItzMasayoshi• Sydeon - https://twitter.com/Sydeon• Yvonnie - https://twitter.com/yvonnie🎥 Producer & Director:• Brodin - https://twitter.com/brodinplett🎞️ Edited by: • Dunois - https://twitter.com/DunoisKR#OfflineTV #Challenge #Subscribe"
"Rfr8FdKyNK4","« les chiens aboient, la caravane passe »","2022-07-31T17:22:21Z","UCDkl5M0WVaddTWE4rr2cSeA","Lena Situations","19","22.01.08","[none]","894699","0","0","9755","https://i.ytimg.com/vi/Rfr8FdKyNK4/default.jpg","False","True","avant de revenir sur youtube et de commencer la saison six des vlogs d’août j’avais besoin et envie de vous parler. ☺️"
"-capZjxVKiM","Dream - MrBeast $1,000,000 Challenge (Extra Scenes)","2022-07-30T10:09:36Z","UChU3JRloULzdFX3aCu7BiSA","DreamXD","22","22.01.08","[none]","1067512","0","0","5411","https://i.ytimg.com/vi/-capZjxVKiM/default.jpg","False","True","This is extra scenes from Dream's channel of the Minecraft Speedrunner VS Mr Beast $1,000,000 Challenge video. Free $15 with Code DREAMYT download cashapp now: http://cash.app/13+Original Video: https://www.youtube.com/watch?v=wwkH0prchjQThis video was crazy fun and intense. Definitely one of the hardest challenges.Minecraft challenge videos are fun to do :)"
"Lvjgni3giDc","Sultaan - Husan De Charche","2022-07-31T03:30:12Z","UCxn67ixCm0QFLoEtDibrPKQ","SULTAAN","10","22.01.08","Sultaan|Sultan Dhillon|Sultaan dhillon|Sultan|beeba boys|og ghuman","307902","0","0","2578","https://i.ytimg.com/vi/Lvjgni3giDc/default.jpg","False","True","Sultaan Inc. presents Husan De Charche Official Music VideoTrack - Husan De CharcheArtist - SultaanMusic - Banks On The BeatMix Master - SoundProofDirector - Prince KaoniAssistant Director - Mandip RupanaDop - Nishan singhFemale Lead - Yashika AnandMake Up - Kashish ArtProduction - Gurpahul Choreographer - Sahil Masih Art Production - Karma ArtEquipment - Binni FilmsFocus - Gurwinder KambojArtwork - SamanProject - Beeba Boys#Sultaan #NewPunjabiSong2022All Rights Reserved. © Sultaan Inc."
